pmid,pmcid,title,journal,insert_time
22529803,PMC3331883,Cutaneous lymphadenoma: a case report and immunohistochemical study.,Case Rep Dermatol,2023-12-17-22-03-22
25002949,PMC4083669,Cutaneous lymphadenoma: a rare case and brief review of a diagnostic pitfall.,Rare Tumors,2023-12-17-22-03-22
33777457,PMC7969119,Cutaneous Lymphadenoma: A Case of Recurrence after Shave Excision.,Case Rep Dermatol Med,2023-12-17-22-03-22
34232601,PMC8428866,"Cutaneous Lymphadenoma Is a Distinct Trichoblastoma-like Lymphoepithelial Tumor With Diffuse Androgen Receptor Immunoreactivity, Notch1 Ligand in Reed-Sternberg-like Cells, and Common EGFR Somatic Mutations.",Am J Surg Pathol,2023-12-17-22-03-22
35928583,PMC9343981,Cutaneous lymphadenoma in a young Saudi female: a case report.,AME Case Rep,2023-12-17-22-03-22
36860584,PMC9969865,Cutaneous Lymphadenoma: A Case Report and Literature Review.,Clin Cosmet Investig Dermatol,2023-12-17-22-03-22
