pmcid,label,caption,graphic,disease,modality
PMC9361620,Fig. 2,"A Chest enhanced computed tomography showed filling defects in the right pulmonary artery (red arrow). B Chest enhanced computed tomography showed a nodule (1.4 cm × 0.9 cm) in the left inferior lobe basal segment (red arrow). C, D Enhanced MRI examination of the head showed pituitary stalk thickening in the sagittal (C) and coronal sections (D) (red arrow). E Pancreatic enhanced magnetic resonance imaging (MRI) showed swelling of the pancreatic tail (red arrow). F MR cholangiopancreatography showed local stricture of the pancreatic duct section of common bile duct (red arrow). G The positron emission tomography-computed tomography showed a nodule (2.3 cm × 1.5 cm) in the left inferior lobe with hypermetabolism (red arrow). H Histopathological examination of the left lung nodule: lung squamous carcinoma. Microscope type: ZEISS Microscope Model AXIO Lab A1, ZEISS camera Model Axiocam ICc 5 and ZEN software at a resolution of 144dpi and processed in adobe photoshop 21.0.2 at a resolution of 300 dpi. No downstream processing was utilized",12890_2022_2094_Fig2_HTML,NotMatch,NotMatch
PMC9361620,Fig. 3,Timeline of the main clinical events,12890_2022_2094_Fig3_HTML,NotMatch,NotMatch
PMC9478222,Figure 1.,"Funduscopic examination showing negative findings in the right eye (A) and vascular tortuosity in the left eye (B). (C) Magnetic resonance imaging of the brain with axial T2 fluid-attenuated inversion recovery demonstrating soft tissue lesions with contrast enhancement and restricted diffusion involving bilateral eyelids, orbits, and intraconal region, which are more prominent on the left side (white arrow) than on the right side. The left optic nerve is encased by lesions (white asterisk). Staphyloma of the left globe is also observed (white arrowhead).",medi-101-e30750-g001,NotMatch,NotMatch
PMC9478222,Figure 2.,"Spectral-domain optical coherence tomography shows the optic nerve head and retinal nerve fiber layer sector average thickness maps of the left eye demonstrating thinning of the nasal-upper, superior-nasal, superior-temporal, and inferior-temporal parts (A). The ganglion cell complex thickness map of the left eye show nearly diffuse thinning (B). After 6 months of treatment, spectral-domain optical coherence tomography shows the optic nerve head and retinal nerve fiber layer sector average thickness maps of the left eye demonstrating in the normal range (C). The ganglion cell complex thickness map of the left eye shows thinning over the peri-foveal region (D); compared with (B), there is a reduction in the thinning area.",medi-101-e30750-g002,NotMatch,NotMatch
PMC9478222,Figure 3.,"Histologic features of the orbital mass. Hematoxylin and eosin staining shows hyperplastic lymphoid follicles with germinal centers (black arrowhead), an increase in vessels and inflammatory infiltrate within and around the lymphoid follicles (A, 20×; B, 100×; C, 200×), and abundant mononuclear and binuclear eosinophils (black arrow) infiltrating the interfollicular area (D, 400×).",medi-101-e30750-g003,NotMatch,NotMatch
PMC9238044,Fig. 1,Pigmentation left after red rashes fading on both lower limbs,13223_2022_683_Fig1_HTML,NotMatch,NotMatch
PMC9238044,Fig. 2,"Chest computed tomography (CT) examination: a, b Increased texture and a little emphysema in both lungs; multiple pneumatoceles (red arrows). c, d Thickening bronchial walls and mild bronchiectasis in the lower lobe of lungs (blue arrows)",13223_2022_683_Fig2_HTML,NotMatch,NotMatch
PMC9238044,Fig. 3,"Hematoxylin-and-eosin-stained sections of the right inguinal lymph node biopsy: a, b Complete lymph node structure, lymph node follicular hyperplasia, and germinal center enlargement. c, d A large number of eosinophil infiltration and eosinophil abscess in the follicular and interfollicular area",13223_2022_683_Fig3_HTML,NotMatch,NotMatch
PMC9238044,Fig. 4,a The change curve of peripheral eosinophils. b The change curve of and serum total IgE Level,13223_2022_683_Fig4_HTML,NotMatch,NotMatch
PMC9238044,Fig. 5,Chest CT scan: a Several enlarged lymph nodes could be seen in the left armpit in December 2018 (red arrow). b No enlarged lymph nodes found in the left armpit in August 2020,13223_2022_683_Fig5_HTML,NotMatch,NotMatch
PMC9537629,FIGURE 1,"Magnetic resonance imaging (MRI) showed abnormal soft tissue nodules around the iliac vessels in the left groin, T1WI sequence was isointense with muscle tissue (A,a) white arrow levels the plane of the greater trochanter, black arrow levels the plane of the femoral head), and T2WI was slightly hyperintense (B,b). Diffusion-weighted imaging showed obvious high signal (C,c), and contrast-enhanced scan showed obvious homogeneous enhancement (D).",fmed-09-1023804-g001,NotMatch,NotMatch
PMC9537629,FIGURE 2,"Fluoro18-labeled deoxyglucose positron emission tomography/computed tomography (18F-FDG PET/CT) of the patient, the maximum intensity projection [MIP, (A)] showed multiple mild to moderate radioactive uptake foci in the left inguinal region (white arrow levels the plane of the greater trochanter, black arrow levels the plane of the femoral head). The axial figures in the left inguinal region at the femoral head level [(B) CT; (C) PET; (D) PET/CT fusion] and greater trochanter level [(E) CT; (F) PET; (G) PET/CT fusion] showed soft tissue nodules with radioactive uptake, with SUVmax of 5.3 (black arrow) and 4.5 (white arrow), respectively.",fmed-09-1023804-g002,NotMatch,NotMatch
PMC9537629,FIGURE 3,Hematoxylin–eosin staining showed lymphocyte proliferation in the lesions with diffuse eosinophil infiltration [(A) 100 × magnification; (B) 400 × magnification arrows indicate eosinophilic microabscesses].,fmed-09-1023804-g003,NotMatch,NotMatch
PMC9794988,Figure 1,"Photographs of the bilateral anterior and posterior ears of the patient. Before the treatment (A, B), after 19 months of treatment with omalizumab (C, D), and after 16 weeks of treatment with dupilumab (E, F) (arrows indicate tumorous regions).",fimmu-13-1084879-g001,NotMatch,NotMatch
PMC9794988,Figure 2,"The anterior and posterior ears’ color Doppler ultrasound. The right anterior mass is in the size of 5.2×2.2 cm and has a heterogeneous hypoechoic–isoechoic appearance (right ear in front, right ear behind, and left ear in front); (A–C) before treatment; (D–F) after 16 weeks of treatment with dupilumab.",fimmu-13-1084879-g002,NotMatch,NotMatch
PMC9794988,Figure 3,"The pathological characteristics of ear masses. The gross view of pathological sections (A). In the cortical region, lymphoid tissue hyperplasia with numerous eosinophils infiltrating (B); hyperplasia of postcapillary venules with hyalinosis (C, D); the marked region with the rectangle in C shows hyaline blood vessels (Hematoxylin and Eosin staining).",fimmu-13-1084879-g003,NotMatch,NotMatch
PMC9794988,Figure 4,Time-course changes in the levels of eosinophil count and serum IgE (A); the change in mass volume in each region during treatment (B).,fimmu-13-1084879-g004,NotMatch,NotMatch
PMC9816637,Fig. 1,"Histopathological image of a cheek mass from a 33-year-old man with Kimura disease. Lymphoid hyperplasia with massive eosinophil infiltration (hematoxylin and eosin stain, ×200).",acfs-2022-01053f1,Match,NotMatch
PMC9816637,Fig. 2,Enhanced computed tomography shows ill-defined enlarged subcutaneous masses with hyperattenuated lymph nodes. (A) Axial view. (B) Coronal view.,acfs-2022-01053f2,NotMatch,NotMatch
PMC9740894,Figure 1,"Pathological manifestations based on hematoxylin–eosin and immunohistological staining of the specimen obtained from Case 1. (A) Florid follicular hyperplasia, 5×. (B) Small vessel infiltration with fibrosis, 20×. (C) Stromal fibrosis, 40×. (D) Periventricular sclerosis, 40×. (E) Eosinophilic infiltration with eosinophilic abscess formation, 40×. (F) Immunohistological staining showed >50 IgG4(+) cells per high-power field. (G) Immunohistological staining showed IgG(+) cells.",jcm-11-06887-g001a,NotMatch,NotMatch
PMC9740894,Figure 2,"High-resolution computed tomography with head and upper neck enhancement in Case 2. The image revealed subcutaneous nodular lesions (arrows) in the bilateral postauricular region (dimensions, right: 15 mm × 7 mm; left: 17 mm × 12 mm) with relatively ill-defined margin and increased stranding of adjacent subcutaneous fat.",jcm-11-06887-g002,NotMatch,NotMatch
PMC9740894,Figure 3,"Pathological features with hematoxylin-eosin stain and immunohistology stain of the specimen from Case 2. (A) Foci of fibrosis, fibroadipose tissue, and salivary gland tissue with scattered lymphoid follicles containing germinal centers, 2×. (B) Small blood vessel infiltration. (C) Dense infiltration of small lymphocytes, plasma cells, and eosinophils, 60×. (D) Immunohistology stain showed IgG4-positive cells, more than 100 cells per high-power field (E) Immunohistology stain showed IgG-positive cells, percentage of IgG4-positive/IgG-positive cells was more than 40%.",jcm-11-06887-g003a,NotMatch,NotMatch
PMC9880338,Fig 1,,gr1,Empty,Empty
PMC9880338,Fig 2,,gr2,Empty,Empty
PMC9880338,Fig 3,,gr3,Empty,Empty
PMC9946802,Figure 1,"Computed tomography images. (A) swollen lymph nodes in the retroperitoneum (red arrow). (B) Swollen lymph node in right armpit (red circle). Swollen lymph nodes in the mediastinum (blue triangle). (C) Magnification ×20. Lymphoid follicular hyperplasia. (D) Magnification ×100 high endothelial venules with angiogenesis, infiltration of plasma cells and eosinophils, and localized fibrosis.",JIR-16-701-g0001,NotMatch,Match
PMC9826584,Fig. 1,"Computed tomography scan, coronal view: well-defined nodule with heterogeneous enhancement and multiple cystic spaces in the left parotid gland",13256_2022_3729_Fig1_HTML,NotMatch,NotMatch
PMC9826584,Fig. 2,The gross specimen consisted of a tan-brown solid mass with a well-circumscribed border and cystic spaces,13256_2022_3729_Fig2_HTML,NotMatch,NotMatch
PMC9826584,Fig. 3,"A The mass consisted of two main components: multiple papillary growths and cystic spaces with bright eosinophilic cells within lymphoid tissues (left) and extensively fibrotic tissue with multiple vaguely formed lymphoid follicles (right). (H&E, original magnification ×20). B The first component consisted of multiple papillary cystic spaces lined by oncocytic epithelium with diffuse lymphocytic infiltrate with lymphoid follicle in the stroma. (H&E, original magnification ×40) (Inset: the cystic lining is bilayer of luminal columnar cells and abluminal cuboidal cells; both cells have granular eosinophilic cytoplasm. (H&E, original magnification ×200). C The second component of the mass showed diffuse sclerotic fibrosis with scattered lymphoid follicles exhibiting folliculolysis, and inflammatory infiltrate. (H&E, original magnification ×40). D A prominent eosinophilic infiltrate was present within the sclerotic stroma and between the lymphoid follicles, which were admixed with lymphocytes and histiocytes. (H&E, original magnification ×100). E The lymphoid follicles showed follicular hyperplasia with mantle zone preservation with proteinaceous deposits and perivascular fibrosis. (H&E, original magnification ×200)",13256_2022_3729_Fig3_HTML,NotMatch,Match
PMC9981570,FIGURE 1,Pathology images of the excisional biopsy revealed lymph nodes with reactive follicles and prominent germinal centers.,CCR3-11-e7031-g001,NotMatch,NotMatch
PMC9982731,Figure 1,(A) Hyperplasia of lymphoid follicular tissue in lymph nodes. (B) Reactive germinal center with the obvious well-formed mantle area.,fped-11-1131963-g001,NotMatch,NotMatch
PMC8006622,Figure 1,"Enlarged left axillary lymph nodes, approximately 3 × 5 cm (A). Severe oedema of both lower limbs (B).",EHF2-8-1620-g002,NotMatch,NotMatch
PMC8006622,Figure 2,"Electrocardiogram on admission: sinus tachycardia, atrial extrasystole, ventricular extrasystole, limb lead depression, and ST‐T changes.",EHF2-8-1620-g001,NotMatch,NotMatch
PMC8006622,Figure 3,"TTE: giant space‐occupying mass in the right ventricle (A), the mass occupied approximately 80–90% of the right ventricle chamber and invaded the right atrium, affecting right cardiac reflux and causing massive pericardial effusion (B). Myocardial contrast echocardiography and left ventricular opacification (LVO) revealed a loose space‐occupying lesion with high blood flow (C,D).",EHF2-8-1620-g004,NotMatch,NotMatch
PMC8006622,Figure 4,"Cardiovascular magnetic resonance imaging: plain scan revealed a 6.2 × 12 × 9.8 cm phyllodes mass with regular edges in right ventricle anterior wall, the mass protruded into the heart chamber and invaded into the right atrium (A,B). However, gadolinium‐enhanced scan was not performed. For the four‐chamber view, uniform but slightly higher than normal signals were found on fat‐saturated T1‐weighted and T2‐weighted images (C,D).",EHF2-8-1620-g007,NotMatch,NotMatch
PMC8006622,Figure 5,"Pericardial effusion (A): pathological examination of paraffin‐embedded pericardial effusion samples found adenoid or small clusters of epithelioid cells and redundant small round atypical cells with less cytoplasm and visible nuclei (B, HE, ×200). Immunohistochemical examination showed epithelioid cells CK (+), CK7 (+), CR (+), MC partially (+), CD68 (+), TTF‐1 (−), mesothelial cells, and diffusely distributed atypical cells CK (−), CD20 (+), CD3 (−), CD138 (−), Ki‐67 ~ 10% (+) (C, ×200).",EHF2-8-1620-g003,NotMatch,NotMatch
PMC8006622,Figure 6,"Positron‐emission tomography/computed tomography: multiple enlarged lymph nodes in the left axilla, mediastinum, and celiac mesentery, and they were of high signal on positron‐emission tomography (A). Mass in the right heart (B).",EHF2-8-1620-g005,NotMatch,NotMatch
PMC8006622,Figure 7,"Pathological biopsy of nasal cavity mass: redundant fat fusiform histiocytes, small lymphocytes, and scattered or aggregated atypical cells, which were medium‐sized with large and round deep‐stained nuclei; in some cells, nucleoli and mitosis were visible without necrosis (A,B. HE, A, ×100; B, ×400). Immunohistochemistry: CD3 (+ mainly small lymphocytes) (C, ×400), CD79a (+) (D, ×400).",EHF2-8-1620-g006,NotMatch,Match
PMC10152615,Figure 1,A) High number of eosinophils without morphological abnormalities observed in the peripheral blood review. Staining with May Grünwald-Giemsa. Images obtained in CellaVision DM96 (1000x). B) Evolution of eosinophil count in peripheral blood during 2017-2020. C) Evolution of serum IgE concentration during 2017-2019.,bm-33-2-020801-f1,NotMatch,NotMatch
PMC10152615,Figure 2,Diagnosis of patients with severe eosinophilia (above 5 x109/L): non-malignant diseases (in black) and solid neoplasia and haematological diseases (in grey). CML - chronic myeloid leukaemia. CSS - Churg-Strauss syndrome. EGE - eosinophilic gastroenteritis. KD - Kimura disease. LN - lymphoid neoplasm.,bm-33-2-020801-f2,Match,NotMatch
PMC10030818,Fig. 1,"Radiological images of a parotid gland nodule in a young woman with Kimura disease. (A–B) Magnetic resonance images show that the mass has isointensity on a T1-weighted image (A, arrow) and hyperintensity on a T2-weighted image (B, arrow). (C) A fluid-attenuated inversion-recovery image shows an isointense nodule (arrow) with a small low-intensity lesion (arrowhead), which corresponds to a round hyperintense lesion (B, arrowhead) in the nodule on the T2-weighted image. (D–E) Computed tomography images show the nodule is isodense on precontrast imaging (D, arrow) and demonstrates mild heterogeneous enhancement on post-contrast imaging (E, arrow). (F) Ultrasonography performed just before the excisional biopsy demonstrates that the nodule (arrow) is oval and homogeneously hypoechoic. The lengths of the scale bars are shown in the photos. MRI T1 (T2) WI: magnetic resonance imaging T1 (T2) weighted image, FLAIR: fluid-attenuated inversion-recovery, CT: computed tomography, CE CT: contrast-enhanced CT, US: ultrasonography.",gr1,Match,NotMatch
PMC10030818,Fig. 2,"Histological and immunohistochemical images of a parotid gland mass in a young woman with Kimura disease. (A) An inflamed tissue with lymphoid follicles (arrows), squamous nests (dots), and a cystic lesion (star) is seen. (B) A high-magnification photo shows that the main inflammatory cells are lymphocytes and eosinophils (arrows in the inset image). (C–D) Squamous nests (dots) and a squamous cyst (star) are embedded in the inflamed stroma. No atypia is seen in the epithelium (D). (E) Serous glands (arrows) suggestive of parotid gland tissue are present at the periphery of the lesion. (F) Immunohistochemistry using anti-immunoglobulin E antibodies shows positive germinal centers (arrows) and many scattered positive cells (some are indicated by arrowheads) in the inflamed lesion. A reticular pattern of immunoglobulin E staining in germinal centers is seen in the magnified photo (inset). Stars indicate squamous cysts. A–E: hematoxylin and eosin staining. The lengths of the scale bars are shown in the photos.",gr2,Match,NotMatch
PMC10270775,Fig. 1,"Clinical and histopathologic findings of the patient. (A) Clinical photograph of the patient at the initial visit. Firm oval shaped palpable masses sized 1.0 × 2.5 cm arising from the medial canthus and continuing to the tear trough in both eyes were observed. (B) Clinical photograph after prednisolone treatment. The palpable masses at the medial canthus and tear trough in both eyes were improved. (C) Coronal view of magnetic resonance image. T1-weighted gadolinium-enhanced fat suppression image revealed enhancement of both lacrimal sacs. (D) Axial view of magnetic resonance image. T1-weighted gadolinium-enhanced fat suppression image showed enhanced nasolacrimal duct and soft tissue at the tear trough region in both eyes. (E) Microscopic finding of the specimen with a low-power view. Mixed inflammation with abundant eosinophils was seen in the background of lymphoid follicles and stromal fibrosis (hematoxylin-eosin, ×100). (F) Microscopic finding of the specimen with higher magnification. Marked eosinophils were infiltrated with polymorphous population of lymphocytes and plasma cells (hematoxylin-eosin, ×400). (G) Immunoglobulin G (IgG) immunohistochemical staining (×200). (H) IgG4 immunohistochemical staining (×200). High IgG4/IgG ratio (>40%) and high IgG4 plasma cell counts (63 cells/high power field) was shown. Informed consent for publication of the clinical photograph was obtained from the patient.",kjo-2023-0013f1,NotMatch,Match
PMC10289553,Figure 1,"Specimen shows fibrous stromal tissue densely infiltrated by neutrophils, lymphocytes, histiocytes, plasma cells, and eosinophils.",ms9-85-3079-g001,NotMatch,NotMatch
PMC10259547,Figure 1,Rashes and cervical lymphadenopathy at the time of presentation (Pre-treatment),JFMPC-12-788-g001,NotMatch,NotMatch
PMC10259547,Figure 2,Histopathological Examination. (i) 40× magnification. (a) Increased eosinophils admixed with inflammatory cells (lymphocytes and occasional histiocytes). (b) There is also the prominence of plump endothelial cells. (ii) 20× magnification. Image showing preserved nodal architecture,JFMPC-12-788-g002,NotMatch,NotMatch
PMC10259547,Figure 3,Post-treatment resolution of rashes,JFMPC-12-788-g003,NotMatch,NotMatch
