pmid,pmcid,title,journal,insert_time,has_targz,disease
36794737,PMC10550599,Intracranial solitary fibrous tumor with delayed symptomatic metastasis to the lumbar spine: illustrative case.,J Neurosurg Case Lessons,2023-12-17-22-16-10,False,NotMatch
36820605,PMC9907904,Hepatic metastasis from a meningeal Hemangiopericytoma: A case report: Erratum.,Medicine (Baltimore),2023-12-17-22-16-10,True,Match
36826099,PMC9955746,Solitary Fibrous Tumors of the Lung: A Clinicopathological Analysis of 52 Cases.,Curr Oncol,2023-12-17-22-16-10,True,NotMatch
37033241,PMC10081489,Sphenoid sinus is a rare site for tumor-induced osteomalacia: A case report and literature review.,Front Endocrinol (Lausanne),2023-12-17-22-16-10,True,NotMatch
37090942,PMC10121372,High-Grade Ectopic Pituitary Adenoma within the Cerebellopontine Angle: A Case Report.,J Neurol Surg Rep,2023-12-17-22-16-10,True,NotMatch
37128618,PMC10148174,Hemangiopericytoma of the central nervous system: a case report.,Pan Afr Med J,2023-12-17-22-16-10,True,Match
37267430,PMC10655548,Malignancies in Prader-Willi Syndrome: Results From a Large International Cohort and Literature Review.,J Clin Endocrinol Metab,2023-12-17-22-16-10,False,NotMatch
37284225,PMC10240854,Sinonasal hemangiopericytoma: A rare sinonasal tumor.,SAGE Open Med Case Rep,2023-12-17-22-16-10,True,Match
37492853,PMC10363678,A rare case of intracranial solitary fibrous tumor that is still alive after multiple surgical resections: a case report and review of the literature.,Front Neurol,2023-12-17-22-16-10,True,NotMatch
37501902,PMC10370977,Angioarchitecture and Pre-Surgical Embolization of Central Nervous System Solitary Fibrous Tumor/Hemangiopericytoma.,J Neuroendovasc Ther,2023-12-17-22-16-10,True,Match
37520395,PMC10372045,Combined treatments with microballoon catheters and multiple cryoablation probes for shoulder-subclavian soft tissue hemangiopericytoma: A case report.,Radiol Case Rep,2023-12-17-22-16-10,True,Match
37554166,PMC10405728,A pregnant woman with a giant bilateral parietal hemangiopericytoma underwent multiple surgeries and radiotherapy: a case report and literature review.,Front Oncol,2023-12-17-22-16-10,True,Match
37636140,PMC10447192,Separation Surgery and Adjuvant Carbon Ion Radiotherapy for a Recurrent Solitary Fibrous Tumor/Hemangiopericytoma: A Case Report.,Spine Surg Relat Res,2023-12-17-22-16-10,True,Match
37711282,PMC10499534,Complete Resection of a Torcular Herophili Hemangiopericytoma without Sinus Reconstruction: A Case Report and Review of the Literature.,Case Rep Surg,2023-12-17-22-16-10,True,Match
37779748,PMC10533948,Recurrent Solitary Fibrous Tumor in a 73-Year-Old Male Presenting With Small Bowel Obstruction: A Case Report.,Cureus,2023-12-17-22-16-10,False,NotMatch
37908275,PMC10578418,Hypoglycemia From Metastatic Meningeal Solitary Fibrous Tumor Occurring Over Two Decades After Initial Diagnosis.,JCEM Case Rep,2023-12-17-22-16-10,False,NotMatch
37909001,PMC10580471,Three Cases of Non-islet Cell Tumor Hypoglycemia Highlighting Efficacy of Glucocorticoid Treatment.,JCEM Case Rep,2023-12-17-22-16-10,False,NotMatch
38046974,PMC10693355,Ga68-FAPI Imaging and Lu177-FAPI Therapy in a Case of Metastatic Solitary Fibrous Tumor.,Indian J Nucl Med,2023-12-17-22-16-10,False,NotMatch
38059253,PMC10696358,Delayed cervical spine metastasis from intracranial solitary fibrous tumor.,J Neurosci Rural Pract,2023-12-17-22-16-10,False,NotMatch
7848576,PMC3054097,Oncogenic osteomalacia: a clinicopathologic study of 17 bone lesions.,J Korean Med Sci,2023-12-17-22-16-10,True,NotMatch
8878806,PMC3054093,Hemangiopericytoma of renal sinus expanding to the renal hilum: an unusual presentation causes misinterpretation as transitional cell carcinoma.,J Korean Med Sci,2023-12-17-22-16-10,True,Match
