pmcid,label,caption,graphic,disease,modality
PMC5708669,Fig 5,"Distribution of alterations in the PIK3CA gene.(A) The table shows the distribution of PIK3CA mutations in our cohort of canine HSA cases, the corresponding human amino acid change, and the functional impacts of the mutants based on previous human studies. ""GOF"" denotes gain-of-function. (B) Schematic diagram of homologous mutations in human PIK3CA. The x axis represents amino acid positions and domain structure of human PIK3CA, and the y axis represents the number of times each mutation observed in our cohort.",pone.0188667.g005,NotMatch,NotMatch
PMC5708669,Fig 6,"Summary of somatic mutations in HSA cases lacking strong driver mutation candidates.Green blocks denote missense mutations. Shown in black are predicted loss-of-function mutations (essential splice-site variants, nonsense mutations, and frameshift indels).",pone.0188667.g006,NotMatch,NotMatch
PMC5708669,Fig 7,"Distribution of alterations in the TP53 gene.(A) Table shows the distribution of TP53 mutations in our cohort, the mutation types, the corresponding human amino acid change, and the predicted functional impact of each mutation based on previous studies. (B) Schematic diagram of homologue mutations in human TP53. The x axis represents amino acid positions and domain structure of human TP53, and the y axis represents the number of times each mutation was identified in our cohort.",pone.0188667.g007,NotMatch,NotMatch
PMC5800597,Fig 1,Study schema.Study schema showing cases included from 1989–2016 from an academic teaching hospital. GR = golden retriever dog.,pone.0192578.g001,NotMatch,NotMatch
PMC5800597,Fig 2,Golden retriever dogs seen and undergoing necropsy.Scatter plot showing in green circles the total number of golden retrievers per year undergoing necropsy exam and in red squares the total number of golden retrievers seen in the hospital per year. The solid line represents the percentage of golden retrievers undergoing necropsy divided by the total golden retriever animals seen that year.,pone.0192578.g002,NotMatch,NotMatch
PMC5800597,Fig 3,"Percent of golden retriever dogs dying of cancer and age of death over time.(A) Scatter plot with fitted regression line and 95% CI showing percent of golden retriever dogs undergoing necropsy exam that died from cancer by year. The results show a significant (P = 0.38, R2 = 0.16) but weak increase in the proportion of dogs with a cancer diagnosis over time. (B) Scatter plot with fitted regression line and 95% CI showing age of golden retriever dogs presenting for necropsy over time. The results show a significant but week increase in age over time (P = 0.01, R2 = 0.009).",pone.0192578.g003,NotMatch,NotMatch
PMC5800597,Fig 4,Age distribution of golden retriever dogs.(A) Histogram of age for all golden retriever dogs undergoing a necropsy exam with a median age of 9.15 years. (B) Histogram of ages of all golden retriever dogs undergoing a necropsy exam categorized by having a death attributable to cancer or not with a median age of death for those dogs dying of non-cancerous cause of 6.87 years and a median age of death of 9.83 years for those dogs with a cancer attributable death.,pone.0192578.g004,NotMatch,NotMatch
PMC5800597,Fig 5,"Age of golden retrievers broken out by sex and cause of death.Box and whisker plot showing median age, interquartile range, adjacent values and outliers of golden retriever dogs who underwent a necropsy exam and an attributable or non-attributable death from cancer categorized by sex and spay or neuter status. P values are shown for differences between cancer and non-cancer attributed deaths within each sex category and for differences between sex category within the cancer and non-cancer attributed death groups. NCAD = non-cancer attributable death, CAD = Cancer attributable death.",pone.0192578.g005,NotMatch,NotMatch
PMC5800597,Fig 6,"Histologic types of cancer diagnosed by sex.Bar graph showing frequency of tumor type leading to death in golden retriever dogs categorized by sex and spay or neuter status. M = intact male, MC = castrated male, F = Intact female, FS = spayed female.",pone.0192578.g006,NotMatch,NotMatch
PMC5962627,Fig. 1,"Mouse skeletal muscle VEC gene activation expression. Circle: control, triangle: low dose, square: high dose. Each dot represents the gene signature of 1 animal. **p < 0.01; ****p < 0.0001 (homoscedastic t test). Dotted line represents the average of control values normalized to 1 from which fold changes were calculated for all individual animals. a Mouse skeletal muscle vascular endothelial cell activation signature time course. b Mouse skeletal muscle mitosis signature time course",204_2018_2189_Fig1_HTML,NotMatch,NotMatch
PMC5962627,Fig. 2,"Rat skeletal muscle gene expression. Circle: control, square: high dose. Each dot represents the gene signature of 1 animal. ****p < 0.0001 (homoscedastic t test). a Rat skeletal muscle vascular endothelial cell activation signature time course. b Rat skeletal muscle mitosis signature time course. Each dot represents endothelial vascular cell activation gene signature",204_2018_2189_Fig2_HTML,NotMatch,NotMatch
PMC5962627,Fig. 3,"Mouse Placental Growth Factor 2 (PLGF2). Circle: control, triangle: low dose, square: high dose. Each dot represents terminal plasma value of 1 animal. The 2 circled points highlight the 2 mice bearing HSA. **p < 0.01; ****p < 0.0001 (homoscedastic t test). Bar = Mean; error bar = 1 standard deviation",204_2018_2189_Fig3_HTML,NotMatch,NotMatch
PMC5962627,Fig. 4,"Rat Placental Growth Factor 2 (PLGF2). Circle: control, square: high dose. Bar = mean; error bar = 1 standard deviation. Horizontal-dotted line: LLoQ. Each dot represents terminal plasma value of 1 animal in part A, and same animals intermediate sampling values through time in part B. a PLGF2 terminal samples analyzed by Luminex multiplexed kit. b PLGF2 kinetics samples analyzed by ELISA",204_2018_2189_Fig4_HTML,NotMatch,NotMatch
PMC5962627,Fig. 5,Siponimod-treated mouse skeletal muscle VECs. Assessment of cell proliferation and PLGF2 release of mouse muscle VECs treated with Siponimod expressed as percentage of control untreated cells (solid symbols: average of three independent experiments with triplicate points within each experiment; open symbols: single experiment with triplicate points within each experiment),204_2018_2189_Fig5_HTML,NotMatch,NotMatch
PMC5962627,Fig. 6,Siponimod-treated rat pulmonary (a) and aortic VECs (b). Assessment of cell proliferation and PLGF2 release of rat pulmonary (a) and aortic (b) VECs treated with Siponimod expressed as percentage of control untreated cells (average of two independent experiments with triplicate points within each experiment),204_2018_2189_Fig6_HTML,NotMatch,NotMatch
PMC5962627,Fig. 7,Siponimod-treated human dermal and pulmonary VECs. Assessment of cell proliferation and PLGF2 release of human dermal (a) and pulmonary (b) VECs treated with Siponimod expressed as percentage of control untreated cells (average of three (pulmonary VECs) and two (dermal VECs) independent experiments with triplicate points within each experiment),204_2018_2189_Fig7_HTML,NotMatch,NotMatch
PMC5962627,Fig. 8,"Mouse versus rat Adverse Outcome Pathway plausible mechanism for HSA formation in the mouse. Although PLGF2 induction was observed earlier than the mitosis gene signature, it is unknown if one flows from the other, or if both independently arise from VEC activation. The fact that in the rat, PLGF2 induction outlasts mitosis would tend to advocate for two separate events",204_2018_2189_Fig8_HTML,NotMatch,NotMatch
PMC6005304,Figure 1,"Hematoxylin and eosin stain of intraocular hemangiosarcoma demonstrating neoplastic spindle cells lining blood-filled vascular channels. Arrows indicate neoplastic cells lining vascular, blood-filled channels.",CRIVEM2018-6160980.001,Match,NotMatch
PMC6005304,Figure 2,"Hematoxylin and eosin stain of splenic hemangiosarcoma. Neoplasm consists of erratic streams of neoplastic, endothelial-like, fusiform cells forming the linings of tortuous blood-filled channels and cavities supported by fibrous stroma.",CRIVEM2018-6160980.002,Match,NotMatch
PMC6005304,Figure 3,Positive immunohistochemical staining of the splenic tumor for CD31. Brown color indicates positive staining of neoplastic cells immunoreactive with a monoclonal mouse anti-human CD31 antibody.,CRIVEM2018-6160980.003,NotMatch,NotMatch
PMC5828302,Figure 1,Abdominal CT scan showing an enlarged spleen with its visible rupture (1) and bleeding outside the capsule.,CRIONM2018-8672407.001,NotMatch,NotMatch
PMC5828302,Figure 2,Abdominal CT scan performed before the surgery. Significant spleen enlargement is visible with distinctive area of parenchyma affected by the angiosarcoma.,CRIONM2018-8672407.002,Match,NotMatch
PMC5828302,Figure 3,"Microscopic view of angiosarcoma with hemorrhagic areas and vascular channels lined by endothelial atypical cells (hematoxylin and eosin staining, 100x).",CRIONM2018-8672407.003,Match,Match
PMC5828302,Figure 4,"Vascular capillaries of various sizes and cavernous-like spaces lined by endothelial cells with high-grade atypia (hematoxylin and eosin staining, 200x).",CRIONM2018-8672407.004,NotMatch,Match
PMC5828302,Figure 5,Immunohistochemical stain for CD34 highlights the malignant endothelial cells (200x).,CRIONM2018-8672407.005,NotMatch,Match
PMC5828302,Figure 6,The coronal scope (a) and axial scope (b) of radiotherapy plan and dose distribution illustrated by different isodoses.,CRIONM2018-8672407.006,NotMatch,NotMatch
PMC6143936,Figure 1,"Flowchart of the study population; BC, breast cancer; DCIS, ductal carcinoma in situ; RAS, radiation‐associated sarcoma; RT, radiotherapy",CAM4-7-4825-g001,NotMatch,NotMatch
PMC6143936,Figure 2,"Trends in RAS incidence and median latency; AS, angiosarcoma; BC, breast cancer; RAS, radiation‐associated angiosarcoma",CAM4-7-4825-g002,Match,NotMatch
PMC6198847,Figure 1,"58-year-old female with high-grade RIAS. Mediolateral oblique and
craniocaudal mammograms of the right breast (A and
B, respectively) showing an ill-defined
asymmetric lesion in the upper-outer quadrant, with skin
thickening and course calcifications.",rb-51-05-0281-g01,NotMatch,NotMatch
PMC6198847,Figure 2,"77-year-old female with intermediate-grade RIAS presenting as
nodules and ulcers. Mediolateral oblique mammograms of the left
breast showing hyperdense areas underlying scar tissue,
accompanied by a rounded, well-circumscribed mass that was not
visible in the previous examination, together with coarse
calcifications and skin thickening.",rb-51-05-0281-g02,NotMatch,NotMatch
PMC6198847,Figure 3,"82-year-old female with high-grade RIAS and extensive papules.
Gray-scale and color Doppler ultrasound of the left breast
(A and B, respectively), showing a
central superficial heterogeneous mass with some cystic areas
and increased blood flow.",rb-51-05-0281-g03,NotMatch,NotMatch
PMC6198847,Figure 4,"72-year-old female with high-grade RIAS, presenting with a nodule
with signs of inflammation. Ultrasound of the right breast,
showing multiple solid, rounded, well circumscribed masses with
heterogeneous echogenicity.",rb-51-05-0281-g04,NotMatch,NotMatch
PMC6198847,Figure 5,"58-year-old female with high-grade RIAS who presented with mild
skin discoloration. Axial sagittal gadolinium-enhanced
fat-suppressed T1-weighted MRI scan showing anomalous skin
enhancement on the left breast.",rb-51-05-0281-g05,NotMatch,NotMatch
PMC6198847,Figure 6,"81-year-old female with high-grade RIAS who presented with
extensive skin discoloration. Axial T1-weighted,
gadolinium-enhanced, fat-saturated MRI sequence after
subtraction (A) and axial diffusion-weighted (b =
1000) MRI sequence (B), both depicting retroareolar
lesions with early, avid enhancement and restricted diffusion,
highly suggestive of recurrence.",rb-51-05-0281-g06,NotMatch,NotMatch
PMC6198847,Figure 7,"59-year-old female with high-grade RIAS who presented with a
nodule and ulcers. Axial T2-weighted MRI sequence
(A) and axial T1-weighted, gadoliniumenhanced,
fat-saturated MRI sequence after subtraction (B),
both showing enhancement of the skin and subcutaneous tissue
down to the pectoralis fascia, without invasion of the
muscle.",rb-51-05-0281-g07,NotMatch,NotMatch
PMC6171240,Fig. 1,a Expression levels of undifferentiated endothelial cell-related genes in HSA cell lines cultured in normal or in SF conditions. Gene expression levels of each cell line in normal condition were set to 1. b The numbers of colonies of each cell line and condition. *p < 0.01. Student’s t test. All samples were analyzed in triplicates and the scores are presented as means ± SD,12917_2018_1624_Fig1_HTML,NotMatch,NotMatch
PMC6171240,Fig. 2,Survival rate of HSA cell lines treated with doxorubicin or paclitaxel. *p < 0.01. **p < 0.05. Student’s t test. All samples were analyzed in triplicates. Survival curves are plotted as average percentages ± SD,12917_2018_1624_Fig2_HTML,NotMatch,NotMatch
PMC6171240,Fig. 3,Flow cytometry analysis for ALDH activity. The percentages of ALDH positive cells are shown in each box. The bar graphs at the right end of each line indicate average percentages of ALDH+ cells with ±SD. The boxes were drown based on the result of negative control samples treated with DEAB,12917_2018_1624_Fig3_HTML,NotMatch,NotMatch
PMC6171240,Fig. 4,Gene expression levels of Notch receptors (a) and Notch target genes (b). *p < 0.01. **p < 0.05. Student’s t test. All samples were analyzed in triplicates and the scores are presented as means ± SD,12917_2018_1624_Fig4_HTML,NotMatch,NotMatch
PMC6171240,Fig. 5,a Relative growth rate of HSA cell lines cultured in normal or SF condition treated with DMSO or DAPT. *p < 0.01. **p < 0.05. Student’s t test. All samples were analyzed in triplicates and growth curves are presented as means ± SD. b Representative images of HSA cell lines in serum-free condition treated with DAPT or not. Bars = 100 μm,12917_2018_1624_Fig5_HTML,NotMatch,NotMatch
PMC6171240,Fig. 6,"a Western blot analysis using anti-human Notch2 antibody. HeLa cell line was used as a positive control. b Notch2 protein expression levels in HSA cell lines cultured under the normal or serum-free condition, c Conceptual diagram of Notch2 protein and its mutants. d Gene expression levels of Notch target genes. Vec = cells transfected the empty vector. FL = cells overexpressing full length of Notch2. Ex = cells overexpressing dominant negative form of Notch2. In = cells overexpressing constitutive active form of Notch2. Gene expression levels of Vec were set to 1. *p < 0.01. **p < 0.05. Dunnett’s test. Samples for gene expression analysis were analyzed in triplicates and the scores are presented as means ± SD",12917_2018_1624_Fig6_HTML,NotMatch,NotMatch
PMC6171240,Fig. 7,"a Colony numbers of HSA cell lines overexpressing Notch2 vector constructs. b (Top) Representative images of JuB2 and Ud6, 5 and 7 days after starting serum-free culture, respectively. Bars = 100 μm. (Bottom) Relative cell numbers of JuB2 and Ud6. Number of Vec was set to 1. *p < 0.01. **p < 0.05. Dunnett’s test. The scores are presented as means ± SD",12917_2018_1624_Fig7_HTML,NotMatch,NotMatch
PMC6171240,Fig. 8,Immunohistochemistry analysis for clinical HSA cases using anti-human Notch2 antibody. Insertion indicated the magnified views of tumor cells or normal endothelial cells. Arrows = neoplastic cells. Arrow heads = endothelial cells in normal blood vessels in the same slides. Asterisks = lymphocytes. Bars = 50 μm,12917_2018_1624_Fig8_HTML,NotMatch,NotMatch
PMC6047806,Fig 1,Chemical structure of VDC-597.,pone.0200634.g001,NotMatch,NotMatch
PMC6047806,Fig 2,"The dual PI3K/mTOR Inhibitor VDC-597 reduces downstream phosphorylation of Akt and 4eBP1 in canine hemangiosarcoma cells.DEN, CIN, and SB-HSA were incubated for 24 hours in standard conditions with either C/10 EMEM or C/10 EMEM with VDC-597 (range of concentrations for DEN-HSA, 1 uM for CIN- and SB-HSA), followed by protein extraction and western analysis. The addition of VDC-597 reduced downstream phosphorylation of both Akt and 4EBP1, as assessed by comparing the ratio of phospho-protein to total protein in each condition.",pone.0200634.g002,Match,NotMatch
PMC6047806,Fig 3,"(A)50% Inhibitory concentrations following a 72-hour exposure to VDC-597 in canine tumor cell lines. Canine tumor cells were incubated in C/10 EMEM or C/10 EMEM with various concentrations of VDC-597 for 72 hours, followed by determination of relative viable cell number using a bioreductive fluorometric assay. IC50s were calculated using nonlinear regression, and presented values indicate means from 3 separate experiments. (B). VDC-597 Dose-Dependently Inhibits the Growth of Canine Hemangiosarcoma Cells. Canine HSA cells were exposed to varying concentrations of VDC-597 followed by determination of relative viable cell number as above. Calculated IC50s were 0.23, 0.69 and 0.71 uM for CIN-, SB-, and DEN-HSA respectively. Results shown indicate means of 3 separate experiments. Error bars indicate standard error measurements.",pone.0200634.g003,Match,NotMatch
PMC6047806,Fig 4,"VDC-597 in combination with doxorubicin provides additive inhibitory effects on canine hemangiosarcoma cell growth.DEN, CIN, and SB-HSA cells were incubated in C/10 EMEM with varying concentrations of doxorubicin, or co-treated in C/10 EMEM with VDC-597 and doxorubicin for 72 hours followed by determination of relative viable cell number as above. Error bars indicate standard error measurements.",pone.0200634.g004,Match,NotMatch
PMC6047806,Fig 5,VDC-597 inhibits proliferation and induces apoptosis of canine hemangiosarcoma cells.NucLight Red-expressing SB-HSA cells were incubated for 72 hours with C/10 or C/10 with various concentrations of VDC-597 with the addition of YoYo-1 iodide reagent to label apoptotic cells. The number of viable (A) and number of apoptotic (B) cells per well were determined using an IncuCyte real-time videomicroscopy system. Area under the curve for each condition was calculated. Asterisks indicate P values less than 0.05. Error bars indicate standard error measurements.,pone.0200634.g005,Match,NotMatch
PMC6047806,Fig 6,VDC-597 inhibits canine hemangiosarcoma cell migration.A. DEN-HSA was plated in the top chamber of a specialized 96-well chemotaxis migration plate in either C/0.1 EMEM or C/0.1 EMEM with various concentrations of VDC-597. C/20 EMEM or C/20 EMEM with identical various concentrations of VDC-597 of the top chamber was placed in the bottom chamber. Migration of the cells through the micropore membrane was assessed using the Incucyte Live Cell Imaging System over 90 hours. Area under the curve for each condition is expressed. Asterisks indicate P values less than 0.05. B. DEN-HSA was plated and allowed to grow to confluency in a specialized 96-well scratch wound assay plate. A uniform defect (“scratch”) was made through the confluent layer of cells and mitomycin C-containing C/10 EMEM with various concentrations of VDC-597 was added. Relative wound density was assessed using the Incucyte Live Imaging System over 48 hours. Area under the curve for each condition is expressed. Asterisks indicate P values less than 0.05. Error bars indicate standard error measurements.,pone.0200634.g006,Match,NotMatch
PMC6047806,Fig 7,"VDC-597 inhibits VEGF production in canine hemangiosarcoma cells.DEN, CIN, and SB-HSA cells were incubated in C/10 EMEM with various concentrations of VDC-597. 24 hours later, supernatants were harvested and utilized in a canine VEGF-specific ELISA. Relative viable cell number was concurrently assessed and VEGF concentration normalized to cell number. Error bars represent standard error measurements. Asterisks indicate P values less than 0.05.",pone.0200634.g007,Match,NotMatch
PMC6760631,Fig. 1,"Characterization of canine dendritic cell populations. a Mature dendritic cells exhibited a characteristic morphology and expressed high levels of b CD80, c CD40, and CD11c (both b and c)",41417_2019_80_Fig1_HTML,NotMatch,NotMatch
PMC6760631,Fig. 2,"Median survival of animals treated by splenectomy plus chemo-immunotherapy. Differences in survival between treated animals and historical controls were determined by Kaplan–Meier survival analysis. Because study did not contain a parallel control arm, comparison of experimental values with historical controls was achieved by Monte–Carlo simulation assuming a Poisson distribution of hazard rates around a central value of 48 days, itself determined by analysis of 154 historical case controls. Historical control data were adapted from a figure originally published in Wendelburg et al. [11]",41417_2019_80_Fig2_HTML,NotMatch,NotMatch
PMC6760631,Fig. 3,Serial ultrasound imaging documents radiographic evidence of tumor regression. a Baseline image at day 0 indicates 6.8 cm mass. b Day 20 image indicates mass of 1.8 cm. c Day 30 image indicates mass of 1.0 cm with increased evidence of fibrosis. d Day 63 image no longer identifiable as a definitive mass,41417_2019_80_Fig3_HTML,NotMatch,NotMatch
PMC6760631,Fig. 4,Absence of hemangiosarcoma in select organ systems at necropsy. a Right cardiac lobe and part of diaphragmatic lobe of lung. Arrow indicates consolidation. b Kidneys: arrows point to age-related cortical pitting and depressions but no hemangiosarcoma was observed. c Liver: pale and tan noncancerous subcapsular foci were observed but no evidence of hemangiosarcoma,41417_2019_80_Fig4_HTML,Match,NotMatch
PMC6430957,Figure 1,"A, Transverse and B, sagittal contrast‐enhanced computed tomographic images of an 11‐years‐old neutered male cross‐breed dog with a hemangiosarcoma metastasis in the tongue muscle. The lesion appears round, heterogeneous, and with mild ring enhancement",JVIM-33-812-g001,Match,NotMatch
PMC6430957,Figure 2,Same dog as in Figure 1. Diffuse SMMs with varied enhancement patterns are visible,JVIM-33-812-g002,NotMatch,NotMatch
PMC6430957,Figure 3,"Computed tomographic study in an 8‐year‐old spayed female Labrador Retriever. The contrast enhanced study shows a ring‐enhancing lesion in the right epaxial muscle at the level of T11 (A). In the lungs, there is only 1 soft tissue nodule in the ventral part of the left caudal lung lobe (B). No other metastatic lesions were found in this patient",JVIM-33-812-g003,NotMatch,NotMatch
PMC6314605,Fig 1,"Gene transcription of PSMA across cell lines.(A) Validation of canine-specific TaqMan PSMA primer efficiency across 5-log orders of RNA concentration using CPA, a canine prostatic carcinoma cell line. (B) Comparative PSMA gene expression across canine cell lines. Relative PSMA expressions for six cHSA cell lines (red) compared to the non-malignant canine endothelial cell line, CAoEC (green). Positive and negative control cell lines include CPA (blue) and ACE-1 (purple), respectively. Representative data presented from 3 independent biologic replicates with 5 technical replicates for each cell line.",pone.0210297.g001,NotMatch,NotMatch
PMC6314605,Fig 2,"Antibody validation for canine PSMA protein expression.Validation of antibodies for detecting PSMA in human and canine cell lines by (A) confocal fluorescent microscopy, and (B) western blot analysis. Positive and negative controls for canine and human include (CPA and ACE-1) and (LNCaP and PC3), respectively.",pone.0210297.g002,NotMatch,NotMatch
PMC6314605,Fig 3,"Comparative PSMA protein expressions across cell lines.Comparison of PSMA protein expressions and associated histograms for six cHSA cell lines (red) relative to the non-malignant CAoEC line (green) by (A and B) western blot analysis, and (C and D) by confocal fluorescent microscopy. Canine positive and negative controls are CPA (blue) and ACE-1 (purple), respectively. Significance p < 0.05 and p < 0.01 denoted by “*” and “**”, respectively.",pone.0210297.g003,NotMatch,NotMatch
PMC6314605,Fig 4,"Characterization of PSMA in cHSA tumor samples.Spontaneously-arising cHSA tumor samples involving the spleen, liver, and lung tissues, with representative (A) histology by H&E and PSMA immunohistochemistry (Score 3; magnification 400x), and comparison (B) of staining properties for cHSA by CD31 and PSMA (magnification 100x).",pone.0210297.g004,NotMatch,Match
PMC6314605,Fig 5,"Optimization of qualitative PCR methodology and dynamic range of detection for PSMA.(A) Differential PSMA amplicon generation by qualitative PCR with the lowly expressing PSMA cHSA cell line (FITZ; red) compared with CAoEC (green) across different thermocycles ranging from 24 to 30. Determination of qualitative PCR sensitivity for detecting PSMA amplicons at 27 cycles with a logarithmic titration of (B) FITZ cells only or (C) when FITZ cells are spiked into whole blood. Lowest cell density capable that produces faintly visible amplicons is 104 FITZ cells, alone or in addition to whole blood nucleated cells. Amplicon production expressed as a ratio of PSMA/β actin pixels/area. Abbreviations FITZ (FZ; red) and CAoEC (CE; green).",pone.0210297.g005,NotMatch,NotMatch
