pmcid,label,caption,graphic,disease,modality
PMC7997418,Figure 3,"Boxplot representing overall lectin-histochemistry (DSA, WGA, SNA) and immunohistochemical (CD31, VTN, C7) signal intensities. Three tissue components—HSA/cancer, arterial endothelium, and venous endothelium—were assessed in two sample groups—dogs with HSA and dogs without HSA. Differences in the level of tissue glycoprotein expression between tissue components and between HSA and non-HSA were compared.",vetsci-08-00038-g003,NotMatch,NotMatch
PMC7997418,Figure 4,"Boxplots demonstrate the comparison of H-scores assessed from lectin-histochemistry (DSA, WGA, SNA) and immunohistochemical (CD31, VTN, C7) labelling of tissue samples. The statistical analysis was performed by comparing H-scores between tissue components—HSA/cancer cells, arterial endothelium (AE) and venous endothelium (VE). Significance bars show only p-values < 0.05 derived from Wilcoxon test and adjusted by Bonferroni corrections.",vetsci-08-00038-g004,NotMatch,NotMatch
PMC7997418,Figure 5,"Scatter plots of H-scores distribution, assessed from lectin-immunohistochemical labelling for complement C7 and VTN as well as DSA, WGA, and SNA. (A) Matrix scatter plots created for the candidate antibodies/lectins H-scores. The darker dots (dark brown) represent H-score assessed from the cancer component of HSA splenic tissue samples, while the lighter dots (light green) represent H-score assessed from the HSA-like lesion of non-HSA (hematoma and hemorrhage) splenic tissue samples. (B) Scatter plot of H-scores distribution assessed from lectin-immunohistochemical labelling with the anti-human complement C7 antibody and DSA lectin. The pair of reactants was selected from recursive partitioning results. Two cut-off points, complement C7 (H-score > 67.5) then DSA (H-score > 145), allow clear distinction between HSA and HSA-like tissues.",vetsci-08-00038-g005,NotMatch,NotMatch
PMC8109047,FIGURE 1,"Autopsy imaging‐computed tomographic images in case 1. (A) Two‐dimensional image at a level of the first rib; (B) Three‐dimensional image of the left‐side view; (C) Three‐dimensional image of the right‐side view; (D) Gross photograph of the left‐side view, (E) Gross photograph of the right‐side view. The left fractured rib dislocated the tracheal stenosis (A, arrow). There were cracked ribs with no bony callus in ninth to eleventh ribs (B, circles). Fractures were confirmed on necropsy (D, E)",VRO2-8-e1-g008,NotMatch,NotMatch
PMC8109047,FIGURE 2,Autopsy imaging‐computed tomographic maximum intensity projection image (A) and gross photograph (B) in case 2. Arrows show the urethral calculi. Sandy contents in the reticulum were also depicted as high density in the cranial ventral abdomen,VRO2-8-e1-g005,NotMatch,NotMatch
PMC8109047,FIGURE 3,"Autopsy imaging‐computed tomographic image (A) and gross photograph (B) in case 3. Bone lysis in the atlas (A), which is one of multiple bone lysis lesions, was confirmed (B)",VRO2-8-e1-g004,NotMatch,NotMatch
PMC8109047,FIGURE 4,"Autopsy imaging‐computed tomographic image (A) and gross photograph (B) in case 4. A total of six hairballs were depicted in the rumen (arrows), and all hairballs were confirmed on necropsy (B)",VRO2-8-e1-g003,NotMatch,NotMatch
PMC8109047,FIGURE 5,Autopsy imaging‐computed tomographic image in case 5. (A) Two‐dimensional image; (B) Three‐dimensional image; (C) Photograph of the three‐dimensional printed model). The use of the three‐dimensional printed model allowed the bony changes to be easy to understand making it ideal for hands‐on training,VRO2-8-e1-g001,NotMatch,NotMatch
PMC8109047,FIGURE 6,"Histological findings in case 5. The neoplasia comprised various odontogenic tissues. (Hematoxylin and eosin stain. Bar, 10 mm). The mass was identified as ameloblastic fibro‐odontoma",VRO2-8-e1-g006,NotMatch,NotMatch
PMC8109047,FIGURE 7,"Antemortem radiograph of the skull (A) and autopsy imaging‐computed tomographic image (B) in case 6. Fluid level (arrows) in the antemortem radiograph (A) suggests maxillary abscess; however, aggressive neoplasia with calcification was detected in the autopsy imaging‐computed tomography (B). Intracranial air is a technical artifact because of the cutting of the neck. Air entered to subarachnoid space from the cutting site",VRO2-8-e1-g007,NotMatch,NotMatch
PMC8109047,FIGURE 8,"Histological findings in case 6. Neoplastic endothelial cells form irregularly shaped and sized vessels. (Hematoxylin and eosin stain. Bar, 20 μm). The mass was identified as hemangiosarcoma",VRO2-8-e1-g002,Match,NotMatch
PMC8150673,Figure 1,Metabolites altered in the development of VC-mediated hemangiosarcoma. Volcano plots of metabolite data significantly different when comparing Hemangiosarcoma vs. Control. Data are plotted as fold-change vs. -log(p-value). Metabolomic datasets were statistical compared by a Welch’s t-test with a p < 0.05 being considered significant.,ijms-22-05093-g001,Match,NotMatch
PMC8150673,Figure 2,"Serum inflammatory proteins bradykinin and C3 are elevated while anti-inflammatory lipids are diminished in VC-mediated hemangiosarcoma. Serum bradykinin (A), hydroxylated bradykinin (B), C3 (C), EPA (D), prostaglandin A2 (E), arachidonate (20:4n6) (F), stearidonate (18:4n3) (G), 15-HETE (H) and DHA (22:6n3) (I) are plotted for Control and Hemangiosarcoma groups. Data are represented as mean ± SEM. * denotes significance with p < 0.05, ** p < 0.01.",ijms-22-05093-g002,Match,NotMatch
PMC8150673,Figure 3,"Serum bile acids are increased in VC-mediated hemangiosarcoma. Serum glycocholate (A), taurocholate (B), taurochenodeoxycholate (C), deoxycholate (D), taurodeoxycholate (E), glycochenodeoxycholate (F), glycolithocholate sulfate (G) and taurolithocholate 3-sulfate (H) are plotted for Control and Hemangiosarcoma groups. Data are represented as mean ± SEM. * denotes significance with p < 0.05, ** p < 0.01.",ijms-22-05093-g003,Match,NotMatch
PMC8150673,Figure 4,"Serum gamma-glutamyl amino acids are increased in VC-mediated hemangiosarcoma. Serum gamma-glutamylvaline (A), gamma-glutamylleucine (B), gammaglutamylisoleucine (C), gamma-glutamylmethionine (D), gamma-glutamylglutamate (E), gamma-glutamyltyrosine (F), gamma-glutamyltryptophan (G) and gamma-glutamylalanine (H) are plotted for control group, Control and Hemangiosarcoma groups. Data are represented as mean ± SEM. * denotes significance with p < 0.05, ** p < 0.01.",ijms-22-05093-g004,Match,NotMatch
PMC8150673,Figure 5,"Fibrin degradation products are elevated in VC-mediated hemangiosarcoma. Serum fibrinogen peptides Fibrin Degradation Product 1 (A), Fibrin Degradation Product 2 (B), Fibrin Degradation Product 3 (C) are plotted for Control and Hemangiosarcoma groups. Data are represented as mean ± SEM. * denotes significance with p < 0.05, ** p < 0.01.",ijms-22-05093-g005,Match,NotMatch
PMC8150673,Figure 6,"Steroid hormones, steroid hormone metabolites and gut-derived phenol gastrodigenin are diminished in VC-mediated hemangiosarcoma. Serum 5alpha-androstan-3-beta,17-beta-diol disulfate (A), Dehydroisoandrosterone (DHEA) sulfate (B), Epiandrosterone (C) and gastrodigenin (D) are plotted for Control and Hemangiosarcoma groups. Data are represented as mean ± SEM. * denotes significance with p < 0.05.",ijms-22-05093-g006,Match,NotMatch
PMC8150673,Figure 7,Random forest confusion matrix and biochemical importance plot. Confusion matrix for Hemangiosarcoma and Control.,ijms-22-05093-g007,Match,NotMatch
PMC8243913,Fig. 1,Mean nucleosome concentrations in the plasma of healthy dogs and dogs with HSA,12917_2021_2934_Fig1_HTML,NotMatch,NotMatch
PMC8243913,Fig. 2,ROC curve demonstrating the ability of the assay to discriminate between healthy dogs and those with HSA. The AUC for this assay was determined to be 92.9 %,12917_2021_2934_Fig2_HTML,NotMatch,NotMatch
PMC8243913,Fig. 3,"Median nucleosome concentrations in dogs with HSA based on primary location. Dogs with primary splenic, cardiac and bone HSA had significantly higher median nucleosome concentrations than healthy dogs",12917_2021_2934_Fig3_HTML,NotMatch,NotMatch
PMC8243913,Fig. 4,"Mean Nucleosome concentrations from dogs of all stages with HSA compared to healthy controls. The assay was able to detect 67 % of dogs with stage I, 76 % of dogs with stage II and 90 % of dogs with stage III disease",12917_2021_2934_Fig4_HTML,NotMatch,NotMatch
PMC8243913,Fig. 5,"Longitudinal assessment of nucleosome concentrations in a patient with stage III HSA throughout the course of treatment. The green circles represent clinical remission, red circles represent progressive disease and the orange circle represent a partial clinical response. All assessments were performed by a board-certified veterinary medical oncologist. All imaging was interpreted by a board-certified veterinary radiologist",12917_2021_2934_Fig5_HTML,NotMatch,NotMatch
PMC8308881,Figure 1,"Conditional outcome probabilities of a positive result for class (Bartonella infected, in orange or Not Bartonella infected, in blue) for each test. The conditional outcome probability is the probability of a positive result for a subject with a random effect of zero (an “average” subject). Points show the probability estimate calculated based on RE-LCA, and bars show the 95% confidence interval for the estimate.",pathogens-10-00794-g001,NotMatch,NotMatch
PMC8295674,FIGURE 1,"Kaplan‐Meier analysis was used to estimate the survival times of dogs with splenic hemangiosarcoma that received adjuvant carboplatin or DOX‐based chemotherapy. A, Entire population; B, dogs with stage I disease; C, dogs with stage II disease. There was no significant difference between the 2 chemotherapy groups for the entire population or when stratified by stage. Tick marks indicate censored dogs",JVIM-35-1929-g001,Match,NotMatch
PMC8295674,FIGURE 2,"In the carboplatin group (A) there was a significant difference (P = .02) in median survival time (MST) of dogs with stage I HSA compared with stage II HSA, while no significant difference was observed in the dogs treated with doxorubicin (B; P = .23). C, The relationship between median survival time (MST) and change in peripheral monocyte counts in dogs with HSA. Dogs with decreasing postoperative monocyte counts had significantly (P = .002) increased MST when compared with dogs with increasing monocyte counts. Tick marks indicate censored dogs",JVIM-35-1929-g002,NotMatch,NotMatch
PMC8319545,Fig. 1.,Shared and unique somatic mutations in canine cardiac and splenic hemangiosarcoma (HSA) from the same patient. Shown here are the number of unique and shared mutations [defined as mutations in the same genomic position with the same nucleotide change(s)] in tumors from dogs that presented with concurrent cardiac and splenic HSA.,dmm-14-049044-g1,Match,NotMatch
PMC8319545,Fig. 2.,"Cancer gene landscape of canine visceral, canine cutaneous and feline cutaneous HSA tumors. (A,B) Mutations in canine visceral HSA (A) and canine and feline cutaneous HSA (B). Canine samples are left of the solid line; feline, right. Canine cutaneous HSA samples with a UV mutational signature are right of the dashed line. Mutations in visceral HSA tumors were present in either the heart sample, spleen sample or both. Shown are genes mutated in two or more samples, excluding those with a UV mutational signature. A full summary of the cases analyzed in this study is provided in Table S1.",dmm-14-049044-g2,NotMatch,NotMatch
PMC8319545,Fig. 3.,"Somatic copy number alterations (SCNAs) of canine visceral, canine cutaneous and feline cutaneous HSA tumors. (A,B) Penetrance plots showing the frequency of SCNAs in canine cardiac (top; n=15), splenic (middle; n=14) and skin HSAs (bottom; n=13) (A), and feline skin HSAs (n=13) (B).",dmm-14-049044-g3,NotMatch,NotMatch
PMC8319545,Fig. 4.,"Comparative mutational landscape of human angiosarcoma (AS) and canine and feline HSA tumors. Shown are genes mutated in at least two of the three species. The human AS data from 62 samples were obtained from the Angiosarcoma Project (Painter et al., 2020). The genes mutated in human AS are represented as a percentage of total cases.",dmm-14-049044-g4,Match,NotMatch
PMC8388721,Figure 1,(A) Overall survival in HSA-affected dogs according to clinical pathological criteria. (B) Patients with metastatic splenic HSA experienced a shorter survival time (p < 0.0001). (C) Patients at stage III show shorter survival time than stage I and II patients (p = 0.0444). (D) Patients that received surgical or surgery associated with adjuvant chemotherapy (CT) as treatment show a longer survival time than those that did not receive treatment or only surgery treatment (p < 0.0001).,animals-11-02406-g001,NotMatch,NotMatch
PMC8388721,Figure 2,"Immunoexpression of Claudin-5, PSMA, and Ki67 in canine hemangiosarcoma (HSA) samples. (A) Low Claudin-5 immunoexpression in a capillary HSA sample. (B) Canine HSA showing high Claudin-5 expression in neoplastic endothelial cells. (C) Low Ki67 expression in a solid HSA sample. (D) High Ki67 expression in a canine HSA sample. (E) Low PSMA expression in a solid HSA sample. (F) High PSMA expression in neoplastic endothelial cells (arrows) in a capillary HSA sample. Note the negative expression in red cells (asterisk), confirming satisfactory endogenous peroxidase blocking. Harris hematoxylin counterstain, 40×.",animals-11-02406-g002,Match,NotMatch
PMC8388721,Figure 3,"(A) Metastatic samples have higher Claudin-5 expression compared with non-metastatic samples (p = 0.0078). (B) Association of Claudin-5 expression with tumor stage, with stage III tumors showing higher expression than stage I and II tumors (p = 0.0451).",animals-11-02406-g003,NotMatch,NotMatch
PMC8388721,Figure 4,"Representative image of each antibody in capillary, cavernous and solid patterns. It is possible to observe the negative control for each antibody and PSMA, Ki67, and Clauding-5 expression in the different histological subtypes. Harris hematoxylin counterstaining, DAB, 40.",animals-11-02406-g004,NotMatch,NotMatch
PMC8388721,Figure 5,(A) Patients that underwent surgery as single therapy show low PSMA protein expression associated with increased survive time (p = 0.0355). (B) Patients treated with surgery associated with chemotherapy show the opposite relationship between PSMA and overall survival. Patients with low PSMA protein expression experience a shorter survival time (p = 0.0113). (C) A longer survival time is observed in patients treated with surgery with a lower Ki67 index (p = 0.0488) and (D) a longer survival time is observed for patients with low Ki67 index in those treated with chemotherapy (p = 0.0143).,animals-11-02406-g005,NotMatch,NotMatch
PMC8388721,Figure 6,Matrix of multiple correlations for all studied markers. Positive correlations are shown in blue and negative correlations are shown in red. The strength of correlations is depicted by color intensity.,animals-11-02406-g006,NotMatch,NotMatch
PMC8408428,Fig. 1,"Contrast-enhanced CT of the abdomen (2 d after onset) demonstrated a large tumor in the right lobe of the liver with uneven enhancement in (A) arterial, (B) venous, (C) delayed phases.",gr1,NotMatch,NotMatch
PMC8408428,Fig. 2,"(A) Hematoxylin-eosin staining showed abnormal proliferation of tumor cells. Immunohistochemical staining showed (B) CD31(+), (C) CD34(+), (D) ERG (+).",gr2,NotMatch,NotMatch
PMC8408428,Fig. 3,"During TACE (2 wk after onset), (A)large tumor staining was visible. After TACE, (B) iodinated oil deposition was observed in the tumor.",gr3,NotMatch,NotMatch
PMC8408428,Fig. 4,"Abdominal enhanced CT (2 mo after onset) showed significant necrosis of the tumor in a wide range in (A) arterial, (B) venous, (C) delayed phases.",gr4,NotMatch,NotMatch
PMC8408428,Fig. 5,Intraoperative angiography of TACE (2 mo after onset) showed a small amount of dark staining of the tumor was visible.,gr5,NotMatch,NotMatch
PMC8408428,Fig. 6,CT (6 mo after onset) examination revealed multiple metastatic lesions in the liver.,gr6,NotMatch,NotMatch
PMC8531209,Figure 1,Patient outcomes.,fvets-08-736329-g0001,NotMatch,NotMatch
PMC8333103,Fig. 1,"We performed a rigorous quality control (QC) of whole-exome sequencing (WES) data published for 654 canine cases.a Distributions of total read pairs per sample of the tumor and normal sample sets of each study. Each dot represents a sample and the median is indicated by a black line. The dashed line specifies the QC cutoff. Each study is represented by the tumor type and the institute name. MT mammary tumor, GLM glioma, BCL B-cell lymphoma, TCL T-cell lymphoma, OM oral melanoma, OSA osteosarcoma, HSA hemangiosarcoma, UCL unclassified. CUK Catholic University of Korea, SNU Seoul National University, JL Jackson Laboratory, SI Sanger Institute, BI Broad Institute, TGen Translational Genomics Research Institute, UPenn University of Pennsylvania. n = 184, 20, 56, 61, 39, 65 (71 tumors), 66, 12, 47, 21 (23 tumors), and 83 independent cases for matched normal and tumors samples for each independent study listed from left to right. b–f Distributions of per sample rate of read pairs that aligned concordantly and uniquely to the canFam3 reference genome (b) (n = 81 for UCL BI; others the same as a), the fraction of reads with mapping quality of ≥30 (c) (n = 50 and 18 for GLM JL and HSA UPenn respectively; others the same as b), CDS-targeting rate (the fraction of read pairs that align concordantly and uniquely to the canFam3 CDS regions) (d) (the same sample size as c), mean read coverage in CDS regions (e) (n = 60, 38 and 80 for BCL BI, TCL BI, and UCL BI, respectively; others the same as d) and root-mean-square error (RMSE) between the actual distribution and theoretical distribution (based on the Poisson distribution) of sequence coverage in CDS regions (f) (n = 183, 49, 58, 43, 8, and 74 for MT CUK, GLM JL, BCL BI, HSA BI, HSA UPenn, and UCL BI, respectively; others the same as e). g Distributions of the total number of callable bases per case, determined by MuTect. n = 183, 20, 49, 58, 38, 71, 66, 12, 42, 8, and 74 independent tumors from left to right. h Tumor-normal pairing accuracy. “Self” (in green) is the fraction of germline variants shared between the normal and tumor samples of a dog. “Best nonself” is the fraction of germline variants shared between a normal or tumor sample of one dog and its best-matched sample from another dog. “Self—Best nonself” (in purple) indicates the difference and a negative difference points to incorrect tumor-normal pairing. The sample size is the same as in (g). Source data are provided as a Source Data file.",41467_2021_24836_Fig1_HTML,Match,NotMatch
PMC8333103,Fig. 2,"We conducted breed validation and prediction using breed-specific germline base substitutions and small indels discovered.The heatmap shows the clustering of 505 animals (398 dogs with breeds provided and 107 dogs with no breeds provided), using variant allele frequency (VAF) values of the 5363 breed-specific germline base substitution and small indel variants in their normal samples. These variants were discovered with the WES dataset (see “Methods”). The WGS dataset was used for validation as specified in the “Data Type” bar, where “WGS(WES)” indicates that a dog has both WGS and WES data but only WGS data were used in the clustering analysis. The “Provided Breed” bar and the “Disease” bar respectively indicate the breed and tumor type of each dog provided by the source studies. The “Validated Breed” bar denotes the analysis outcome as specified, with “Unknown” representing dogs whose provided breeds could not be validated or corrected, due to the lack of any specific VAF clustering patterns of the ten pure breeds investigated. Source data are provided as a Source Data file.",41467_2021_24836_Fig2_HTML,NotMatch,NotMatch
PMC8333103,Fig. 3,"Canine tumor alteration landscape, consisting of genes recurrently mutated and/or amplified/deleted, varies with tumor types but not with breeds in general.a Oncoprints indicate the top six most recurrently altered genes with nonsynonymous somatic base substitutions or small indels (top), or copy number alterations (CNAs) (bottom), in CDS regions in each tumor type indicated. Significant recurrence, identified by Fisher exact tests with multiple testing correction60, are denoted by “*” as shown. The breed of each animal is specified in the breed bar. b Enrichment scores of the most recurrently altered genes and pathways, obtained via Fisher exact test q-values (see “Method”), in each tumor type of all breeds (left) and of Golden Retriever (middle), as well as in each breed with ≥10 dogs within a tumor type (right). Source data are provided as a Source Data file.",41467_2021_24836_Fig3_HTML,NotMatch,NotMatch
PMC8333103,Fig. 4,"Canine tumors share many of the same major gene and pathway alterations as their human counterparts.Each panel of a–g compares the mutation recurrence of a gene or pathway in a tumor type between the two species. Human breast cancer (BRCA) (a), pediatric and adult GLM (b), diffuse large B-cell lymphoma (DLBCL) (c), TCL (d), mucosal melanoma (MM) (e), OSA (f) and angiosarcoma (AS) (g) are from published studies (see text). Shown are curated pathways (10 total) from a TCGA pan-cancer publication46, as well as genes mutated in ≥10 tumors and ≥10% (for pathway genes) or 20% (for non-pathway genes) of all tumors in a tumor type in either species. Genes and pathways with the mutation frequency that are significantly different (q < 0.05 from Fisher exact tests followed by multiple testing correction60) and have ≥2-fold changes between the two species are considered different. Source data are provided as a Source Data file.",41467_2021_24836_Fig4_HTML,Match,NotMatch
PMC8333103,Fig. 5,"We investigated TMB and common alterations in each of the 597 tumors of over 7 tumor types and over 35 breeds.The tumors in the oncoprint were ordered from left to right by lowest to highest TMB. Seven tumor types as indicated in Fig. 3 and unknown tumor types (UCL; see Fig. 1) are included. Breeds shown include those validated, corrected, predicted or unknown (with an issue or not predicted) as shown in Fig. 2, as well as other breeds, which are not validated due to small sample size, and mixed breeds. Top recurrent gene and pathway alterations are shown. Source data are provided as a Source Data file.",41467_2021_24836_Fig5_HTML,NotMatch,NotMatch
PMC8333103,Fig. 6,"TMB varies among tumor types and is correlated with TP53 mutation.a TMB distributions of each canine tumor type ordered left to right from lowest to highest median values. The left plot shows that problematic genes (see “Methods”) have significantly higher TMB than other genes, and thus were excluded from further analyses. The right plot indicates that canine tumors are classified into TMB-low (TMB-L) and -high (TMB-H). Two-sided Wilcoxon tests were conducted to examine the TMB difference between two groups indicated, with **, ***, **, ****, ***, and **** from left to right representing unadjusted p = 0.006, 0.0006, 0.001, 4.7e−6, 0.0003 and 2e−16, respectively. For significant comparisons, the fold change in median TMB is also indicated. n = 202, 49, 55, 38, 71, 78, 49, 306 and 236 independent tumors for each tumor type listed from left to right, respectively. b, c TMB distributions of cases with wild type (blue) or mutant (red) TP53 or PIK3CA within each canine (b) or human (c) tumor type. For tumor types with both wild type and mutant groups having ≥5 tumors, two-sided Wilcoxon tests were conducted to determine the significance of the association between TMB and TP53 or PI3KCA, with unadjusted p-values and fold changes shown as described in (a). LGG low-grade glioma, GBM glioblastoma, HGG high-grade glioma. From left to right: b
n = 11, 191, 1, 49, 6, 49, 1, 37, 2, 69, 40, 38, 29, 20, 18, 288, 72 and 164 independent tumors for TP53 (***, ***, **, ****, and **** representing p = 0.0002, 0.0003, 0.005, 2.4e−7 and 9.9e−5, respectively), while n = 74, 128, 3, 46, 55, 38, 1, 70, 1, 77, 15, 34, 77, 229, 17 and 219 independent tumors for PIK3CA (** and ** representing p = 0.005 and 0.007, respectively). c
n = 345, 703, 249, 265, 121, 268, 5, 36, 4, 38, 7, 39, 20, 29, 14, 34, 22, 44, 19 and 37 independent tumors for TP53 (****, *, ***, *, and ** representing p = 2e−16, 0.02, 0.0006, 0.02 and 0.008, respectively), while n = 347, 701, 42, 472, 36, 353, 41, 42, 1, 45, 2, 47, 10, 38, 8, 58 and 56 independent tumors for PIK3CA. Source data are provided as a Source Data file.",41467_2021_24836_Fig6_HTML,NotMatch,NotMatch
PMC8333103,Fig. 7,"TMB is largely independent of breeds.a TMB distributions of cases grouped by tumor type and then breed. Only groups with ≥10 tumors are shown, with n = 15, 28, 70, 14, 16, 11, 17, 44, 16, 21, 25, 21, 25 and 42 independent tumors from left to right. Two-sided Wilcoxon tests were conducted, with ** and * representing unadjusted p = 0.009 and 0.01, respectively, and fold-changes shown. b TMB distributions of tumors grouped by breed, tumor type, and finally TP53 (top) or PIK3CA (bottom) mutation status. Only groups with TP53 (or PIK3CA) wild-type and mutant-combined tumors of ≥10 are shown, with n = 15, 27, 1, 66, 4, 12, 2, 16, 10, 1, 17, 15, 1, 12, 13, 8, 13, 39, 5, 21, 14, 11, 14 and 28 (top) and n = 12, 3, 18, 10, 41, 29, 8, 6, 10, 6, 6, 5, 17, 16, 24, 1, 21, 44, 21, 25, 29 and 13 (bottom) independent tumors left to the right. Two-sided Wilcoxon tests were conducted, with *, **, and ** from left to right representing unadjusted p = 0.04, 0.003, and 0.008, respectively, and fold-changes shown. Source data are provided as a Source Data file.",41467_2021_24836_Fig7_HTML,NotMatch,NotMatch
