pmcid,label,caption,graphic,disease,modality
PMC1475262,FIGURE 4.,,envhper00492-0205-a,Empty,Empty
PMC1475262,FIGURE 5.,,envhper00492-0205-b,Empty,Empty
PMC1475262,FIGURE 6.,,envhper00492-0206-a,Empty,Empty
PMC1475262,FIGURE 7.,,envhper00492-0206-b,Empty,Empty
PMC1475262,FIGURE 8.,,envhper00492-0206-c,Empty,Empty
PMC2680013,Figure 1,"Golden Retriever Hemangiosarcoma Cells Segregate from Non-Golden Retriever Hemangiosarcoma Cells via Their Expression Profile.A. Hierarchical clustering of 6 Golden Retriever (GR) hemangiosarcoma samples versus 3 non-Golden Retriever (nGR) hemangiosarcoma samples (GEO series record GSE15086). Increasing green intensity indicates increased gene expression, increasing red intensity indicates decreased gene expression, and black indicates no change. Bars represent groups that cluster together. B. Gene differences between Golden Retrievers (GR) and non-Golden Retrievers (nGR) were plotted according to their cytogenetic location along the 38 autosomes and the X chromosome. Tick marks represent individual genes that show differential regulation, with the color intensity (green to black to red) representing expression changes as described in part A. Genes plotted received a p-value<0.05 and were derived from ANOVA analysis of the global list of filtered genes. C. Quantitative expression analysis of 3 genes found in panel A, TSP-3, DLA88 (MHC), and SMARCA1 (SWI/SNF) that were differentially expressed between Golden Retrievers with hemangiosarcoma and other breeds with hemangiosarcoma. Samples were evaluated for gene expression changes by RT-PCR followed by qPCR. One sample originating from a non Golden Retriever dog (Dal-4) was normalized to 1.0 and used as a reference; gene expression is presented as fold change compared to the reference sample. The samples used for real time PCR analysis (in the order presented) include CHAD P9, Dal-4, Joey, DD1, CHAD G6, CHAD G4, and Frog. D. Schematic representation of gene expression changes between Golden Retrievers and non Golden Retrievers with hemangiosarcoma grouped by biological function using ONTO/express gene ontology program (vortex.cs.wayne.edu/Projects.html).",pone.0005549.g001,Match,NotMatch
PMC2680013,Figure 2,"Gene Set Enrichment Analysis Validates the Hypothesis that the Golden Retriever Hemangiosarcoma Gene Set Is Involved in Hypoxia, Inflammation, and Cancer.A. Bar graph representing the number of gene sets/pathways from the GSEA archived database that were enriched in hemangiosarcoma samples from Golden Retrievers versus hemangiosarcoma samples from non-Golden Retrievers. Each gene on the x-axis was present in the number of GSEA gene sets indicated on the y-axis (of 77 where FDR<0.05). B. Graphical representation of genes (x-axis) present in each GSEA pathway/gene set (y-axis), where a filled box means the gene was present and enriched in that GSEA pathway. Increasing red intensity reflects higher enrichment scores. The genes enriched in the highest number of gene sets are identified by name.",pone.0005549.g002,Match,NotMatch
PMC2680013,Figure 3,"Expression of VEGF Receptors in Hemangiosarcoma Cells of Golden Retrievers and Non-Golden Retrievers.A. Hemangiosarcoma cells from 4 Golden Retrievers (in order from top to bottom, Frog, Veronica, Tucker, Emma) and from 2 non-Golden Retrievers (Dal-4 and Joey) were cultured in chamber slides and stained with antibodies against VEGFR1 and VEGFR2 as described in the methods. Staining was visualized using epifluorescence. Bar = 20 µm. B. Emma, Frog, Joey, and Dal-4 cells obtained during the log growth phase were used to quantify expression of VEGFR1, VEGFR2 and ß-actin by immunoblotting. Conditions were optimized for linearity. Densitometric band quantification was done using Image J 1.37. Data are normalized to ß-actin using the sample with the highest expression for each receptor as the calibrator. C. Dal-4 cells were cultured in complete media supplemented with VEGF (+), in the absence of serum and growth supplements (−), with or without Drug 3 (100 nM) or Drug 1 (1 µM) as indicated. The activation status of VEGFR1 and VEGFR2 was examined using modification-state (phosphospecific) antibodies directed against pVEGFR1-Tyr915 and pVEGFR2-Tyr875. ß-actin was used as a loading control, and HUVEC lysates were used as a specificity control for VEGFR1.",pone.0005549.g003,Match,NotMatch
PMC2680013,Figure 4,"Differential Sensitivity of Canine Hemangiosarcoma Cell Lines to VEGFR Inhibitors.The effect of three VEGFR inhibitors on proliferation and viability of hemangiosarcoma cells was tested in vitro. The selectivity and half maximal inhibitory concentrations for Drugs 1, 2, and 3 are listed in the Materials and Methods. Cells (10,000/well) were plated in duplicate in a 96-well microtiter plates and allowed to attach for 16 hr prior to addition of inhibitors at the indicated concentration. Cells were then cultured for 72 hr, and the number of viable cells was determined using the MTS assay. Absorption at 490 nm for each well was averaged, and data normalized to % viability where the mean of wells that received no treatment (0 nm) was considered = 100%. The mean of two independent experiments is shown at drug concentrations of 100 nM. P-values were calculated using Student's T-test.",pone.0005549.g004,Match,NotMatch
PMC2768746,Figure 1,"Gross appearance of Ud xenograft tumors at 24 days after transplantation, which was transplanted repeatedly 20 times. The xenograft tumor was solid, dark red in color, and contained necrotic and blood-filled areas on the cut surface. Bar: 2.5 mm.",1471-2407-9-363-1,NotMatch,NotMatch
PMC2768746,Figure 2,"Histological features of original HSAs and xenograft HSA tumors. Microscopic features of original HSAs and xenograft HSA tumors. Histologically, each of the original HSAs (A, C, E, G, I, and K present the original tumors of Si, Re, Ud, Sy, Sa, and Ju, respectively) showed vascular-like proliferation and formed solid sheets with various-sized clefts. The neoplastic cells that comprised original tumors had various shapes, ranging from spindle-shaped and polygonal to ovoid. Each of the xenograft tumors (B, D, F, H, J, and L present Si, Re, Ud, Sy, Sa, and Ju, respectively) were predominantly solid and contained poorly formed, irregular-shaped vascular spaces with erythrocytes, neutrophils, and lymphocytes. In all xenograft tumors, the neoplastic cells became more pleomorphic, elongated, and plump and the nuclei became larger and more clearly polygonal in shape. Hematoxylin and eosin (HE); bars: 50 μm.",1471-2407-9-363-2,NotMatch,NotMatch
PMC2768746,Figure 3,"Endothelial cell-specific markers and Ki-67 immunolabeled in original HSAs and xenograft HSA tumors. Immunolabeling of CD31, vWF, and Ki-67, in original HSAs and xenograft HSA tumors. All original HSAs had membrane immunoreactivity for CD31 (A: the original tumor of Sa) and cytoplasmic immunoreactivity for vWF (C: the original tumor of Sa). Immunoreactivity for CD31 (B: Sa) and vWF (D: Sa) in all xenograft HSA tumors was detected in the same location as in the original tumors. In all xenograft HSA tumors, Ki-67 (E: Sy) nuclear immunoreactivity was observed in the nuclei of the tumor cells that were derived from canine HSA. Immunohistochemistry (IHC); bars: 50 μm.",1471-2407-9-363-3,NotMatch,NotMatch
PMC2768746,Figure 4,"Angiogenic growth factors and their receptors immunolabeled in original HSAs and xenograft HSA tumors. Representative immunohistochemical results of VEGF-A, flt-1, flk-1, and bFGF in original HSAs and xenograft HSA tumors. All original HSAs had cytoplasmic immunoreactivity for VEGF-A (A: the original tumor of Re), flt-1 (C: the original tumor of Ju), flk-1 (E: the original tumor of Ud), and bFGF (G: the original tumor of Si). Immunoreactivity for VEGF-A (B: Re), flt-1 (D: Ju), flk-1 (F: Ud), and bFGF (H: Si) in all xenograft HSA tumors was detected in the same location as in the original tumors. Immunohistochemistry (IHC); bars: 50 μm.",1471-2407-9-363-4,NotMatch,NotMatch
PMC2768746,Figure 5,"Angiogenesis-associated homeobox proteins immunolabeled in canine normal ECs, original HSAs, and xenograft HSA tumors. Representative immunohistochemical results of HoxD3 and Pbx1 in active and quiescent ECs during angiogenesis. In granulation tissue, although immunoreactivity for HoxD3 (A) and Pbx1 (C) was localized in the nuclei and cytoplasm of angiogenic ECs, it was weak for HoxD3 in the nuclei. Immunoreactivity for HoxD3 (B) was not detected in quiescent ECs but for Pbx1 (D), the immunoreactivity was localized in the nuclei and cytoplasm of quiescent ECs. Representative immunohistochemical results of HoxA9, HoxB3, HoxB7, HoxD3, Pbx1, and Meis1 in original HSAs and xenograft HSA tumors. In all original HSAs, immunoreactivity for HoxA9 (E: the original tumor of Ud), HoxB3 (G: the original tumor of Sy), HoxD3 (K: the original tumor of Sa), Pbx1 (M: the original tumor of Ud), and Meis1 (O: the original tumor of Ud) was localized in the nuclei and cytoplasm of the neoplastic cells. HoxB7 (I: the original tumor of Sa) immunoreactivity was only localized in the nuclei of the neoplastic cells. Immunoreactivity for HoxA9 (F: Ud), HoxB3 (H: Sy), HoxB7 (J: Sa), HoxD3 (L: Sa), Pbx1 (N: Ud), and Meis1 (P: Ud) in all xenograft HSA tumors was detected in the same location as those original tumors. IHC; bars: 25 μm (A--D) and 50 μm (E--P).",1471-2407-9-363-5,NotMatch,NotMatch
PMC2768746,Figure 6,"Gene expressions of neoplastic cells in xenograft HSA tumors. RT-PCR analyses of the expression of endothelial cell-specific markers (CD31 and vWF), angiogenic growth factors/receptors (VEGF-A, flt-1, flk-1, bFGF, and FGFR1), and homeobox genes (HoxA9, HoxB3, HoxB7, HoxD3, Pbx1, and Meis1) in the xenograft HSA tumors (1: Si, 2: Re, 3: Ud, 4: Sy, 5: Sa, 6: Ju, 7: normal canine spleen, 8: normal mouse spleen, and 9: negative control of RT-PCR). The mRNAs of endothelial cell-specific markers, angiogenic growth factors/receptors, and homeobox genes were detected in all the xenograft HSA tumors. In particular, the mRNAs of VEGF-A164 (177-bp) and VEGF-A188 (249-bp) were detected in all the xenograft HSA tumors, but VEGF-A182 (231-bp) was not present. The 2 variants of HoxA9 mRNA (314-bp and 141-bp bands) were detected in all the xenograft HSA tumors.",1471-2407-9-363-6,NotMatch,NotMatch
PMC2992565,Fig. 1,Left orbital proptosis with chemosis.,kjo-24-364-g001,NotMatch,NotMatch
PMC2992565,Fig. 2,Coronal computed tomography shows a superior orbital mass with bony destruction and brain extended.,kjo-24-364-g002,NotMatch,NotMatch
PMC2992565,Fig. 3,Chest computed tomography showing a left lung tumor.,kjo-24-364-g003,NotMatch,NotMatch
PMC2992565,Fig. 4,"Orbital metastasis of bronchial angiosarcoma (H&E, ×200).",kjo-24-364-g004,Match,Match
PMC2992565,Fig. 5,Tumoral cells are staining by factor VIII.,kjo-24-364-g005,NotMatch,NotMatch
PMC2992565,Fig. 6,Tumoral cells are marking with CD31 factor.,kjo-24-364-g006,NotMatch,NotMatch
PMC2992565,Fig. 7,Important leap of inflammatory oedema of the orbit after biopsy.,kjo-24-364-g007,NotMatch,NotMatch
PMC2992565,Fig. 8,"Bronchial mucosa showed lumina lined by sarcomatous cells (H&E, ×200).",kjo-24-364-g008,NotMatch,Match
PMC3075463,Figure 1,"Asymptomatic, erythematous mass on the lower lingual gingiva in the midline",DRJ-6-99-g001,NotMatch,NotMatch
PMC3075463,Figure 2,IOPA and Occlusal radiographs showing saucer like bony erosion of underlying alveolar bone in the midline extending bilaterally up to canines.,DRJ-6-99-g002,NotMatch,NotMatch
PMC3075463,Figure 3,Photomicrograph showing sub-mucosal nodule of tumor mass arranged in clusters/nests of cells close to overlying oral epithelium (hematoxylin and eosin staining × 100).,DRJ-6-99-g003,NotMatch,Match
PMC3075463,Figure 4,Photomicrograph showing hyperchromatic to vesicular nuclei close to small and medium sized blood vessels in a myxoid to scanty collagenised stroma (hematoxylin and eosin staining × 250),DRJ-6-99-g004,NotMatch,NotMatch
PMC3075463,Figure 5,Photomicrograph showing epithelioid cells with intracytoplasmic lumen formation and few mitotic figures (hematoxylin and eosin staining × 250),DRJ-6-99-g005,NotMatch,NotMatch
PMC3075463,Figure 6,Photomicrograph showing epithelioid tumor cells having vacuolated cytoplasm with lumen and also shows nuclear and cellular pleomorphism (hematoxylin and eosin staining × 400).,DRJ-6-99-g006,NotMatch,NotMatch
PMC3075463,Figure 7,"Photomicrograph showing dense reticulin network surrounding tumor cells, confirming the tumor origin from endothelial cell (reticulin staining X 250).",DRJ-6-99-g007,NotMatch,NotMatch
PMC2994824,Figure 1,"Expression of VHL and Ras proteins in canine hemangiosarcoma cell lines. DD-1, Dal-4, and Frog canine hemangiosarcoma cell lines were cultured in chamber slides and stained with an irrelevant control antibody, or with antibodies against VHL or pan-Ras as indicated on the left. Cells were visualized using bright field microscopy at low magnification (10× objective, BF 10×) and staining in the same fields was visualized using epifluorescence (FL 10×). Bars = 200 μm. Right panels show photomicrographs of DD-1 cells under bright field illumination at high magnification (40 × objective, BF 40×) to illustrate the localization of VHL to the cytoplasm and the localization of Ras predominantly to the inner plasma membrane (red staining). Bars = 20 μm.",1471-2407-10-619-1,Match,NotMatch
PMC2994824,Figure 2,"Expression of VHL and PDGFRβ proteins in canine splenic hematoma and in canine hemangiosarcoma tissues. Serial 5-μm sections from paraffin-embedded splenic hematomas or hemangiosarcomas were stained with an irrelevant control antibody, or with antibodies against VHL or PDGFRβ as indicated on the left. Photomicrographs represent similar or contiguous regions within each tissue at 640× magnification. Two samples of splenic hematomas and eight samples of canine hemangiosarcoma were stained for VHL. Both splenic hematomas and five hemangiosarcomas were stained for PDGFRβ. One of the splenic hematomas and two hemangiosarcomas (the tumors used to derive the DD-1 and Dal-4 cell lines) are shown to illustrate the observed patterns. Expression of relevant antigens is indicated by red staining. VHL staining in the splenic hematomas was restricted to blood vessel lining cells (black arrows), whereas in the hemangiosarcomas, VHL staining was seen diffusely in the tumor cells, but not in associated inflammatory cells. In contrast, PDGFRβ staining was seen in blood vessel lining cells in the splenic hematomas, but was seen both in tumor cells and in associated inflammatory cells in the hemangiosarcomas (blue arrows). Bars = 20 μm",1471-2407-10-619-2,Match,NotMatch
PMC2994824,Figure 3,"Canine hemangiosarcoma cells segregate from non-malignant splenic hematoma cells via their gene expression profile. (A) Hierarchical clustering and heat map of differentially expressed genes in 10 hemangiosarcoma samples versus three splenic hematoma samples. Increasing red intensity indicates increased gene expression and increasing green intensity indicates decreased gene expression as shown in the scale bar. The scale (-1 to +1) reflects variation in intensity from the mean (0) and not fold-change. Fold-change differences are shown in Table S2. (B) Quantitative expression and graphical representation of 2 genes shown in Figure 2A (TIMP-1 and PLZF) and 1 additional gene (FN-1) that were differentially expressed between hemangiosarcoma and splenic hematoma cells. Samples were evaluated for gene expression changes by RT-qPCR, normalized to the endogenous 18 S gene. One sample originating from a dog with splenic hematoma was set to the unitary value (1.0) and used as the calibrator; gene expression is presented as the log fold-change compared to the calibrator. (C) Genes whose expression was significantly different (p <0.05) between hemangiosarcomas and splenic hematomas based on analysis of variance of the complete filtered lists were plotted according to their cytogenetic location on the 38 canine autosomes and the X chromosome. The color intensity for each chromosome (red-over represented to gray to blue-under represented) represents the sum of all changes.",1471-2407-10-619-3,Match,NotMatch
PMC2994824,Figure 4,"Hemangiosarcoma is distinguishable from both non-malignant and other malignant tumors. (A). Hierarchical clustering of tumor samples or non-malignant lesions (hematoma) from golden retrievers. Tumor samples were from osteosarcoma cell lines (OSCA), primary leukemia (ALL-Acute lymphoblastic leukemia or CLL-Chronic lymphocytic leukemia) or non-Hodgkin lymphoma (diffuse large B-cell lymphoma, marginal zone lymphoma, or T-zone lymphoma) cells, or hemangiosarcoma cell lines (HSA). Hierarchical clustering was done using the restricted probe list from Table S2. (B) Principal component analysis (PCA) of tumor samples and non-malignant lesions described in (A), except analysis was done using all data points.",1471-2407-10-619-4,Match,NotMatch
PMC2994824,Figure 5,"Gene set enrichment analysis validates the hypothesis that the hemangiosarcoma gene set is involved in hypoxia, inflammation, and cancer. (A) Bar graph representing the number of gene sets that were enriched in hemangiosarcoma samples versus splenic hematoma samples. Each of 23 genes on the x-axis was present in the number of gene sets indicated on the y-axis (of 30 where FDR < 0.05). (B) Bar graph representing the direction and magnitude of change in expression for six representative genes (IL8, TIMP1, MAO, PDGFRβ, CD44, EPHA2), one invariant control (IL8Rβ) and two housekeeping controls (GAPDH, β-actin) relative to the expression in splenic hematomas. Data for each group (three splenic hematomas, 14 hemangiosarcoma cell lines, and three hemangiosarcoma tissues) passed quality assurance using Affymetrix algorithms provided in GeneData Expressionist Refiner. Probe signal levels were quantile-normalized and summarized using the GeneChip-Robust Multichip Averaging (GC-RMA) algorithm. Normalized files were imported into GeneData Expressionist Analyst so average expression values for each group, based on multiple-probe hybridization data, could be used in the comparisons.",1471-2407-10-619-5,Match,NotMatch
PMC3291645,Fig. 1.,"Ocular tumor incidence in
ptena+/−ptenb−/−
zebrafish over time. Kaplan-Meier plot of tumor incidence. Ptena+/−ptenb−/− zebrafish (n=294) were monitored over time. Number of tumor-free fish are plotted on the y-axis (n). Most tumors (26/30) developed close to the eye. The tumors in other locations (4/30) are indicated as +.",DMM008326F1,NotMatch,NotMatch
PMC3291645,Fig. 2.,"Ocular tumor of
ptena+/−ptenb−/−
and
ptena−/−ptenb+/−
mutants, diagnosed as hemangiosarcoma. (A–D) 3-month-old ptena+/−ptenb−/− and (E-H) 9-month-old ptena−/−ptenb+/− mutant with ocular tumor. The entire intact fish was fixed and embedded in paraffin. (B–D) Transversal sections and (F–H) sagittal sections were stained with H&E. Arrows indicate tumor mass, which is associated with the eye bulbs. (B,G) Higher-power magnifications of the tumor mass; (D) magnification of the boxed area in C. The tumor consists of cells that form different sizes of blood-filled spaces (arrows in D,H).(I,J) H&E staining of sections from two individuals revealed hemangiosarcoma formation. (I) The tumor was invasive and penetrated into the brain region with enclosing scull elements (arrows). (J) Cells with plump morphology (arrow) are detaching from surrounding tissue and protrude into the vessel lumen. Sections of representative tumors are depicted here.",DMM008326F2,Match,Match
PMC3291645,Fig. 3.,"Low-dose Pten tumors display elevated cell proliferation and have endothelial cell origin.
ptena+/−ptenb−/− (n=6) (A–C,E–G) and ptena−/−ptenb+/− (n=1) (D,H) mutants with tumors were fixed, paraffin embedded and sectioned transversally or sagitally. Immunohistochemistry using PCNA, a cell proliferation marker, showed clearly enhanced nuclear PCNA staining in tumor cells (A,D) compared with control tissue in the same sections (B,C). CD31, an endothelial cell marker, was expressed in the tumor tissue (E,H) in a similar manner as in control blood vessels in the same sections (F,G). Representative sections are depicted here.",DMM008326F3,NotMatch,NotMatch
PMC3291645,Fig. 4.,"Elevated Akt/PKB signaling in Pten mutant tumors. Immunohistochemistry on transversal sections from a ptena+/−ptenb−/− mutant fish, using pAkt- and pGSK-3β-specific antibodies. (A) Tumor area stains weakly positive for pAkt, whereas (B) control vessel (arrow) from the same section is not stained (n=10). (C) Tumor area is highly positive for pGSK-3β, whereas (D) cells from a control vessel (arrow) from the same section only stain mildly positive (n=6). (E) The cranial part of a ptena+/−ptenb−/− mutant that developed a tumor was dissected into two fragments, one harboring tumor tissue (tumor) and the other representing control tissue (control). The samples were lysed and the lysates were run on a denaturing SDS-polyacrylamide gel. The proteins were transferred to a PVDF membrane and after blocking the blot was probed with anti-pAkt antibody, stripped and sequentially probed with anti-Akt, anti-pGSK-3, anti-PTEN and, as a loading control, anti-actin.",DMM008326F4,NotMatch,NotMatch
PMC3251770,Figure 1,"Gross findings in the spherical mass. (A) The spherical mass was removed from the spleen. (B) The cut surface shows white spots on the edge, indicating necrosis.",lar-27-361-g001,NotMatch,NotMatch
PMC3251770,Figure 2,"Hemorrhage was widespread, making it hard to recognize the normal splenic structure. H&E stain. Scale bar=500 µm.",lar-27-361-g002,NotMatch,Match
PMC3251770,Figure 3,Inflammation and edema were noted with the infiltration of neutrophils and the lack of cell population on the mass edge. H&E stain. Scale bar=50 µm.,lar-27-361-g003,NotMatch,Match
PMC3251770,Figure 4,Multiple cavernous blood channels were formed by tumor cells. Infiltration of tumor cells and tissue reorganization were observed. H&E stain. Scale bar=100 µm.,lar-27-361-g004,NotMatch,Match
PMC3251770,Figure 5,Scattered neoplastic cells and some mitotic figures  were evident. H&E stain. Scale bar=50 µm.,lar-27-361-g005,NotMatch,Match
PMC3322182,Fig. 1,Preoperative computed tomography (CT) findings. (A) The CT findings of the case 1 patient. (B) The CT findings of the case 2 patient.,kjtcs-45-120-g001,NotMatch,NotMatch
PMC3322182,Fig. 2,"Intraoperative findings of the case 1 patient. (A) After we excised the tumor including the right atrial (RA), superior vena cava (SVC), inferior vena cava (IVC), and atrioventricular groove, the red arrow indicates the annulus portion of the injured leaflet using interrupted sutures. (B) This picture shows that the RA, SVC, and IVC were reconstructed using bovine pericardium.",kjtcs-45-120-g002,NotMatch,NotMatch
PMC3322182,Fig. 3,"Computed tomography (CT) findings obtained three months following surgery. (A) The CT findings of the case 1 patient. There were no metastatic findings. (B) The CT findings of the case 2 patient. There were ill-defined, lobulating, heterogeneously enhancing mass lesions in the right atrial and extending into the pericardial space. These findings suggested aggravation of the remaining angiosarcoma (arrows).",kjtcs-45-120-g003,Match,NotMatch
PMC3372809,Figure 1,"The echocardiography shows an intra-cardiac mass (arrow) in the anterior side of right atrial wall. (A) Modified parasternal view. (B) Apical four chamber view. RA, right atrium; RV, right ventricle; LA, left atrium; RV, left ventricle.",kjim-27-224-g001,NotMatch,NotMatch
PMC3372809,Figure 2,The magnetic resonance imaging of the heart shows an intra-cardiac mass (arrow) in the anterior side of the right atrial wall encasing a right coronary artery.,kjim-27-224-g002,NotMatch,NotMatch
PMC3372809,Figure 3,The positron emission tomography shows hypermetabolic lesions in both breast masses (arrows).,kjim-27-224-g003,NotMatch,NotMatch
PMC3372809,Figure 4,"The pathology of the cardiac tumor confirms angiosarcoma with vasoformitive architectures. (A) H&E, × 200. (B) H&E, × 400.",kjim-27-224-g004,Match,Match
PMC3372809,Figure 5,Serial computed tomography shows the bilateral breast masses (arrows).,kjim-27-224-g005,NotMatch,NotMatch
PMC3372809,Figure 6,"The pathology of the breast masses reveals spindle cell sarcoma similar to previous angiosarcoma of the heart. (A) Pap, × 100. (B) Pap, × 400.",kjim-27-224-g006,Match,Match
PMC3438112,Figure 1,"Morphology, DiI-Ac-LDL uptake, and immunocytochemical staining for VEGF-A and bFGF of canine HSA cell lines. (A) Morphological appearance and uptake of DiI-Ac-LDL (right bottom) of established canine HSA cell lines. Canine HSA cell lines were grown in Medium 199 with 10% FBS. Each cell line exhibited a different morphology. Bars = 50 μm. Right bottom; Uptake of DiI-Ac-LDL in KDM/JuA1. Bar = 25 μm. (B) Immunocytochemical staining for VEGF-A and bFGF. The cytoplasm of cells showing positive staining with VEGF-A in KDM/JuA1 and bFGF in KDM/Re12. Bars = 50 μm.",1746-6148-8-128-1,NotMatch,NotMatch
PMC3438112,Figure 2,Cell growth under standard conditions. Growth curves of canine HSA cell lines. Each cell line was plated at 5000 cells/well in 1 mL of Medium 199 containing 10% FBS. The cells were trypsinized and counted with a hemocytometer using trypan blue every 24 h.,1746-6148-8-128-2,NotMatch,NotMatch
