pmid,pmcid,title,journal,insert_time,has_targz,disease
36168609,PMC9509076,Little Finger Duplication.,Plast Reconstr Surg Glob Open,2023-12-17-22-15-40,True,NotMatch
36171955,PMC9511846,The possibilities and challenges in pain management of a child with 26 fingers posted for polydactyly excisions of all 4 limbs!,J Anaesthesiol Clin Pharmacol,2023-12-17-22-15-40,True,Match
36193191,PMC9526427,Monitoring and Management of Bardet-Biedl Syndrome: What the Multi-Disciplinary Team Can Do.,J Multidiscip Healthc,2023-12-17-22-15-40,True,NotMatch
36203522,PMC9523807,"Screening for musculoskeletal system malformations and birth injuries in newborns: Results of a screening program in two hospitals in Shenzen, China.",Pediatr Investig,2023-12-17-22-15-40,True,NotMatch
36243984,PMC9825580,ChromLoops: a comprehensive database for specific protein-mediated chromatin loops in diverse organisms.,Nucleic Acids Res,2023-12-17-22-15-40,True,NotMatch
36247697,PMC9563190,Ulnar dimelia and a rare variant ulnar trimelia: Case reports.,Radiol Case Rep,2023-12-17-22-15-40,True,NotMatch
36268591,PMC9687537,Disease-associated mutations in WDR34 lead to diverse impacts on the assembly and function of dynein-2.,J Cell Sci,2023-12-17-22-15-40,True,NotMatch
36340607,PMC9627110,Prenatal diagnosis of Bardet‑Biedl syndrome due to novel variants in the BBS10 gene in a fetus with multiple anomalies: A case report.,Exp Ther Med,2023-12-17-22-15-40,True,NotMatch
36348750,PMC9633084,New Notations for Better Morphological Distinction of Postaxial Polydactyly of the Foot.,Plast Reconstr Surg Glob Open,2023-12-17-22-15-40,True,Match
36348931,PMC9632917,Bardet-Biedl Syndrome: A Rare Case From Ophthalmology Perspective.,Cureus,2023-12-17-22-15-40,True,NotMatch
36381850,PMC9635940,Ellis-Van Creveld Syndrome: A Rare Case Report of an Indian Child With Rare Cardiac Anomalies and Normal Intelligence.,Cureus,2023-12-17-22-15-40,True,NotMatch
36406960,PMC9668600,Prenatal diagnosis of Bardet Biedl Syndrome: A case report.,Radiol Case Rep,2023-12-17-22-15-40,True,NotMatch
36407107,PMC9669486,Tissue-specific requirement of sodium channel and clathrin linker 1 (Sclt1) for ciliogenesis during limb development.,Front Cell Dev Biol,2023-12-17-22-15-40,True,NotMatch
36420325,PMC9659834,"Bardet-Biedl syndrome: The longer we miss, the worse is the outcome.",Caspian J Intern Med,2023-12-17-22-15-40,True,NotMatch
36442996,PMC9808550,Characterization of a novel deep-intronic variant in DYNC2H1 identified by whole-exome sequencing in a patient with a lethal form of a short-rib thoracic dysplasia type III.,Cold Spring Harb Mol Case Stud,2023-12-17-22-15-40,True,NotMatch
36468023,PMC9715754,Case report and a brief review: Analysis and challenges of prenatal imaging phenotypes and genotypes in Joubert syndrome.,Front Genet,2023-12-17-22-15-40,True,NotMatch
36522336,PMC9755241,Polydactyly-derived allogeneic chondrocyte cell-sheet transplantation with high tibial osteotomy as regenerative therapy for knee osteoarthritis.,NPJ Regen Med,2023-12-17-22-15-40,True,Match
36531762,PMC9757521,Development Delay in a Child with Microcephaly and Birth Asphyxia: Explore Diagnosis beyond Hypotonic Cerebral Palsy.,J Pediatr Neurosci,2023-12-17-22-15-40,True,NotMatch
36538006,PMC10009908,Compound heterozygous splicing variants in KIAA0586 cause fetal short-rib thoracic dysplasia and cerebellar malformation: Use of exome sequencing in prenatal diagnosis.,Mol Genet Genomic Med,2023-12-17-22-15-40,True,NotMatch
36544612,PMC9748314,Can on-top plasty for atypical radial polydactyly realize a functional reconstruction corresponding to appearance?,Nagoya J Med Sci,2023-12-17-22-15-40,True,Match
36550802,PMC9771235,A review of polydactyly and its inheritance: Connecting the dots.,Medicine (Baltimore),2023-12-17-22-15-40,True,Match
36550847,PMC9771268,A Japanese boy with Bardet-Biedl syndrome caused by a novel homozygous variant in the ARL6 gene who was initially diagnosed with retinitis punctata albescens: A case report.,Medicine (Baltimore),2023-12-17-22-15-40,True,NotMatch
36550955,PMC9774408,Structural Evaluation and Conformational Dynamics of ZNF141(T474I) Mutation Provoking Postaxial Polydactyly Type A.,Bioengineering (Basel),2023-12-17-22-15-40,True,Match
36672825,PMC9858533,"Dental Anomalies in Ciliopathies: Lessons from Patients with BBS2, BBS7, and EVC2 Mutations.",Genes (Basel),2023-12-17-22-15-40,True,NotMatch
36686282,PMC9850794,Polydactyly: Clinical and molecular manifestations.,World J Orthop,2023-12-17-22-15-40,True,Match
36694649,PMC9842872,Incidental finding of a hidden central polydactyly: A case report.,Clin Case Rep,2023-12-17-22-15-40,True,Match
36704599,PMC9872935,Bardet-Biedl Syndrome Presenting in Adulthood.,Indian J Nephrol,2023-12-17-22-15-40,True,NotMatch
36712772,PMC9875361,A Seven Toes Foot: Case Series as an Isolated Dysplasia With Variety of Appearance.,Cureus,2023-12-17-22-15-40,True,NotMatch
36717227,PMC10008061,"Morphology, Connectivity, and Encoding Features of Tactile and Motor Representations of the Fingers in the Human Precentral and Postcentral Gyrus.",J Neurosci,2023-12-17-22-15-40,True,NotMatch
36741589,PMC9896974,Bardet-Biedl Syndrome: Current Perspectives and Clinical Outlook.,Ther Clin Risk Manag,2023-12-17-22-15-40,True,NotMatch
36744302,PMC10074118,Ubiquitylation of BBSome is required for ciliary assembly and signaling.,EMBO Rep,2023-12-17-22-15-40,True,NotMatch
36755093,PMC9931588,Aberrant phase separation and nucleolar dysfunction in rare genetic diseases.,Nature,2023-12-17-22-15-40,True,NotMatch
36761496,PMC9887295,A case of syndromic congenital hypothyroidism with a 15.2 Mb interstitial deletion on 2q12.3q14.2 involving PAX8.,Clin Pediatr Endocrinol,2023-12-17-22-15-40,True,NotMatch
36814674,PMC9940283,A rare case of mobile diplopodia mistaken for polydactyly.,Arch Clin Cases,2023-12-17-22-15-40,True,Match
36818997,PMC9931520,Preaxial polydactyly of the foot in an adult patient diagnosed by X-ray after a trauma.,Radiol Case Rep,2023-12-17-22-15-40,True,Match
36819414,PMC9933149,Surgical Outcome of Complex Knee Deformity Correction in a Girl With Ellis-van Creveld Syndrome: A Report of a Rare Case.,Cureus,2023-12-17-22-15-40,True,NotMatch
36883090,PMC9985698,"Fetal Cyclopia, Proboscis, Holoprosencephaly, and Polydactyly: A Case Report With Review of Literature.",Cureus,2023-12-17-22-15-40,True,Match
36921175,PMC10013991,Holoprosencephaly in Patau Syndrome.,Rev Paul Pediatr,2023-12-17-22-15-40,True,NotMatch
36925983,PMC10011752,Hydrometrocolpos With Polydactyly in Consanguineous Parents: A Case Report and Review of Literature.,Cureus,2023-12-17-22-15-40,True,Match
36994260,PMC10041782,"Ankyloglossia, Syndactyly and Polydactyly in the Pediatric Patient.",Cureus,2023-12-17-22-15-40,True,Match
37007936,PMC10064095,Genetic analysis and prenatal diagnosis of short-rib thoracic dysplasia 3 with or without polydactyly caused by compound heterozygous variants of DYNC2H1 gene in four Chinese families.,Front Genet,2023-12-17-22-15-40,True,Match
37020703,PMC10068620,Potential benefit of rapid genetic testing for Pallister-Hall syndrome.,Clin Pediatr Endocrinol,2023-12-17-22-15-40,True,NotMatch
37035736,PMC10073534,"Clinical and genetic analysis in Chinese families with synpolydactyly, and cellular localization of HOXD13 with different length of polyalanine tract.",Front Genet,2023-12-17-22-15-40,True,Match
37060766,PMC10130596,A rare polydactyly of the forefoot with partial duplication of the 5th metatarsal and supernumerary digit: A case report.,Int J Surg Case Rep,2023-12-17-22-15-40,True,Match
37064338,PMC10091002,Fibular Agenesis and Ball-Like Toes Mimicking Preaxial Polydactyly: Prenatal Presentation of Du Pan Syndrome.,Mol Syndromol,2023-12-17-22-15-40,False,Match
37091781,PMC10116042,Genetic variations in the DYNC2H1 gene causing SRTD3 (short-rib thoracic dysplasia 3 with or without polydactyly).,Front Genet,2023-12-17-22-15-40,True,Match
37096247,PMC10122572,Bangladeshi Case Series of Bardet-Biedl Syndrome.,Case Rep Ophthalmol Med,2023-12-17-22-15-40,True,NotMatch
37107627,PMC10137575,Identification of GLI1 and KIAA0825 Variants in Two Families with Postaxial Polydactyly.,Genes (Basel),2023-12-17-22-15-40,True,Match
37107645,PMC10137610,Identification of Compound Heterozygous EVC2 Gene Variants in Two Mexican Families with Ellis-van Creveld Syndrome.,Genes (Basel),2023-12-17-22-15-40,True,NotMatch
37122977,PMC10131258,Risk Factors for 30-Day Unplanned Re-Operation in Pediatric Upper Extremity Surgery: A National Surgical Quality Improvement Program (NSQIP)-Pediatric Analysis.,Cureus,2023-12-17-22-15-40,True,NotMatch
37214040,PMC10198708,Bardet-Biedl Syndrome Presenting With Bifid Epiglottis: A Case Report and Review of Literature.,Cureus,2023-12-17-22-15-40,True,NotMatch
37214064,PMC10196697,McKusick-Kaufman Syndrome: A Case Report With an Emphasis on Perinatal Diagnosis and Genetic Counseling.,Cureus,2023-12-17-22-15-40,True,NotMatch
37215090,PMC10192688,Distinct patterning responses of wing and leg neuromuscular systems to different preaxial polydactylies.,Front Cell Dev Biol,2023-12-17-22-15-40,True,NotMatch
37217974,PMC10204243,Caroli syndrome associated with atrial septal defect and polydactyly: a case report.,J Med Case Rep,2023-12-17-22-15-40,True,Match
37220455,PMC10200039,A Rare Combination of Heptadactyl and Hexadactyl Polydactyly in a Neonate.,Cureus,2023-12-17-22-15-40,True,Match
37220579,PMC10200083,Polydactylyof 5(th) Finger in a 6 Month Old Male: A Case Report.,World J Plast Surg,2023-12-17-22-15-40,True,Match
37239474,PMC10217928,Biallelic Variants in Seven Different Genes Associated with Clinically Suspected Bardet-Biedl Syndrome.,Genes (Basel),2023-12-17-22-15-40,True,NotMatch
37240074,PMC10218572,"WGS Revealed Novel BBS5 Pathogenic Variants, Missed by WES, Causing Ciliary Structure and Function Defects.",Int J Mol Sci,2023-12-17-22-15-40,True,NotMatch
37328543,PMC10275923,A missense variant at the RAC1-PAK1 binding site of RAC1 inactivates downstream signaling in VACTERL association.,Sci Rep,2023-12-17-22-15-40,True,NotMatch
37395375,PMC10502860,Hyperplastic Human Macromass Cartilage for Joint Regeneration.,Adv Sci (Weinh),2023-12-17-22-15-40,True,NotMatch
37415582,PMC10319965,Bardet-Biedl syndrome: Delayed diagnosis in a 14-year-old child with end-stage renal disease.,Clin Case Rep,2023-12-17-22-15-40,True,NotMatch
37445217,PMC10342287,Maternal Cigarette Smoking and Congenital Upper and Lower Limb Differences: A Systematic Review and Meta-Analysis.,J Clin Med,2023-12-17-22-15-40,True,NotMatch
37452404,PMC10347770,Delineation of the phenotypes and genotypes of facial infiltrating lipomatosis associated with PIK3CA mutations.,Orphanet J Rare Dis,2023-12-17-22-15-40,True,NotMatch
37470539,PMC10451126,Ellis van creveld syndrome: Cardiac anomalies and anesthetic implications.,Ann Card Anaesth,2023-12-17-22-15-40,True,NotMatch
37484763,PMC10360172,Aesthetic outcomes of and anatomic reconstruction for Wassel type IV-D radial polydactyly using a modified Bilhaut-Cloquet procedure.,Front Pediatr,2023-12-17-22-15-40,True,Match
37485807,PMC10568384,Prenatal whole exome sequencing identified two rare compound heterozygous variants in EVC2 causing Ellis-van Creveld syndrome.,Mol Genet Genomic Med,2023-12-17-22-15-40,False,NotMatch
37489014,PMC10568379,RNA sequencing resolves novel DYNC2H1 variants causing short-rib thoracic dysplasia type 3: Case report.,Mol Genet Genomic Med,2023-12-17-22-15-40,False,NotMatch
37547102,PMC10401059,Epidemiology of birth defects based on a birth defects surveillance system in southwestern China and the associated risk factors.,Front Pediatr,2023-12-17-22-15-40,True,NotMatch
37551246,PMC10404379,Effects of Methimazole vs Propylthiouracil in Newborns: A Comparative Review.,Cureus,2023-12-17-22-15-40,True,NotMatch
37551370,PMC10388742,Congenital limb defects in a married female population of the Rahim Yar Khan District in Pakistan.,Asian Biomed (Res Rev News),2023-12-17-22-15-40,True,NotMatch
37588308,PMC10427120,Musculoskeletal Manifestations in Patients With Bardet-Biedl Syndrome: A Report of Two Cases.,Cureus,2023-12-17-22-15-40,True,NotMatch
37588947,PMC10426295,Megaloblastic Anemia in Bardet-Biedl Syndrome: A Rare Case Report.,Clin Med Insights Case Rep,2023-12-17-22-15-40,True,NotMatch
37626311,PMC10463978,A novel smoothed (SMO) point mutation in congenital tibial hemimelia: a case report.,BMC Pediatr,2023-12-17-22-15-40,True,NotMatch
37635794,PMC10449118,Fetal renal cystic disease and post-natal follow up-a single center experience.,Front Pediatr,2023-12-17-22-15-40,True,NotMatch
37675276,PMC10477052,On-top-plasty reconstruction for thumb triplication.,JPRAS Open,2023-12-17-22-15-40,True,NotMatch
37710961,PMC10550848,Gain-of-function MYCN causes a megalencephaly-polydactyly syndrome manifesting mirror phenotypes of Feingold syndrome.,HGG Adv,2023-12-17-22-15-40,False,Match
37715365,PMC10507954,Tourniquet-Related Nerve Injury Following Reconstructive Surgery for Wassel Type IV Preaxial Polydactyly of 13-Year-Old Boy: A Case Report.,Am J Case Rep,2023-12-17-22-15-40,True,Match
37736303,PMC10509762,Identification of novel TMEM231 gene splice variants and pathological findings in a fetus with Meckel Syndrome.,Front Genet,2023-12-17-22-15-40,True,NotMatch
37763346,PMC10532704,A Complex Case of Clino-Syndactyly with Fourth Metacarpal Aplasia.,Life (Basel),2023-12-17-22-15-40,False,NotMatch
37766918,PMC10520965,"Epidemiology of birth defects in a national hospital-based birth defect surveillance spot in Southern Jiangsu, China, 2014-2018.",Front Med (Lausanne),2023-12-17-22-15-40,False,NotMatch
37776687,PMC10556756,Unilateral complete fibular dimelia and diplopodia: A case report and literature review.,Int J Surg Case Rep,2023-12-17-22-15-40,False,NotMatch
37876589,PMC10593553,A Rare Case of Mosaic 3pter and 5pter Deletion-Duplication with Autism Spectrum Disorder and Dyskinesia.,Case Rep Genet,2023-12-17-22-15-40,False,NotMatch
37886641,PMC10598340,Recent advances in primary cilia in bone metabolism.,Front Endocrinol (Lausanne),2023-12-17-22-15-40,False,NotMatch
37892378,PMC10605362,"Cutaneous, Cranial, and Skeletal Defects in Children and Adults with Focal Dermal Hypoplasia.",Children (Basel),2023-12-17-22-15-40,False,NotMatch
37927679,PMC10620062,Congenital Hepatic Cyst in Patients With Patau Syndrome: A Rare Clinical Finding.,Cureus,2023-12-17-22-15-40,False,NotMatch
38013309,PMC10681469,Novel mutation in RPGRIP1L gene causing Joubert syndrome: A case report.,Medicine (Baltimore),2023-12-17-22-15-40,False,NotMatch
38021809,PMC10656932,Laurence-Moon-Bardet Biedl Syndrome With Cholelithiasis.,Cureus,2023-12-17-22-15-40,False,NotMatch
38024053,PMC10680408,Unusual Presentation of Familial Unilateral Postaxial Polydactyly With Metacarpal Delta Phalanx: A Report of a Rare Case.,Cureus,2023-12-17-22-15-40,False,Match
38034494,PMC10684923,Review of the phenotypes and genotypes of Bardet-Biedl syndrome from China.,Front Genet,2023-12-17-22-15-40,False,NotMatch
38062428,PMC10704717,Clinical features and genetic analysis of a case series of skeletal ciliopathies in a prenatal setting.,BMC Med Genomics,2023-12-17-22-15-40,False,NotMatch
38063613,PMC10706044,Experience with Management of Radial Polydactyly: The Multicenter Analysis of 28 Surgical Procedures with Follow-Up.,Healthcare (Basel),2023-12-17-22-15-40,False,Match
9610623,PMC3054471,"Short-rib polydactyly syndrome, Beemer-Langer type, with bilateral huge polycystic renal dysplasia: an autopsy case.",J Korean Med Sci,2023-12-17-22-15-40,True,Match
