pmid,pmcid,title,journal,insert_time,has_targz
28272239,PMC5348187,Cutaneous presentation preceding acute monocytic leukemia: A CARE-compliant article.,Medicine (Baltimore),2023-12-17-22-06-57,True
29723350,PMC5916393,Clinical and pathological features of myeloid leukemia cutis.,An Bras Dermatol,2023-12-17-22-06-57,True
30483125,PMC6243099,Cutaneous Leukemic Infiltrates Successfully Treated With Biomodulatory Therapy in a Rare Case of Therapy-Related High Risk MDS/AML.,Front Pharmacol,2023-12-17-22-06-57,True
36093559,PMC9459570,Diagnosis and prognostic analysis of skin infiltration in chronic lymphocytic leukemia: a case report and literature review.,Transl Cancer Res,2023-12-17-22-06-57,True
37516911,PMC10373345,Skin mesenchymal niches maintain and protect AML-initiating stem cells.,J Exp Med,2023-12-17-22-06-57,False
