pmcid,label,caption,graphic,disease,modality
PMC7900109,Figure 4,"Age-specific incidence rates for NMSC (n = 13,913). SCC patients were significantly older than BCC patients (p < 0.01). NMSC non-melanoma skin cancer, SCC squamous cell carcinoma; BCC basal cell carcinoma.",41598_2021_83502_Fig4_HTML,NotMatch,NotMatch
PMC7900109,Figure 5,"Age-specific incidence rates for NMSC in relation to sex; n = 13,913. In patients 18–44 years old, there was a significant predominance of women (p < 0.01). In patients 45–69 years old, there was no predominance in sex (p = 0.93). In patients 70–79 years old, there was a significant predominance of men (p < 0.01). In patients 80–102 years old, there was a significant predominance of women (p < 0.01).",41598_2021_83502_Fig5_HTML,NotMatch,NotMatch
PMC7900109,Figure 6,Age-specific incidence rates for NMSC between 1999 and 2019.,41598_2021_83502_Fig6_HTML,NotMatch,NotMatch
PMC7900109,Figure 7,Distribution of BCC subtypes between 1999 and 2019.,41598_2021_83502_Fig7_HTML,NotMatch,NotMatch
PMC7933517,Figure 1,"Clinical and dermoscopic images of three cases of infiltrative basal cell carcinoma. (A) A man in his 60s with a 7 mm amelanotic plaque located on the tip of his nose. (B) Dermoscopically the lesion was ulcerated, with a pinkish-whitish background. Both short white streaks and red-white structureless areas could be seen, together with superficial fine telangiectasia. (C) A man in his 50s with a 5 mm pinkish papule located in his right cheek. (D) On dermoscopic examination both classic arborizing and more superficial fine telangiectasia are seen on a pinkish background, together with a small ulceration. (E) A woman in her 40s with a whitish 8 mm papule located on her right temple. (F) Dermoscopy highlights the presence of mixed red and white structureless areas with peripheral white streaks and superficial fine telangiectasia.",fonc-10-630458-g001,NotMatch,NotMatch
PMC8088921,FIGURE 1,"High‐resolution computed tomography (CT) images of the primary tumor (a), (b), (d), the dissemination lesion (e), (f), (h), and the mediastinal lymph node (i), (j), (l). Position emission tomography‐CT images of the primary tumor (c), the dissemination (g), and the mediastinal lymph node (k) at the time of referral (2018 Sep) (a),(e),(i), before treatment with nintedanib (2019 Apr) (b), (c), (f), (g), (j), (k)), and 7 months after treatment with nintedanib (2020 Jan) (d), (h), (l). [Correction added on 31 March 2021, after first online publication: The dates at the top of Figure 1 have been corrected from, ‘September 201X’, ‘April 201X+1’, and ‘January 201X+2’ to ‘September 2018’, ‘April 2019’, and ‘January 2020‘, respectively.]",TCA-12-1457-g003,NotMatch,NotMatch
PMC8088921,FIGURE 2,"(a) Computed tomography‐guided biopsy specimen from the left lower lobe showing non‐small cell carcinoma (hematoxylin–eosin). (b) Immunohistochemistry revealed that the tumor cell was positive for p40 expression. The tumor was immunohistochemically suspected to be squamous cell carcinoma. Scale bar, 50 μm",TCA-12-1457-g001,NotMatch,NotMatch
PMC8129122,Figure 1,Representative examples of p53 immunoexpression in cBCCs: (A) positive (90.6%) expression; (B) negative (2.3%) expression.,41598_2021_89906_Fig1_HTML,NotMatch,NotMatch
PMC8129122,Figure 2,Electrophoregram with representative examples of the TERTp mutations observed.,41598_2021_89906_Fig2_HTML,NotMatch,NotMatch
PMC8196200,Figure 1,The association between age and skin cancer’s vertical dimension.,41598_2021_91942_Fig1_HTML,NotMatch,NotMatch
PMC8196200,Figure 2,"Comparison of skin cancer’s vertical dimension (A) and its surface area (B), as observed between sexes.",41598_2021_91942_Fig2_HTML,NotMatch,NotMatch
PMC8343475,Figure 1,"(A) NBCC, BS IV; (B) IBCC, BS IV; (C) NBCC, BS III; (D) IBCC, BS III. Anti-MMP-1 antibody immunostaining: (A and B) ×200. Anti-MMP-13 antibody immunostaining: (C and D) ×200. BS: Breslow score; IBCC: Infiltrative basal cell carcinoma; MMP: Matrix metalloproteinase; NBCC: Nodular basal cell carcinoma",RJME-61-4-1221-fig1,Match,NotMatch
PMC8343475,Figure 2,(A) Distribution of cases depending on CS TEC MMP-1 and tumor type; (B) Distribution of cases depending on CS TEC MMP-1 and pT category; (C) Distribution of cases depending on CS TEC MMP-1 and BS; (D) Distribution of cases depending on CS ISC MMP-1 and tumor type; (E) Distribution of cases depending on CS ISC MMP-1 and pT category; (F) Distribution of cases depending on CS ISC MMP-1 and BS. BS: Breslow score; CS: Composite score; ISC: Inflammatory stromal component; MMP-1: Matrix metalloproteinase-1; pT: Primary tumor; TEC: Tumoral epithelial component,RJME-61-4-1221-fig2,NotMatch,NotMatch
PMC8343475,Figure 3,(A) Distribution of cases depending on CS TEC MMP-13 and tumor type; (B) Distribution of cases depending on CS TEC MMP-13 and pT category; (C) Distribution of cases depending on CS TEC MMP-13 and BS; (D) Distribution of cases depending on CS ISC MMP-13 and tumor type; (E) Distribution of cases depending on CS ISC MMP-13 and pT category; (F) Distribution of cases depending on CS ISC MMP-13 and BS. BS: Breslow score; CS: Composite score; ISC: Inflammatory stromal component; MMP-13: Matrix metalloproteinase-13; pT: Primary tumor; TEC: Tumoral epithelial component,RJME-61-4-1221-fig3,NotMatch,NotMatch
PMC8343475,Figure 4,(A) Distribution of CS for MMP-1 and MMP-13 in TEC; (B) Distribution of CS for MMP-1 and MMP-13 in ISC. CS: Composite score; ISC: Inflammatory stromal component; MMP: Matrix metalloproteinase; TEC: Tumoral epithelial component,RJME-61-4-1221-fig4,NotMatch,NotMatch
PMC8086475,Fig. 1.,"Integration of the Fast Raman device in the pathway of Mohs surgery. Step 1: tissue excision, mapping to maintain orientation, washing and blotting to remove superficial blood. Step 2: Analysis by Fast Raman device – output is presented as an image with BCC presented in red colour and highlighted by a green circle Step 3: Frozen section histology.",boe-12-4-2015-g001,NotMatch,NotMatch
PMC8086475,Fig. 2.,"Confusion matrix for the support vector machine (SVM) classification model generated via 5-fold cross validation. The model was trained and validated with spectra acquired intra-operatively during the study. The Healthy group contains spectra of dermis, epidermis, inflamed dermis, fat and muscle. The Contaminants group contains spectra of surgical ink and substrate. Number of spectra for each group presented in parenthesis.",boe-12-4-2015-g002,NotMatch,NotMatch
PMC8086475,Fig. 3.,"Typical examples of concordant BCC-negative diagnoses by Fast Raman analysis and frozen section histology. Fast Raman analysis of an: a) nose layer, b) cheek layer, c) lip layer, d) eyelid layer, e) forehead layer, f) eyebrow layer. The most relevant frozen sections, showing the majority of the resection surface are included as reference. Scalebars: 5 mm.",boe-12-4-2015-g003,NotMatch,NotMatch
PMC8086475,Fig. 4.,"Typical cases of BCC-positive Fast Raman diagnoses declared negative by frozen section histology. Fast Raman analysis of tissue specimens excised from the following anatomical locations: a) lip, b) eyelid, c) nose. The most relevant frozen H&E sections are included. Tissue structures which have been incorrectly detected as BCC and are highlighted in the inset: a) incipient hair follicles; b) incipient hair follicles; c) inflammation. Scalebars: 5 mm.",boe-12-4-2015-g004,NotMatch,Match
PMC8086475,Fig. 5.,"Typical examples of concordant BCC-positive diagnoses by Fast Raman analysis and frozen section histology. Fast Raman analysis of an a) nodular BCC from nose, b) superficial BCC from eyelid, c) infiltrative BCC from nose. The most relevant frozen section, showing the location of the residual tumour for each Fast Raman analysis. Tumours are presented as red segments in the Fast Raman map and are highlighted by green circles. Scalebars: 5 mm.",boe-12-4-2015-g005,NotMatch,NotMatch
PMC8086475,Fig. 6.,"Simulation of reduction of Fast Raman measurement time by addition of noise to Raman spectra. Representative tissue specimens: a) and b) BCC-positive; c) and d) BCC-negative. Measurement time: 30 minutes: 2s/spectrum in all rounds; 26 minutes: 1 s/spectrum in Round 1, 2 s/spectrum in Rounds 2 and 3; 21 minutes: 1 s/spectrum in Round 1 and 2, 2 s/spectrum in Round 3; 20 minutes: 1s/spectrum in all rounds. The locations of tumours are highlighted by green circles. White arrowheads highlight changes in the Fast Raman maps that are caused by the addition of noise. Scalebar: 5 mm.",boe-12-4-2015-g006,NotMatch,NotMatch
PMC8232838,Figure 1,Histological subtypes of ductal carcinoma in situ.,BCTT-13-409-g0001,NotMatch,NotMatch
PMC8232838,Figure 2,Histological subtypes in upstaged cases (final pathology confirming invasive or microinvasive patterns).,BCTT-13-409-g0002,NotMatch,NotMatch
PMC8232838,Figure 3,Sentinel lymph node biopsy results in patients with ductal carcinoma in situ.,BCTT-13-409-g0003,NotMatch,NotMatch
PMC8200622,Figure 1,Distribution of patients by gender,CHSJ-47-01-75-fig1,NotMatch,NotMatch
PMC8200622,Figure 2,Distribution of patients by living environment,CHSJ-47-01-75-fig2,NotMatch,NotMatch
PMC8200622,Figure 3,Distribution of patients by age,CHSJ-47-01-75-fig3,NotMatch,NotMatch
PMC8200622,Figure 4,Distribution of cases by margin invasion,CHSJ-47-01-75-fig4,NotMatch,NotMatch
PMC8200622,Figure 5,Distribution of cases by histopathological subtype,CHSJ-47-01-75-fig5,NotMatch,NotMatch
PMC8200622,Figure 6,Correlation between histopathological subtype and margin invasion,CHSJ-47-01-75-fig6,NotMatch,NotMatch
PMC8200622,Figure 7,Distribution of cases by location,CHSJ-47-01-75-fig7,NotMatch,NotMatch
PMC8200622,Figure 8,Distribution of cases by risk areas,CHSJ-47-01-75-fig8,NotMatch,NotMatch
PMC8200622,Figure 9,Correlation between location of the disease and living environment,CHSJ-47-01-75-fig9,NotMatch,NotMatch
PMC8200622,Figure 10,Distribution of patients by secondary diagnosis,CHSJ-47-01-75-fig10,NotMatch,NotMatch
PMC8200622,Figure 11,Table of performed correlations,CHSJ-47-01-75-fig11,NotMatch,NotMatch
PMC8200622,Figure 12,Correlation between tumor type and area of residence,CHSJ-47-01-75-fig12,NotMatch,NotMatch
PMC8200622,Figure 13,Correlation between margin invasion and gender,CHSJ-47-01-75-fig13,NotMatch,NotMatch
PMC8269292,Figure 1,"(a) A brown-black plaque on the chest of a 51-year-old female patient. The lesion has a maximum diameter of 0.6 cm. Histology set the diagnosis of a superficial BCC; (b) dermatoscopy confirmed our observations for low-risk neoplasms. Pigmentation was the striking feature in this tumor with leaf-like structures at the periphery (white asterisks), concentric structures (white circle), and a hint of telangiectasias (white arrow).",cancers-13-03208-g001,NotMatch,NotMatch
PMC8269292,Figure 2,"(a) A pinkish nodule on the left temple of a 66-year-old male patient with dark skin phototype and a maximum diameter of 1.3 cm, histopathologically diagnosed as a mixed BCC (nodular and metatypical). Due to anatomic location and size, the lesion was treated as a high-risk tumor for local recurrence; (b) dermatoscopic evaluation was in line with histology. A combination of arborizing (pink asterisk) and hairpin (black circle) vessels was evident. White, shiny linear structures (white arrows) were also obvious on the lesion’s surface. Finally, white, perifollicular circles along with central yellow clods were dermatoscopically apparent (black arrows).",cancers-13-03208-g002,NotMatch,NotMatch
PMC8225846,Figure 1,"Distribution of somatic variants across the mutated genes. Each row represents a gene and each column corresponds to individual samples. When multiple mutations were present in a gene, only the pathogenetic or probable pathogenetic mutation was considered and shown in the diagram generated with Oncoprinter in cBioPortal tool.",41598_2021_92592_Fig1_HTML,NotMatch,NotMatch
PMC8225846,Figure 2,"Mutational profiles interpreted with protein annotation. The protein figure was generated with MutationMapper in cBioPortal tool. Alterations occurring two and/or more times are specified in the protein domains. (a) PTCH1: the sterol-sensitive and Patched family functional protein domains are represented by green and red boxes, respectively. (b) TP53: the transactivation, DNA-binding and tetramerization domains are represented by green, red and blue boxes, respectively. (c) CSMD1: the CUB and SUSHI domains are represented by green and red boxes, respectively. (d) NOTCH1: the EGF-like domains are represented by green boxes. (e) DPP10: the dipeptidyl peptidase N-terminal domain is represented by green box.",41598_2021_92592_Fig2_HTML,NotMatch,NotMatch
PMC8225846,Figure 3,Two-dimensional principal component analysis (PCA) of genetic variations among superficial and nodular subtypes. Each sample was characterized as a distinct dot in a vector space. PTCH1 mutations characterized the superficial BCC types that clustered on the top right of the graph (PTCH1 arrow). Over 47% of the variance in genetic profile data sets were accounted for by the first two components: PC1 (29%) and PC2 (18%).,41598_2021_92592_Fig3_HTML,NotMatch,NotMatch
PMC8293240,Figure 1,Clinical features of the “Case 1” lesion.,dermatopathology-08-00032-g001,NotMatch,NotMatch
PMC8293240,Figure 2,"(A) Clinical features of the “Case 2” lesion, well circumscribed, symmetrical, smooth bordered, skin-colored pinkish or brown, at the level of the passage from the tip to the right nasal wing. (B) Dermoscopic features of TB with arborizing vessels and teangiectasias.",dermatopathology-08-00032-g002,NotMatch,NotMatch
PMC8293240,Figure 3,"Proliferation of numerous small and irregular nests of basaloid cells with no obvious connection to the epidermis (hematoxylin and eosin, original magnification, (A) 40× (B) 100×).",dermatopathology-08-00032-g003,NotMatch,NotMatch
PMC8293240,Figure 4,"Proliferation of large nests of basaloid cells without connection to the epidermis (hematoxylin and eosin, original magnification, (A) 40× (B) 100×).",dermatopathology-08-00032-g004,NotMatch,NotMatch
PMC8375545,Graph 1,Distribution of malignancies,IJD-66-284-g001,NotMatch,NotMatch
PMC8375545,Figure 1,"Pigmented basal cell carcinoma (BCC) over medial canthus of eye (a), BCC over trunk (b), BCC near outer canthus of left eye (c), Ulcerative BCC over temporal aspect of scalp (d), BCC over popliteal fossa (e), BCC over dorsum of hand (f)",IJD-66-284-g002,NotMatch,NotMatch
PMC8375545,Figure 2,"Squamous cell carcinoma (SCC) secondary to draw string dermatitis over waist (a), Verrucous SCC over back (b), SCC over sole (c), SCC over neck in a patient of albinism (d), SCC over face in a patient of xeroderma pigmentosum (e and f)",IJD-66-284-g003,NotMatch,NotMatch
PMC8375545,Figure 3,"Acral lentigenous melanoma over sole (a), Superficial spreading melanoma over chest (b), Acral lentigenous melanoma with pigmentation & ulceration over sole (c and d)",IJD-66-284-g004,NotMatch,NotMatch
PMC8375545,Figure 4,"Diffuse large B cell lymphoma over legs (a, b), Peripheral T cell lymphoma involving lower abdomen and right thigh (c), Anaplastic T cell lymphoma over lower limb (d)",IJD-66-284-g005,NotMatch,NotMatch
PMC8375545,Figure 5,"Cutaneous metastasis secondary to carcinoma of breast over chest (a), Cutaneous metastasis secondary to carcinoma cervix over vulva (b), Cutaneous metastasis secondary to papillary carcinoma of thyroid over chest (c), Cutaneous metastasis secondary to carcinoma breast over abdomen (d)",IJD-66-284-g006,NotMatch,NotMatch
PMC8375545,Graph 2,Site wise distribution,IJD-66-284-g007,NotMatch,NotMatch
PMC8375545,Graph 3,Predisposing factors,IJD-66-284-g008,NotMatch,NotMatch
PMC8375545,Figure 6,"(a-f). Dermoscopy (10x polarised mode) revealed combination of colours with white shiny streaks, maple leaf like structure (blue arrow) arborizing vessels (green arrow) suggestive of basal cell carcinoma (a), keratinised whitish structure (green arrow, b), polymorphous vascular structure (green arrow) and red dot (black arrow) (c) suggestive of squamous cell carcinoma. Parallel ridge (blue arrow) and lattice pattern (red arrow) (d), brown globules (yellow arrow) (e), white structureless area (blue arrow) (f) suggestive of melanoma",IJD-66-284-g009,NotMatch,Match
PMC8375545,Figure 7,"(a-f). Histopatholgy: nodule over face revealed basaloid cells arranged in nests & cords, nodular BCC (a, nodule over forehead revealed basaloid tumor cells with with squamous differentiation & keratin filled cyst, keratotic BCC (b) nodule over forehead revealed basaloid cells with intra & extracellular brown black coarse pigmentation, pigmented BCC (c) nodule over hand revealed tumor mass in dermis & infiltrating deeper tissues along with desmoplastic stroma, fibro-epithelial BCC (d), mass over forehead revealed basaloid cells arranged in anastomosing cords and trabeculae, adenoid BCC (e and f)",IJD-66-284-g010,NotMatch,NotMatch
PMC8375545,Figure 8,"(a-d). Histopathology from growth over sole revealed hyperplastic epidermis, dermis shows haemorrhage, necrosis & keratin pearl formation with surrounding malignant squamous cells suggestive of squamous cell carcinoma (a and b) histopathology from lesion over sole revealed sheets of tumor cells with large, irretgular pleomorphic, hyperchromatic nuclei & prominent nucleoli, condensation of chromatin & intracytoplasmic melanin pigment suggestive of malignant melanoma",IJD-66-284-g011,NotMatch,NotMatch
PMC8375545,Figure 9,"(a-d). Histopatholgy: nodule over trunk revealed monomorphic population of lymphoid cells in dermis, cutaneous lymphoma(a);plaque over back revealed collection of eosinophil, lymphocyte, large abnormal cells with irregular hyperchromatic multilobulated nuclei, mycosis fungoides (b); lesion over leg revealed tumor cells in cords and nest in dermis; metastasis of malignancy stomach(c); nodule over chest revealed tumor mass arranged in complex branching papillae with central core of occasional Psammoma bodies in dermis; metastasis of papillary carcinoma of thyroid",IJD-66-284-g012,NotMatch,NotMatch
PMC8630439,Figure 1,"Keratotic basal cell carcinoma with perineural invasion. Hematoxylin and eosin staining of tissue was from an elderly Caucasian female, with a lesion on the face. Magnification, x200.",etm-23-01-10982-g00,NotMatch,Match
PMC8630439,Figure 2,"Mixed basal cell carcinoma with superficial multicentric and nodular components, associated with dense inflammatory infiltrate. Hematoxylin and eosin staining of tissue from elderly Caucasian male, with a lesion on the head and neck region. Magnification, x40.",etm-23-01-10982-g01,NotMatch,Match
PMC8630439,Figure 3,"Partial view of a basosquamous carcinoma. Hematoxylin and eosin staining of elderly Caucasian male, with a lesion on the face. Magnification, x100.",etm-23-01-10982-g02,NotMatch,Match
PMC8689684,"
Figure 1
",Nodular skin tumor of the back of a 69-year-old man.,rjab560f1,NotMatch,NotMatch
PMC8689684,"
Figure 2
",H–E × 2: Collision tumor: in the right side of the photo is shown the dermal squamomelanocytic tumor component and in the left side the superficial basal cell carcinoma (H–E stain ×2 magnification).,rjab560f2,NotMatch,NotMatch
PMC8689684,"
Figure 3
",H–E × 10: Higher magnification of the dermal squamomelanocytic tumor showing admixed malignant malanocytes and keratinizing squamous cell carcinoma cells (H–E stain ×10 magnification).,rjab560f3,NotMatch,Match
PMC8689684,"
Figure 4
",HMB45 × 4: HMB45 immunostain highlights the malignant melanocytic component ( ×10 magnification).,rjab560f4,NotMatch,Match
PMC8689684,"
Figure 5
",p63 × 10: p63 immunostain confirms the presence of squamous cell carcinoma component (×10 magnification).,rjab560f5,NotMatch,Match
PMC8689684,"
Figure 6
",Axillary lymph node dissection scar.,rjab560f6,NotMatch,NotMatch
PMC8802970,Figure 1,Clinical types of BCC,PDIA-38-44030-g001,NotMatch,NotMatch
PMC8802970,Figure 2,BCC sites,PDIA-38-44030-g002,NotMatch,NotMatch
PMC8848273,Figure 1,"(a) BCC: clinical aspect showing a nodular, exophytic tumor with central ulceration and hemorrhagic crusts located at facial level; (b) Gray scale US: well-defined, exophytic, oval-shaped lesion located in the dermis; notice the hypoechoic inhomogeneous structure, corresponding to the histological nodular BCC type with cystic differentiation (central hypoechoic space) and characteristic hyperechoic spots; the DI was 5.5 mm; (c) Color Doppler US: increased blood flow within the lesion, displaying an arborizing pattern and two vascular pedicles; (d) Strain elastography: increased rigidity of the lesion, suggesting malignant lesion; (e) Histology: macro- and micronodular infiltrate of basaloid cells with palisade arrangement and fibrous stroma containing inflammatory cells; the DI (Breslow) was 5.4 mm; the tumor was a nodular-type BCC (nodulocystic variant); (f and g) Histology of different cases with microcalcifications corresponding to the US-identified hyperechoic spots within the tumor (f) and keratin formation (g). HE staining: (e) ×100; (f and g) ×400. BCC: Basal cell carcinoma; DI: Depth index; HE: Hematoxylin–Eosin; US: Ultrasound",RJME-62-2-545-fig1,NotMatch,Match
PMC8848273,Figure 2,Tumor depth measurement Quality Bar Graphic,RJME-62-2-545-fig2,NotMatch,NotMatch
PMC8848273,Figure 3,Correlation between the ultrasonographic and histological tumor thickness index,RJME-62-2-545-fig3,NotMatch,NotMatch
PMC8775292,Fig 1,"Examples of the HE sections of the standard histologic examination at 4 levels (HE 1–4, upper panel from left to right) and the HE sections of the 4 additional levels (HE 5–8, lower panel from left to right). In this example, an additional nodular component was found in level 6, 7 and 8.",pone.0256149.g001,NotMatch,NotMatch
PMC8969878,Figure 1.,The annual number of total new basal cell carcinoma cases and eligible cases enrolled to the study during 10-year study period.,dr-14-1-9413-g001,NotMatch,NotMatch
PMC8969878,Figure 2.,Age distribution of basal cell carcinoma patients (n=278).,dr-14-1-9413-g002,NotMatch,NotMatch
PMC8969878,Figure 3.,Provisional diagnosis other than basal cell carcinoma (n=53).,dr-14-1-9413-g003,NotMatch,NotMatch
PMC9098340,Figure 1,"Distribution of basal cell carcinoma tumours on the body (n = 244, n = 2 location not stated).",JSC2022-8443867.001,NotMatch,NotMatch
PMC9098340,Figure 2,"Distribution of basal cell carcinoma tumours on the face (n = 126). The area in red is the high-risk mask area of the face (n = 87), and the blue area signifies the rest of the face, which is a medium risk (n = 39).",JSC2022-8443867.002,NotMatch,NotMatch
PMC9205873,Figure 1,"Proportion of the histologic subtype of basal cell carcinoma according to the location (a) divided into H&N, trunk, extremities, (b) among H&N lesions. H&N head and neck.",41598_2022_14533_Fig1_HTML,NotMatch,NotMatch
PMC8947530,Figure 1,Nodular pigmented BCC: clinical aspect (a) and dermoscopic (Dermlite®) appearance showing small bluish-gray dot-like structures (indicated my black arrows) and bluish-brown globules (indicated by black circles) accompanied by arborized vessels (indicated by white arrows) (b) (own collection).,diagnostics-12-00735-g001,NotMatch,NotMatch
PMC8947530,Figure 2,"Pigmentary BCC: clinical aspect (indicated by black circle) (a) and videodermatoscopic appearance using Visiomed microDERM AG® (×30) targeting “maple leaf-like” elements (indicated by black arrows) which are brown homogeneous structures that are not associated with the pigment network, and their morphology is reminiscent of leaves, with brown extensions in the periphery, always without connection to the pigmentary network or adjacent pigmentary areas; similarly, “spoke−wheel-like” pigmentary structures (indicated by white circles) as radially distributed brown structures, with a central axis and with brown radial projections, are identified (b) (own collection).",diagnostics-12-00735-g002,NotMatch,NotMatch
PMC8947530,Figure 3,"Example of superficial BCC examination: the clinical appearance of an oval, pink-translucent, ulcerated tumour located on the photoexposed cervical area (indicated by black circle) (a), videodermoscopic aspect (using Visiomed microDERM AG®—×15) showing a small ulceration (indicated by a black arrow) (b), HFUS examination (using Dermascan C® 20 MHz) with evidence of a subepidermal, well-demarcated, linear hypoechoic mass (indicated by orange circle) representing the superficial basal cell carcinoma (c) (own collection).",diagnostics-12-00735-g003a,NotMatch,NotMatch
PMC8947530,Figure 4,"Pigmentary nodular BCC at videodermoscopic examination (using Visiomed microDERM AG® × 15 magnification) showing bright red, sharp in focus and large arborizing vessels (indicated by black arrows), and blue gray globules (indicated by black circles), with no presence of the pigmentary network (a). Extensive superficial malignant melanoma (Clark III Breslow 1.1 mm, pT1b Nx, Pn0) with videodermoscopic appearance (using Visiomed microDERM AG® ×30 magnification), which indicates an asymmetric tumour lesion, with a longitudinal diameter greater than 6 mm (D1/D2 = 13.4/6.7 mm), with the presence of an atypical pigmented network with irregular blotches (indicated by black circles), with radial streaming (parallel linear extension at the periphery indicated by black arrows) and regression, with the white area lighter than the surrounding skin (indicated by white circles) (b) (own collection).",diagnostics-12-00735-g004,NotMatch,NotMatch
