pmcid,label,caption,graphic,disease,modality
PMC6153581,Fig. 8,"Highly differentiated SCC, in a 72-year-old man. Dermoscopy shows keratin with blood spots in the center and white circles in the periphery. Image courtesy of the Vienna Dermatologic Imaging Research Group, Department of Dermatology, Medical University of Vienna, Austria.",11864_2018_573_Fig8_HTML,NotMatch,NotMatch
PMC6420945,Figure 1,"1a- 1b, Clinical view of nodular formation with an erosive, bleeding surface, located next to the left cricothyroid area; 1c, Preoperative finding: outlining the surgical margins;",OAMJMS-7-698-g001,NotMatch,NotMatch
PMC6420945,Figure 2,"2a-2b, Intraoperative view: elliptical excision of the nodular lesion; 2c, Postoperative finding: surgical defect closed by single interrupted sutures",OAMJMS-7-698-g002,NotMatch,NotMatch
PMC7360904,Fig. (1),"epithelial cells with an organoid and trabecular pattern with positive immunohystochemical staining for chromogranin A (A), and negative for thyroglobulin (B).",EMIDDT-19-226_F1,NotMatch,NotMatch
PMC7360904,Fig. (2),epithelial cells with an organoid and trabecular pattern with positive immunohystochemical staining for calcitonin (A-B).,EMIDDT-19-226_F2,NotMatch,NotMatch
PMC6420332,Figure 1,Basal cell carcinoma with amyloid deposits on the left arm.Distant (a) and closer (b) views of the extensor aspect of his left arm near the elbow of a 68-year-old man show a basal cell carcinoma associated with secondary localized cutaneous amyloid deposits presenting as a six by six millimeter flesh-colored nodule; the periphery of the nodule is outlined by purple lines (black arrow).,cureus-0011-00000003879-i01,NotMatch,NotMatch
PMC6420332,Figure 2,"Microscopic features of basal cell carcinoma with amyloid deposits: dermal tumor.Distant (a) and closer (b) views of the biopsy specimen show sparse orthokeratosis (solid black circle) and a thin epidermis with flattening of the rete ridges (between the black triangles). Atypical basaloid tumor cells are present in the dermis as strands and nodular aggregates (black arrows) (hematoxylin and eosin: a, x 2; b, x 10).",cureus-0011-00000003879-i02,NotMatch,NotMatch
PMC6420332,Figure 3,"Microscopic features of basal cell carcinoma with amyloid deposits: amyloid.Distant (a) and closer (b) views of the biopsy specimen show marked deposition of amyloid, presenting amorphous material in the dermal stroma between the tumor aggregates (solid black stars) (hematoxylin and eosin: a, x 4; b, x 10).",cureus-0011-00000003879-i03,NotMatch,Match
PMC6420332,Figure 4,"Microscopic features of basal cell carcinoma with amyloid deposits: solar elastosis.Distant (a) and closer (b) views of the biopsy specimen show solar elastosis presenting as homogenous alteration of the collagen in the dermis above the tumor and below the epidermis (solid black diamonds) (hematoxylin and eosin: a, x 10; b, x 20).",cureus-0011-00000003879-i04,NotMatch,Match
PMC6486073,Graphic 1,"Distribution of the number of skin cancer cases, by subtype, according to
age group",abd-94-02-0157-g01,NotMatch,NotMatch
PMC6486073,Graphic 2,"Distribution of the number of diagnosed cases in relation to anatomical
location and gender",abd-94-02-0157-g02,NotMatch,NotMatch
PMC6518285,Figure 1,Diagram showing case selection process. RCM: reflectance confocal microscopy; BCC: basal cell carcinoma.,jcm-08-00449-g001,NotMatch,NotMatch
PMC6518285,Figure 2,"Superficial basal cell carcinoma. (A) Dermoscopy showing multiple, brown globules and dots, and leaf-like peripheral structures. (B) reflectance confocal microscopy (RCM) revealed the presence of sharply demarcated cords connected to the epidermis (white arrows), dark peritumoral clefting (red arrowheads), and peripheral palisading (white arrowhead), corresponding to the basaloid cords and aggregates seen on histopathology (hematoxylin and eosin (H&E) stain, magnification 4×) (C).",jcm-08-00449-g002,NotMatch,Match
PMC6518285,Figure 3,"Nodular basal cell carcinoma. (A) Dermoscopy image of a pigmented nodular basal cell carcinoma (nBCC) with blue-gray ovoid nests, brown globules, and arborizing vessels. (B) RCM revealed large, well defined tumor islands (TI), peritumoral clefting (red arrows), and clumped melanophages (green rectangle). (C) Histopathology showed large basaloid islands with palisading and stromal retraction in the dermis (H&E stain, magnification 4×). (D) Dermoscopy of hypopigmented nBCC with ulceration and arborizing vessels. (E) RCM showed large tumor islands (TI) with peripheral palisading and clefting (white arrows). (F) Histopathologic correlates of the structures seen through RCM (H&E stain, magnification 40×).",jcm-08-00449-g003,Match,Match
PMC6518285,Figure 4,"Infiltrative basal cell carcinoma. (A) Dermoscopy showing a hypopigmented lesion with structureless red shiny areas, chrysalis pattern, short fine telangiectasia, and erosion. (B) RCM showed multiple hyporefractile silhouettes, which appear as imprints (white arrows) outlined by bundles of bright collagen (red asterisks). (C) Histopathology shows tumor islands and strands that resemble the hyporefractile silhouettes observed through RCM (BerEP4 stain, magnification 4×).",jcm-08-00449-g004,NotMatch,NotMatch
PMC6551196,Figure 1,"Pigmented basal cell carcinoma on the nasal tip mimicking melanomasViews of the basal cell carcinoma (within the black circle) prior to biopsy, from the right side (A), frontal (B), and left side (C), of the nasal tip of a 74-year-old Hispanic woman demonstrate an ulcerated (blue arrows), black nodule (black arrows). A paramedian forehead flap was used to repair the wound following Mohs micrographic surgery; the right side (D), frontal (E), and left side (F) of her nasal tip show excellent healing of the flap (within red circle) and hypertrichosis (white arrows) from the tissue used to cover the surgical defect.",cureus-0011-00000004369-i01,NotMatch,NotMatch
PMC6551196,Figure 2,"Pigmented basal cell carcinoma on the left nasal bridge mimicking melanomaDistant (A), closer (B and C), frontal (A and B), and left side (C) views of a pigmented basal cell carcinoma (within the black circle) on the left nasal bridge of a 63-year-old Hispanic man. The tumor consists of black pigment (black arrows) adjacent to ulcerated (blue arrow) and intact red and flesh-colored areas.",cureus-0011-00000004369-i02,NotMatch,NotMatch
PMC6551196,Figure 3,Pigmented basal cell carcinoma (with concurrent seborrheic keratosis) masquerading as melanoma.Distant (A) and closer (B and C) views of a collision tumor consisting of a pigmented basal cell carcinoma that presented as a large ulcerated black nodule (black arrow) and a seborrheic keratosis (orange arrows) appearing as pigmented patches adjacent to the centrally located black nodule on the left breast of a 77-year-old woman. Distant (D) and closer (E) views of the left breast following a layered closure (white arrows) of the surgical wound. The tumor was cleared after one stage of Mohs micrographic surgery.,cureus-0011-00000004369-i03,NotMatch,NotMatch
PMC7065618,Figure 1,Schematic diagram of the optical coherence tomography angiography system used in the experiments,JBIO-12-e201900131-g001,NotMatch,NotMatch
PMC7065618,Figure 2,"Image processing steps. All sub‐figures are given as en face view maximum intensity projection images. Scale bar: 1 mm. A, Original optical coherence tomography angiography volume. B, Preprocessed volume. C, Segmented volume. D, Skeleton volume. E, Preprocessed volume with skeleton overlaid in green. F, Skeleton volume presented in vascular density heat map. G, Preprocessed volume presented in vascular density heat map. The lesion area is encircled by the white line. H, Heat map of the preprocessed volume with the lesion area (blue square) and healthy area (green) regions‐of‐interests. Bottom right: heat map scale for normalized vascular density",JBIO-12-e201900131-g002,NotMatch,NotMatch
PMC7065618,Figure 3,"Completely automatic and semi‐automatic lesion area determination. Scale bar: 1 mm. Each image is shown as an en face view of the vascular density (VD) generated heat map. The upper row (panels A, B, C) shows the results generated by the completely automatic algorithm with the lesion area encircled by a solid white line while the lower row (panels D, E, F) shows the results by the semi‐automatic method with the lesion area encircled by the dashed white line. Bottom left: heat map scale for normalized VD",JBIO-12-e201900131-g003,NotMatch,NotMatch
PMC7065618,Figure 4,"Validation of the automatic method using the nodular basal cell carcinoma case. Scale bar: 1 mm. A, optical coherence tomography angiography (OCTA) maximum intensity projection (MIP) image for the depth range between 0.1 and 0.5 mm below skin surface. B, Dermatoscopy image of the lesion. C, One biopsy image. Dark purple area in the center indicates the lesion. D, B scan given by OCT. C, OCTA MIP image for the depth range between 0.5 and 1 mm below skin surface. F, OCTA MIP image with depth color coding from 0.1 to 1 mm. G, vascular density heat map with the automatically determined lesion area encircled by the white line. The dotted white lines in (B) and (G) indicate the position of the cross section shown in (C) and (D)",JBIO-12-e201900131-g004,Match,NotMatch
PMC7065618,Figure 5,"Six patients' results of superficial basal cell carcinoma. One row for one patient. Scale bar: 1 mm. (A), (E), (I), (M), (Q), (U): En face view of depth‐color‐coded images given by optical coherence tomography angiography, depth range from 0.1 to 1 mm under the skin surface. (B), (F), (J), (N), (R), (V): En face maximum intensity projection (MIP) images for the depth range from 0.1 to 0.5 mm. (C), (G), (K), (O), (S), (W): En face MIP images for depth range from 0.5 to 0.1 mm. (D), (H), (L), (P), (T), (X): vascular density heat maps for all six cases with the automatically determined lesion area encircled by the white line",JBIO-12-e201900131-g005,NotMatch,NotMatch
PMC6545347,Fig 1,,gr1,Empty,Empty
PMC6545347,Fig 2,,gr2,Empty,Empty
PMC6592668,Figure 1,Nodular basal cell carcinoma-clinical aspect,CHSJ-45-01-116-fig1,Match,NotMatch
PMC6592668,Figure 2," Nodular basal cell carcinoma, col HE, ob X 40",CHSJ-45-01-116-fig2,Match,Match
PMC6592668,Figure 3," Nodular basal cell carcinoma with pigmented areas, col HE, ob X 40",CHSJ-45-01-116-fig3,Match,Match
PMC6592668,Figure 4,"Nodular basal cell carcinoma-dermoscopy: featureless areas, atypical red vessels, white-red structureless background, arborizing vessels, comma vessels and telangiectactic vessels",CHSJ-45-01-116-fig4,Match,NotMatch
PMC6592668,Figure 5," a,b. Pigmented basal cell carcinoma: pigmented islands, blue-gray globules and blue-gray ovoid nests; the pigmented distribution pattern with maple leaf-like structures and spoke wheel-like areas; arborizing vessels and white streaks/white areas ",CHSJ-45-01-116-fig5,NotMatch,NotMatch
PMC6594316,Figure 1,"
Histopathological analysis of perianal nodule biopsy. (a) Hematoxylin and Eosin (H&E) stain (original magnification 100x) showing anastomosing cords of basaloid cells with overlying connection to epidermis and stromal retraction. (b) Immunohistochemical staining for smooth muscle actin (original magnification 100x) showing diffuse, strong positivity. (c) Immunohistochemical staining for Ber-EP4 (original magnification 100x) showing diffuse, strong, membranous positivity.",CRIDM2019-6268354.001,NotMatch,Match
PMC6745442,Figure 1,Ulcerated lesions on the back on a large achromic patch of vitiligo,CCR3-7-1782-g001,NotMatch,NotMatch
PMC6745442,Figure 2,Close‐up of the lesions on the back,CCR3-7-1782-g002,NotMatch,NotMatch
PMC6745442,Figure 3,Three months after the surgery,CCR3-7-1782-g003,NotMatch,NotMatch
PMC6745442,Figure 4,"Histopathology of metatypical basal cell carcinoma showing cells with larger and more atypical nuclei, without evident peripheral palisade (HE, 400×)",CCR3-7-1782-g004,NotMatch,NotMatch
PMC6745442,Figure 5,"Focal area of nodular basal cell carcinoma (HE, 100×)",CCR3-7-1782-g005,Match,NotMatch
PMC6617868,Figure 1,"Nasal BCC, after previous marking of dermatoscopy and margin borders (a), and closure with a neighboring flap in transposition. (b) Result with 7 days of evolution.",JSC2019-4798510.001,NotMatch,NotMatch
PMC6617868,Figure 2,Lower eyelid BCC. (a) Aspect of the lesion. (b) Resection with margin and preparation of the eyebrow flap. (c) Immediate aspect. (d) Aspect with fifteen days of evolution.,JSC2019-4798510.002,NotMatch,NotMatch
PMC6617868,Figure 3,Patient with basal cell carcinoma of the left ear. (a) Boundaries and margins. (b) Retroauricular retail. (c) Immediate result. (d) Final appearance after 30 days.,JSC2019-4798510.003,NotMatch,NotMatch
PMC6976826,Figure 1,Distribution of Histopathological Subtypes of BCC,APJCP-20-2851-g001,NotMatch,NotMatch
PMC6976826,Figure 2,"Immunohistochemistry Staining Results of PTCH1 Expression. A, shows strong PTCH1 expression while B shows a negative staining of PTCH1",APJCP-20-2851-g002,NotMatch,NotMatch
PMC6976826,Figure 3.,"Distribution of PTCH1 Expression Age, Sex, Across Several Variables",APJCP-20-2851-g003,NotMatch,NotMatch
PMC6466859,Figure 1,"Percentage of positive tumours for CRABP1, Nestin, and Ephrin B2. Percentage of CRABP1- and Nestin-positive tumours for invasive margin (IM) of the tumour, the inflammatory infiltrate surrounding the tumour (IIF), and the tumour-stroma interaction (TSI) site within the core of the tumour (a and b). CRABP1 and Nestin positively stained cells classified into staining for positive tumours were classified into 4 groups: 0 (no expression), 1 (0-33% of cells positive), 2 (33-66% of cells positive), and 3 (>66% of cells positive, mean with standard deviation, c and d). Ephrin B2-positive tumours in % (e) and classified staining (mean with standard deviation) (f).",SCI2019-9320701.001,NotMatch,NotMatch
PMC6466859,Figure 2,"Herovici's stain of skin appendage tumours: stain of young (blue) and mature (pink) collagen (Herovici's stain), was used to allocate tumour stroma of skin appendage tumours as indicated by young collagen. The amount of cells that are present at either the invasive margin (IM) of the tumour, the inflammatory infiltrate surrounding the tumour (IIF), or the tumour-stroma interaction (TSI) site within the core of the tumour were determined for each tumour. Nodular basal cell carcinoma with stroma (blue indicating young collagen) within the tumour's stroma interface and at the tumour's invasive margin surrounded by its inflammatory interface (a, b). Adenoid basal cell carcinoma with blue stroma within the tumour surrounded by pink, mature collagen (c). Different stains of sclerosing basal carcinoma: blue young collagen largely present (d, f), almost absent (e) within the tumour and indicating the tumour margins (d) or invasive front (f) where tumour cells invade mature, pink collagen. Poroma with only mature (pink) collagen (g) in contrast to early porocarcinoma (h, l) with mixed blue and pink stroma and a margin of blue and pink (black arrow) and progressive porocarcinoma (l) with dominance of blue collagen with single fibers of pink collagen. Sebaceous carcinoma with tumour stroma as indicated by blue stained collagen ((i) and (m) with higher magnification).",SCI2019-9320701.002,Match,NotMatch
PMC6466859,Figure 3,"CRAPB1 expression profile: positive staining of cells lining up at the epidermal-dermal interface region and the papillary dermis ((a), black arrows) and the dermal papilla (b) and strong staining of sebaceous gland cells, their septates and within the surrounding papillary dermis (c). Nodular basal cell carcinoma with staining at the tumour-stroma interaction (TSI) site within the core of the tumour (as indicated by black arrows, (d)) but also within the tumour (e). Superficial basal cell carcinoma with CRABP1-positive cells at the tumour-stroma interaction site ((f), black arrows). Sclerosing basal cell carcinoma with strong expression within the inflammatory infiltrate located within the core of the tumour and its tumour-stroma interaction (TSI) site (g). Well-differentiated sebaceous carcinoma (h) with positive cells located at the tumour-stroma interaction (TSI) site within the core of the tumour and at the invasive margin (IM) of the tumour in an early porocarcinoma (i).",SCI2019-9320701.003,Match,NotMatch
PMC6466859,Figure 4,"Nestin expression profile: scalp skin with positive staining of the outer root sheath cells of the hair follicle (a) in the dermal interface of sebaceous glands (b) and the tumour-stroma interaction (TSI) site within the core of the tumour and the invasive margin (IM) of the tumour of a nodular basal cell carcinoma (c, d), adenoid (e), and nodular (f) basal cell carcinoma with Nestin-positive cells at the invasive margin (IM) of the tumour (black arrows). Expression in early porocarcinoma at the invasive margin (g and h) but also within the inflammatory infiltrate ((h), as indicated by black arrows and the two small pictures below in higher magnification). Low-grade sebaceous carcinoma (i) with positive basal cells within the tumour stroma interface (TSI).",SCI2019-9320701.004,Match,NotMatch
PMC6466859,Figure 5,"Ephrin B2C expression profile: hair follicle with precortical (black arrow) and inner root sheath staining (a). Sclerosing BCC with positive cells at the tumour-stroma interaction (TSI) site within the core of the tumour together with plasma cells, infiltrating and surrounding BCCs as well (b). Infiltrating BCC (c) and adenoid BCC (d) are mainly negative except for a few cells at the tumour-stroma interaction (TSI) site. Early porocarcinoma (e) and late porocarcinoma showed both expressions (f). Similar results for sebaceous tumours: sebaceous adenoma (g) is weakly positive in contrast to an undifferentiated sebaceous gland carcinoma (h). Pilomatricoma with positive transitory cells (i).",SCI2019-9320701.005,NotMatch,NotMatch
PMC6466859,Figure 6,"Ephrin B2N expression profile: in unaffected skin, the hair follicle shows positive staining of the inner root sheath and bulbus (a and b). Cells of the hair follicle showed strong cytoplasmic with weaker nuclear staining (c). Adenoid BCC with positive cells at the tumour-stroma interaction (TSI) site within the core of the tumour (black arrows) (d) and positive cells at the invasive margin (IM) of superficial BCC (e). Strong staining of a sclerosing BCC (f).",SCI2019-9320701.006,NotMatch,NotMatch
PMC6906959,Figure 1,"A – Basal cell nodular carcinoma: 1) dermoscopy: singular, irregular branched and arborizing vessels (black triangle), grey-blue dots (white dotted arrow) and globules (white triangle), 2) histopathology: compartments of individual cell groups and radiant bands between them (black arrows), 3) ultrasonography: chaotically distributed areas with intensified echogenicity (white arrows). B – Blue naevus: 1) dermoscopy, 2) histopathology, 3) ultrasonography. Pigment located superficial (black dot), pigment located in deeper areas of the dermis (black triangle). C – Seborrheic wart: 1) dermoscopy: milia-like cysts (black arrow), 2) histopathology: round intralesional cysts of loose keratin (black arrow), 3) ultrasonography: hyperechoic strands (white arrow). D – Xanthogranuloma juvenile: 1) dermoscopy: white hyperkeratotic areas (black arrow), structureless light yellow and brown areas (black triangles), 2) clinical image, 3) ultrasonography: the thickest part of the entry echo in the centre (single white arrow), thin entry echo on the edges (two white arrows). E – Spitz naevus: 1) dermoscopy: dark brown/black areas (white triangles), structureless blue/red/white areas (white arrow), 2) clinical image, 3) 50 MHz ultrasonography: clearly hypoechoic conical structure (white star), wide basis (two white stars), 4) 20 MHz ultrasonography. F – Dermatofibroma: 1) dermoscopy: network with thin lines (black arrow), shades of grey and white (black triangle), 2) histopathology: poorly defined proliferation of “fibrohistiocytic” cells within the dermis, 3) 50 MHz ultrasonography: poorly marked intradermal hypoechogenic area, 4) 20 MHz ultrasonography. G – Compound naevus: 1) dermoscopy, 2) histopathology, 3) 50 MHz ultrasonography, 4) 20 MHz ultrasonography. Pigment located in the upper layers of the dermis (black dot), pigment located in the deeper layer of the dermis (black square), parts of hair follicle (white arrow). H – Pyogenic granuloma: 1) dermoscopy, 2) histopathology: thick layer of epidermis on the surface of the lesion (black triangle), blood clots (black arrow), 3) 50 MHz ultrasonography, 4) 20 MHz ultrasonography: thick central hyperechogenic entry area (white triangle), blood clots visible in the HFUS as minor hyperechoic foci inside the nodule (white arrow)",PDIA-36-89505-g001,NotMatch,NotMatch
PMC6910794,Figure 1,Pendulating tumour on the sole – eccrine poroma,OAMJMS-7-2988-g001,NotMatch,NotMatch
PMC6910794,Figure 2,"Histopathology of eccrine poroma with solid tumor formations composed of monomorphous cells, well circumscribed (HE x 2)",OAMJMS-7-2988-g002,NotMatch,NotMatch
PMC6910794,Figure 3,Complete healing after R0 surgery,OAMJMS-7-2988-g003,NotMatch,NotMatch
PMC6978755,Fig. 1,Patient before treatment with vismodegib,WO-23-91540-g001,NotMatch,NotMatch
PMC6978755,Fig. 2,Patient after treatment with vismodegib,WO-23-91540-g002,NotMatch,NotMatch
PMC6904495,Figure 1,"OCA of normal skin, peri-tumoral region and BCC lesion itself prior to PDT. (A) Skin photograph showing the locations of OCA imaging: normal facial cheek skin distant from the tumor and treatment field (green square), visually inflamed peri-tumoral region (blue square) that was included in the 5-mm margin illumination field, and BCC tumor center (yellow square). (B) Corresponding en-face OCA images, showing increasing density and disordered microvascular network in the progression from normal to tumorous tissue.",41598_2019_55215_Fig1_HTML,NotMatch,NotMatch
PMC6904495,Figure 2,"The most common primary BCC subtypes as seen on en-face OCA images, demonstrating the spectrum varying from sparse thick vessels (green arrows) to thin vessels with high vascular density. (A) Nodular BCC-1 with telangiectasia, same BCC-2 without telangiectasia, and BCC-3 with necrotic core region (black block); (B) superficial BCC; (C) sclerosing BCC. En-face OCA images were taken in regions indicated by white squares in clinical photographs. Histology images were taken in regions indicated by black lines. The yellow arrows in OCA (dotted oval) and histology images indicate necrotic regions (N). Histologically, BCC is characterized by a proliferation of atypical basaloid cells (BC) in the reticular dermis (RD) parallel to the epidermal (E) surface.",41598_2019_55215_Fig2_HTML,NotMatch,NotMatch
PMC6904495,Figure 3,"Quantitative assessment of pre-PDT vascular density in normal skin, peri-tumoral BCC tissues and the four (nodular, nodular with necrotic core, superficial and sclerosing) BCC subtypes. (A) Averaged vascular density results for the various regions derived from en-face OCA images; asterisk (*) indicates a statistically significant difference between normal skin and nodular without necrotic core, superficial and sclerosing BCC subtypes (Bonferroni post-hoc test for multiple comparisons, with p < 0.001); double asterisk (**) indicates a statistically significant difference between nodular BCC with necrotic core from nodular without necrotic core, superficial and sclerosing BCC subtypes (p < 0.001). (B) Maximal distance to the nearest skeletonized vessel results for the various BCC subtypes derived from en-face OCA images; asterisk (*) indicates a statistically significant difference between nodular BCC without necrotic core and normal skin and all the other BCC subtypes (Bonferroni post-hoc test for multiple comparisons, with p < 0.001). The results are shown as mean ± SD. (C) ROC for differentiating normal face skin from nodular, superficial and sclerosing BCC subtypes based on OCA’s vascular density metric. (D) ROC for differentiating the nodular-with-necrotic-core BCC (more clinically challenging pathology) from the more treatable superficial, sclerosing and nodular subtypes based on OCA’s vascular density metric. Dots on the curve represent possible choices of the OCA vascular threshold value (Pth), yielding the listed false negative (FN), false positive (FP) and diagnostic accuracy (DA) values. The curves look stepwise because of limited sample size. The two sets of values on each curve represent possible choices of the vascular density threshold which provide similar diagnostic accuracies but different percentage of false positive and false negative outcomes. Bold font numbers indicate the choices of the vascular density Pth using a trade-off between the percentages of the FN and FP outcomes and the greatest DA. Additional abbreviations: ROC - receiver operating characteristic; AUC - area under ROC curve.",41598_2019_55215_Fig3_HTML,NotMatch,NotMatch
