pmid,pmcid,title,journal,insert_time,has_targz,disease
25863992,PMC4430176,"Giant fibrokeratoma, a rare soft tissue tumor presenting like an accessory digit, a case report and review of literature.",Int J Surg Case Rep,2023-12-17-22-02-53,True,NotMatch
32728848,PMC7477026,Cellular Digital Fibroma: A Comprehensive Review of a CD34-Positive Acral Lesion of the Distal Fingers and Toes.,Dermatol Ther (Heidelb),2023-12-17-22-02-53,True,NotMatch
33209011,PMC7646431,Acquired Periungual Fibrokeratoma Looks like a Supernumerary Digit: An Uncommon Soft Tissue Tumor.,J Cutan Aesthet Surg,2023-12-17-22-02-53,True,NotMatch
34084022,PMC8149993,Horn on the Nail: Acquired Ungual Fibrokeratoma.,J Cutan Aesthet Surg,2023-12-17-22-02-53,True,NotMatch
36386073,PMC9644781,Acquired Fibrokeratoma: A Retrospective Study in a Tertiary Centre in South India.,Indian J Dermatol,2023-12-17-22-02-53,True,NotMatch
38034253,PMC10686781,Acquired Digital Fibrokeratoma.,Cureus,2023-12-17-22-02-53,False,Match
