pmcid,label,caption,graphic,disease,modality
PMC4802406,Fig. 4,"Expressions of MTB/GF genes and the effect of ENO1 transformation on ACLY in considering ENO1 as a candidate for MTB/GF transformations. (a) Comparisons of MTB/GF gene expressions, including ENO1, prior to transformations in 22 glioblastomas (GBs). Normal brain RNA was from pooled non-malignant brain tissue. Each gene's fold change was obtained with the ddCt method described in Section 2.3. Means with 95% confidence intervals are shown for each gene. (b) Effects of ENO1 when used to transform a metabolic gene's expression data. On the left, the distribution of GBs, each identified with a 2-digit number, is displayed according to ACLY's expression in each as a fold-change compared to normal brain's ACLY RNA. The distribution shown on the right is according to each tumor's expression of ACLY following transformation (division by concurrent ENO1 expression).",gr4,NotMatch,NotMatch
PMC4802406,Fig. 5,"Distributions of glioblastomas according their expressions of each metabolic gene following mathematical transformation by ENO1. This was described for ACLY (Fig. 4b). Each tumor is identified by a 2-digit number. The highest transformed values occurred for CA3, CA12, and SCL16A3 (or MCT4).",gr5,NotMatch,NotMatch
PMC4802406,Fig. 6,"Patterns of functional relevance in the correlations between metabolic genes and oncogenes. (a) A pattern attributed to genes whose expressions protect glycolysis in acidic conditions, possibly to supra-physiologic limits. Positive correlations of the ENO1 transformed expressions of metabolic genes (CA3, CA12, LDHA, LDHC, and SLC16A3(or MCT4)) occurred with CN of oncogenes (EGFR, MOS, RNF139, MYC, PIK3C2B, CYP27B1, and CDK4). Those supported by significant associations (Wilcoxon Rank Sum, Section 3.6) are indicated by solid red arrows and trends by black striped arrows. Complexity within a potential 8q amplicon is indicated by strong correlation (r = 0.98) between MOS and MYC but weaker correlations between each of them and intervening RNF139. (b) A pattern attributed to non-aerobic glycolysis operating in intermittent avascular conditions based on previous studies of glycolytic-dependent glioblastoma cell migration [9], [11], involving ENO1 transformed expressions of metabolic genes, ACLY, GYS1, LDHA, and LDHA, was identified by shared positive correlations with CN of oncogenes, EGFR, CCND1, CTTN, FGF3, FGF4, and CCND2. (c) The CN gain of XIAP revealed an opposing pattern for metabolic genes' expressions. The significant association (Wilcoxon Rank Sum, Section 3.6) and a trend are indicated by the solid red and striped black arrows, respectively.",gr6,NotMatch,NotMatch
PMC4802406,Fig. 7,"Expressions of carbonic anhydrase genes, CA3 and CA12, transformed by ENO1, associated significantly in Wilcoxon Rank Sum analyses with CN changes and gender in glioblastomas. (a) Transformed CA12 expression associated significantly with CN gains of RNF139 that were 2.00-fold or greater, lack of a 2.00-fold or greater CN gain in XIAP, and with male gender. (b) Transformed CA3 expression associated significantly with CN gains of EGFR that were 2.00-fold or greater. The red and blue dashed lines among the data points indicate the medians for each data group as indicated.",gr7,NotMatch,NotMatch
PMC4802406,Fig. 8,"Roles for amplified oncogenes, EGFR, RNF139, and XIAP, to control pH via access to the systemic bicarbonate buffer system in aiding glioblastoma cells. Red cells and plasma in the blood stream (upper panels) remove carbons via CO2 that is exhaled in the lungs. Transport of CO2/HCO3− occurs in a relay fashion within the circulation. Large amounts of bicarbonate in the bloodstream buffer protons and levels are maintained via recycling in the kidneys where the protons carried by bicarbonate are expelled. Amplified EGFR and RNF139 may enhance expression of CA3 and CA12, respectively, to increase encoded tumor carbonic anhydrases (lower panel). In contrast, XIAP may reduce expression of CA12. Lactic acid membrane transporter, MCT4, is encoded by SLC16A3. The edge of a tumor cell is in the lowest panel. Red cells are depicted with reactions derived from other diagrams [78], [79], [80]. H+ ions (protons) from ATP breakdown during anaerobic metabolism involving lactic acid is a process explained elsewhere [81].",gr8,NotMatch,NotMatch
PMC4828789,Fig 1,"Representative images of a malignant peripheral nerve sheath tumor mimicking a poorly differentiated synovial sarcoma. a: The tumor consisted of solid proliferations of uniform, round tumor cells with round to oval nuclei. b: Tumor cells were focally positive for S-100 protein on IHC. c: Tumor cells were sparsely positive for cytokeratin AE1/AE3 on IHC, d: FISH revealed no SS18 split signals",13000_2016_486_Fig1_HTML,Match,NotMatch
PMC4828789,Fig 2,Representative images of sarcomatoid carcinoma after synovial sarcoma was excluded. a: The tumor had a pseudoglandular structure and a sheet-like proliferation of cuboidal tumor cells. b: Tumor cells were positive for cytokeratin AE1/AE3 on IHC. c: Tumor cells were negative for bcl-2 on IHC. Infiltrating lymphocytes alone were bcl-2 positive. d: FISH analysis revealed no SS18 split signals. Nuclei showed more than two pairs of orange and green signals with a polyploidy pattern (arrows),13000_2016_486_Fig2_HTML,NotMatch,NotMatch
PMC4828789,Fig 3,Representative images of poorly differentiated synovial sarcoma without cytokeratin expression. a: The tumor consisted of solid and fascicular proliferations of round to short-spindle tumor cells with round to oval nuclei. b: Tumor cells were negative for cytokeratin AE1/AE3 on IHC. c: Tumor cells were negative for EMA on IHC. d: FISH analysis revealed a pair of split and fused orange and green signals showing a SS18 split pattern (arrows),13000_2016_486_Fig3_HTML,NotMatch,NotMatch
PMC4845480,Fig. 1,Noncontrast CT detected a high attenuation mass (16 × 11 mm) in the left choroid plexus (a) that showed enhancement after contrast administration (b),12891_2016_1050_Fig1_HTML,NotMatch,NotMatch
PMC4845480,Fig. 2,FDG PET/CT sagittal image (a) revealed two focal regions of increased uptake in the eye (white arrow) and posterior neck (black arrow). Axial image (b) showed increased FDG uptake in the eye (white arrow) and the choroid plexus of the left eye (SUVmax = 3.8 g/ml). Axial image (c) of the first cervical (C1) spine showed increased uptake (black arrow) adjacent to the C2 lamina (SUVmax = 9.9 g/ml),12891_2016_1050_Fig2_HTML,NotMatch,NotMatch
PMC4845480,Fig. 3,"Axial MRI of a soft tissue mass (14.6 × 7.7 × 7 mm) adjacent to the C1 lamina showed isointensity on a T1WI (white arrow) (a), low intensity on a T2WI (black arrow) (b), and enhanced gadolinium uptake (gray arrow) (c) ",12891_2016_1050_Fig3_HTML,NotMatch,NotMatch
PMC4845480,Fig. 4,"Biopsy specimen showed small mononuclear stromal cells with stromal fibrosis, including formation of a hyalinized collagen matrix and a small area of multinucleated osteoclast-like giant cells (hematoxylin and eosin staining; scale bar, 100 μm) (a). Immunohistochemical analysis showed strong staining for CD68 (b)",12891_2016_1050_Fig4_HTML,NotMatch,NotMatch
PMC4845480,Fig. 5,Axial FDG PET/CT image (a) showed that the FDG uptake (white arrow) in the mediastinal mass was mild or low-level (a) and high uptake (black arrow) in the extra-articular soft tissue mass of the left hip (SUVmax = 12.8 g/ml) (b),12891_2016_1050_Fig5_HTML,NotMatch,NotMatch
PMC4845480,Fig. 6,"Axial MRI showed a soft tissue mass adjacent to the anterior inferior iliac spine, which was isointense on T1WI (white arrow) (a) and T2WI (black arrow) (b). Coronal images showed isointensity in T1WI (white arrow) (c) and T2WI with fat saturation image (black arrow) (d)",12891_2016_1050_Fig6_HTML,NotMatch,NotMatch
PMC4845480,Fig. 7,"Excised tumor specimen showed small mononuclear stromal cells and multinucleated osteoclast-like giant cells (hematoxylin and eosin stain; scale bar, 100 μm)",12891_2016_1050_Fig7_HTML,NotMatch,NotMatch
PMC4860914,Figure 1,(a and b) Extraoral examination of left mandibular swelling that was firm to hard diffuse soft tissue swelling extending anteroposteriorly from midline to the left angle of the mandible and inferiorly extended 2 cm below the inferior border of the mandible. (c) Intraoral view showing the unilateral (left) involvement of the lesion,JOMFP-20-129-g001,NotMatch,NotMatch
PMC4860914,Figure 2,"(a) Cone beam computed tomography reconstructed panoramic image showing diffuse radiolucency in the left body of mandible extending superiorly to the alveolar crest and inferiorly to lower border; anteriorly to apex of 33 and posteriorly till the region of 36. (b) Cone beam computed tomography coronal section showing radiolucent lesion in the left body of mandible extending through buccal and lingual cortex, minimal mucosal thickening of the right and left maxillary sinus floor is seen. (c) Cone beam computed tomography sagittal section revealed radiolucency extending from 33 to 38 with erosion of the mandibular nerve canal. (d) Cone beam computed tomography axial section showing asymmetry on left side with loss of buccal and lingual cortical plates and no evidence of expansion of the cortical plates",JOMFP-20-129-g002,NotMatch,NotMatch
PMC4860914,Figure 3,"(a) Gross surgical specimen showing the erosion and perforation of the buccal and lingual cortical plates. Cut surface of the tumor showing lingual invasion below the inferior border of mandible. (b): Photomicrograph showing presence of mixture of spindle- and round-shaped cells arranged in fascicles separated from normal epithelium by grenz zone (H&E stain, ×40). (c) Photomicrograph showing tumor cells infiltrating the bone (H&E stain ×40). (d): Photomicrograph showing round to spindle shaped tumor cells with hyperchromatic nuclei (H&E stain, ×400)",JOMFP-20-129-g003,NotMatch,Match
PMC4860914,Figure 4,"Round- and spindle-shaped tumor cells showing negativity for (a) desmin (IHC stain, ×400); (b) smooth muscle actin (internal positive control; vessel wall) (IHC stain, ×400); (c) S-100 (internal positive control; nerve) (IHC stain, ×400), (d) CD1a (IHC stain, ×400). The cells were positive for (e); leukocyte common antigen (lymphoid lineage marker) (IHC stain, ×200); and (f) CD20 (B-cell marker) (IHC stain, ×200)",JOMFP-20-129-g004,NotMatch,NotMatch
PMC4878936,Fig. 1,Initial presentation. Frontal radiograph demonstrates large soft-tissue density mass superior to the trapezius without appreciable calcification or tumor matrix.,gr1,NotMatch,NotMatch
PMC4878936,Fig. 2,Initial presentation. (A) Coronal short-tau inversion recovery (STIR) MRI demonstrates a large hyperintense ovoid mass superior to the trapezius. (B) Axial T1-weighted MRI demonstrates a large hypointense ovoid mass superficial to the trapezius. (C) Axial T2-weighted fat-suppressed MRI demonstrates a large hyperintense ovoid mass superficial to the trapezius. (D) Axial T1-weighted fat-suppressed post-intravenous gadolinium-based contrast MRI demonstrates a large ovoid mass with homogeneous internal enhancement.,gr2,NotMatch,NotMatch
PMC4878936,Fig. 3,"Second presentation, 3 years later. (A) Clinical photograph shows large mass involving the superior shoulder with overlying attenuated skin. (B) Clinical photograph shows large mass involving the superior shoulder with overlying attenuated skin.",gr3,NotMatch,NotMatch
PMC4878936,Fig. 4,"Second presentation, 3 years later. (A) Coronal short-tau inversion recovery (STIR) MRI demonstrates significant interval size increase of a heterogeneously hyperintense shoulder mass (vascular flow voids denoted by arrows). (B) Axial T1-weighted MRI demonstrates significant interval size increase of a hypointense shoulder mass. (C) Axial T2-weighted fat-suppressed MRI demonstrates significant interval size increase of a heterogeneously hyperintense shoulder mass. (D) Axial T1-weighted fat-suppressed post-intravenous gadolinium-based contrast MRI demonstrates heterogeneous enhancement of a right shoulder mass.",gr4,NotMatch,NotMatch
PMC4878936,Fig. 5,"Second presentation, 3 years later. Intravenous iodinated contrast-enhanced CT coronal soft-tissue window shows no soft-tissue calcification or tumor matrix within the mass.",gr5,NotMatch,NotMatch
PMC4878936,Fig. 6,"Second presentation, 3 years later. (A) Photomicrograph at 10× magnification with hematoxylin and eosin stain shows pleomorphic spindle cells arranged in a vague storiform pattern. (B) Photomicrograph at 60× magnification with hematoxylin and eosin stain demonstrates rare mitoses.",gr6,NotMatch,NotMatch
PMC4878936,Fig. 7,Intraoperative imaging. (A) Large mass involving the superior right shoulder with overlying attenuated skin acquired just before surgical resection. (B) Large MPNST weighing 4.5 kg. (C) Large defect at the right shoulder after resection of a massive malignant peripheral nerve sheath tumor. The defect was subsequently closed with a pedicled latissimus dorsi flap and split-thickness skin graft.,gr7,Match,NotMatch
PMC4862189,Fig. 1,"MPNST in a 65-year-old female. Plain CT scan (A1) shows a slightly hyper-attenuated lesion in the left cheek with slight zygomatic arch erosion. On MR scan, the tumor demonstrates hypo-intensity on axial T1-weighted (A2) and heterogeneous hyper-intensity on axial T2-weighted (A3) images. Gadolinium-enhanced T1-weighted images (A4) reveal peripheral enhancement. Note the central hyper-attenuated foci on plain CT and mixed-intense signal on T2WI, which is likely to be hemorrhage. Hemorrhagic cyst was conformed in surgery",12957_2016_899_Fig1_HTML,NotMatch,NotMatch
PMC4862189,Fig. 2,"MPNST with NF-1 in a 49-year-old male. A well-defined, ovoid mass lies in the subcutaneous tissue, which demonstrates hypo-intensity on axial T1-weighted (B1) and obvious heterogeneous hyper-intensity on T2-weighted (B2) images. Perilesional edema and intratumoral lobulation are noticeable on T2WI",12957_2016_899_Fig2_HTML,NotMatch,NotMatch
PMC4862189,Fig. 3,"MPNST with NF-1 in a 47-year-old female. A well-defined, ovoid mass is located in the right pelvis wall, which demonstrates hypo-intensity on axial T1-weighted (C1) and obvious heterogeneous hyper-intensity on T2-weighted (C2) images. On enhanced T1 images (C3), there is strong enhancement in parts of the tumor with hypo-intense T2 signal, while moderate or slight enhancement in other parts. Note multiple subcutaneous neurofibromas. Hematoxylin-eosin staining result (100 times) (C4) shows prominence in nuclear mitosis activities and atypia",12957_2016_899_Fig3_HTML,NotMatch,NotMatch
PMC4862189,Fig. 4,"(D1) A huge, well-margined retroperitoneal MPNST is shown on enhanced CT scan, with feeding vessels inside. (D2) On the lower level, a hypo-attenuated foci can be observed, which was turned out to be a myxoid cyst",12957_2016_899_Fig4_HTML,NotMatch,NotMatch
PMC4908608,Fig. 1,(A) Intraoperative image of case 4. The tumor originated from the vagus nerve. (B) Intraoperative image of case 4. The tumor could be smoothly detached from the aorta.,gr1,NotMatch,NotMatch
PMC4898101,Figure 1,"(a-c) Microphotograph of diffuse neurofibroma, note the infiltration of tumor to dermis and subcutaneous tissue. (H and E, ×40), (d) diffuse neurofibroma showing myxoid change (H and E, ×40), (e) diffuse neurofibroma with prominent lymphoid aggregates (arrowhead) (H and E, ×40), (f) microphotograph of localized neurofibroma, note the well delineated tumor (H and E, ×40), (g) localised neurofibroma with extensive myxoid change (H and E, ×40), (h) LNF with areas of calcification (H and E, ×40), (i) plexiform neurofibroma showing tortuous and expanded nerve bundles (H and E, ×40)",JNRP-7-346-g003,NotMatch,NotMatch
PMC4898101,Figure 2,"(a) Microphotograph of conventional schwannoma showing hypercellular, Antoni A areas (black arrowhead) and hypocellular Antoni B areas (red arrowhead). (b) Schwannoma with extensive hyalinized areas. (c-f) Microphotograph of “ancient” schwannoma showing degenerative nuclear atypia (black arrowhead), hyalinized areas (red arrowhead), cystic change (blue arrow head), areas of hemorrhage (*) and myxoid change (+) (H and E, ×40). (g) whole mount section of plexiform schwannoma note the subcutaneous multiple nodules (H and E, ×4), (h and i) higher magnification of the same showing hypocellular and hypercellular areas with verocay body (black arrow)",JNRP-7-346-g005,NotMatch,NotMatch
PMC4898101,Figure 3,"(a) Microphotograph of granular cell tumor showing tumor cells arranged in interlacing pattern with benign nuclei and granular cytoplasm (H and E, ×10). (b and c) Higher magnification of granular cell tumor (H and E, ×40). (d) periodic acid–Schiff stain showing the periodic acid–Schiff positivity of cytoplasm of tumor cells (black arrow) (periodic acid–Schiff, ×40). (e) Tumor cells showing intense cytoplasmic and nuclear positivity for S-100 (immunohistochemistry, S-100, ×40) (f) tumor cells showing cytoplasmic positivity for vimentin (immunohistochemistry vimentin, ×40)",JNRP-7-346-g006,NotMatch,Match
PMC4898101,Figure 4,"(a) Microphotograph of malignant peripheral nerve sheath tumors showing malignant tumor cells with hyperchromatic, pleomorphic nuclei with eosinophilic to clear cytoplasm (H and E, ×40) (b) tumor cells showing diffuse cytoplasmic and nuclear positivity for S-100 (immunohistochemistry S-100, ×40). (c) Tumor cells showing cytoplasmic positivity for vimentin (immunohistochemistry vimentin, ×40). (d) Tumor cells showing nuclear positivity for ki 67 indicating proliferative activity (black arrowhead) (immunohistochemistry ki 67, ×40)",JNRP-7-346-g007,Match,NotMatch
PMC4898101,Figure 5,(a) Gross photograph of localized neurofibroma showing fusiform growth with myxoid and cystic areas. (b) Gross photograph of plexiform neurofibroma with thickened skin and gray-white tumor (Bag of worms),JNRP-7-346-g008,NotMatch,NotMatch
PMC4944641,Figure 1,Computed tomography scan abdomen and pelvis demonstrating 3.6 cm uniformly enhancing mass in the left kidney,UA-8-387-g001,NotMatch,NotMatch
PMC4944641,Figure 2,Immunohistochemistry showing kidney tumor cells positive for S-100 protein,UA-8-387-g002,NotMatch,NotMatch
PMC4944641,Figure 3,Mammogram showing circumscribed appearing 2.7 cm mass in inner central portion of the right breast,UA-8-387-g003,NotMatch,NotMatch
PMC4944641,Figure 4,"Breast tissue reveals spindle cell morphology with mitosis, high magnification",UA-8-387-g004,NotMatch,NotMatch
PMC4936498,Fig. 1,Magnetic resonance imaging coronal view (panel A) and sagittal view (panel B) showing clearly the lesion with some calcification.,gr1,NotMatch,NotMatch
PMC4936498,Fig. 2,An operative view showing the lesion as it was dissected from the surrounding structure (Panel A). Panel B showing the excised mass which looked well encapsulated with a smooth surface.,gr2,NotMatch,NotMatch
PMC4936498,Fig. 3,"Micrograph of the resected lesion showing an area of the tumor featuring spindle cells within loose stroma with associated nuclear atypia and scattered mitotic figures (panel A; H&E stain. ×200). The microscopic field in panel B shows the presence of bony trabeculae surrounded by large malignant hyperchromatic, multinucleated bizarre cells (H&E stain ×200). Panel C shows the tumor acquiring a pleomorphic undifferentiated (malignant fibrous histiocytoma-like) pattern (H&E stain ×200). Panel D shows an area with chondrosarcomatous differentiation (H&E stain ×200).",gr3,NotMatch,Match
PMC4936498,Fig. 4,The metastatic lesion in the right lung as it appeared on CT scan (left panel) and PET scan (right panel) with an avid uptake (SUVmax 6.8).,gr4,NotMatch,NotMatch
PMC5325443,Figure 1,"PD-L1 Expression1-5 cores from different blocks were stained for PD-L1, PD-1 and CD8+ and scored based on intensity of staining on a scale of 0-3 and percent of cells staining positively. Significance of staining differences between groups was compared via chi squared analysis and survival analysis was performed using a Cox proportional hazards model. PD-L1 staining of at least 1% was seen in 0/20 nerves, 2/68 benign lesions and 9/53 malignant lesions. PD-L1 staining of at least 5% was seen in 0/20 nerves, 2/68 benign lesions and 7/53 malignant lesions. PD-L1 was statistically more prevalent in MPNST than both nerves and benign lesions (p=0.049 and p=0.008, respectively) at the 1% level, but only benign lesions at the 5% level (p=0.033).",oncotarget-07-64300-g001,NotMatch,NotMatch
PMC5325443,Figure 2,"CD8+ infiltrateCD8+ of at least 1% was seen in 6/20 (30.0%) nerves, 45/68 (66.2%) benign lesions and 30/53 (56.6%) of MPNST. CD8+ of at least 5% was seen in 1/20 (5.0%) nerves, 14/68 (20.6%) benign lesions and 11/53 (20.7%) of MPNST. There was no difference between benign and malignant tumors at the 5% (p=0.282) or 1% (p=0.982) expression threshold.",oncotarget-07-64300-g002,NotMatch,NotMatch
PMC5325443,Figure 3,"Representative immunohistochemical stainings of PD-L1, PD-1, and CD8+ for nerve, benign peripheral nerve sheath tumors, and malignant peripheral nerve sheath tumors",oncotarget-07-64300-g003,Match,NotMatch
PMC4898298,Figure 1,"27-year-old man with MPNST. Supine radiograph of the abdomen reveals mild height loss of the L2 lumbar vertebral body, with indistinctness of the right lateral border, and nonvisualization of the right pedicle (arrow). These signs indicate a destructive lumbar spinal mass.",gr1,NotMatch,NotMatch
PMC4898298,Figure 2A-B,"27-year-old man with MPNST. Sagittal (A) and axial (B) CT images of the lumbar spine using bone reconstruction algorithm demonstrate a destructive lesion at L2 that involves most of the anterior vertebral body, both pedicles, and the right lamina. Adjacent disc spaces are normal.",gr2,NotMatch,NotMatch
PMC4898298,Figure 2C,"27-year-old man with MPNST. (C) Axial contrast-enhanced CT image through L2 with soft-tissue reconstruction algorithm shows an expansile soft-tissue mass invading the anterior vertebral body and protruding posteriorly into the central canal, causing moderate central stenosis. There is loss of the normal fat plane between the spine and the right psoas muscle (white arrows). The lesion is primarily isoattenuating to muscle, and contains a small hypoattenuating round focus with central high attenuation (target sign, arrow).",gr3,NotMatch,NotMatch
PMC4898298,Figure 3A-C,"27-year-old man with MPNST. Sagittal T1-weighted (A), T2-weighted (B), and T1-weighted gadolinium-enhanced (C) MR images of the lumbar spine demonstrate a soft-tissue mass involving most of the L2 vertebral body. The mass is hypointense on T1, hyperintense on T2, and enhances with gadolinium.",gr4,NotMatch,NotMatch
PMC4898298,Figure 3D-E,"27-year-old man with MPNST. Axial T2-weighted MR images through the mass (D, E) demonstrate soft tissue filling the right L1-L2 neural foramen, extending anteriorly to involve most of the L2 vertebral body and both pedicles, and protruding posteriorly to displace the thecal sac, with near-complete obliteration of the CSF space. Arrow in (E) indicates the “MRI target sign.―",gr5,NotMatch,NotMatch
PMC4898298,Figure 4A-B,"27-year-old man with MPNST. Representative runs from spinal angiogram. A, Right L1 injection shows a hypervascular mass centered at the right side of the L2 vertebral body. B, Right L1 postembolization injection shows occlusion of the arterial feeders at that level.",gr6,NotMatch,NotMatch
PMC4898298,Figure 4C-D,"27-year-old man with MPNST. Representative runs from spinal angiogram. C, Right L2 injection shows that the hypervascular mass has multiple segmental and collateral feeders. Coils have already been placed at the L1 level on the right and the left. D, Right L2 postembolization injection shows successful occlusion of numerous arterial feeders supplying the tumor.",gr7,NotMatch,NotMatch
PMC4898298,Figure 5,"27-year-old man with MPNST. Microscopic H & E-stained specimen shows neurofibromatous component of MPNST. There are interlacing wavy bands of collagen, associated with spindled cells with wavy nuclei and no significant pleomorphism.",gr8,NotMatch,Match
PMC4898298,Figure 6,"27-year-old man with MPNST. Microscopic H & E-stained specimens of MPNST at medium (A, B), high (C), and low (D) power show a hypercellular spindle-cell lesion with cells variably arranged in a herringbone and fascicular pattern. There is severe cytologic atypia and nuclear pleomorphism, with focally brisk mitotic activity. No necrosis is present.",gr9,NotMatch,Match
PMC4898298,Figure 7A-B,27-year-old man with MPNST. Immunohistochemical examinations show diffuse positive immunostaining for p75 (A) and no significant immunostaining for C-kit (B).,gr10,NotMatch,NotMatch
PMC4898298,Figure 7C,27-year-old man with MPNST. There are several foci of malignant osteoid on Gomori trichrome staining (C).,gr11,NotMatch,NotMatch
PMC5341949,Figure 1,"NY-ESO-1 immunohistochemical staining pattern and intensity in liposarcomas and MPNSTPrimary myxoid/round cell liposarcoma, H&E (A) and diffuse (> 75% of cells staining) 3+ IHC positivity (B). Dedifferentiated liposarcoma, H&E (C) and 3+ IHC positivity in > 25% of cells (D). MPNST, H&E (E) and diffuse 3+ IHC positivity (F). Metastatic mxyoid/round cell liposarcoma, H&E (G) and diffuse 3+ IHC positivity (H). (200× magnification).",oncotarget-07-72860-g001,NotMatch,Match
PMC5121163,Fig. 1,"Preoperative brain MRI showing a hyperintense neoplastic lesion on T2 sequence at left cerebellopontine cistern (A) with extension to C4-C5 level through jugular foramen (B and C), it enhances at gadolinium administration (D–F) and shows a low signal intensity in the center (E and F).",gr1,NotMatch,NotMatch
