pmid,pmcid,title,journal,insert_time,has_targz
21139926,PMC2994462,Congenital infantile digital fibromatosis: a case report and review of the literature.,Rare Tumors,2024-02-14-09-13-19,True
23716832,PMC3657242,Infantile digital fibromatosis (inclusion body fibromatosis) observed in a baby without finger involvement.,Indian J Dermatol,2024-02-14-09-13-19,True
27057032,PMC4817457,Infantile Digital Fibromatosis: A Rare Case Report.,Indian J Dermatol,2024-02-14-09-13-19,True
29780440,PMC5950536,An Algorithmic Approach to the Management of Infantile Digital Fibromatosis: Review of Literature and a Case Report.,Eplasty,2024-02-14-09-13-19,True
34394250,PMC8351811,Congenital infantile digital fibromatosis: a case report and review of the literature.,Afr Health Sci,2024-02-14-09-13-19,True
37699283,PMC10498175,Borderline phyllodes tumour of the breast with eosinophilic inclusion bodies: Case report and molecular sequencing.,Int J Surg Case Rep,2024-02-14-09-13-19,True
