pmid,pmcid,title,journal,insert_time,has_targz
23716835,PMC3657245,Glomeruloid hemangioma in normal individuals.,Indian J Dermatol,2023-12-17-22-16-05,True
28392663,PMC5383761,Glomeruloid Hemangioma as a Marker for the Early Diagnosis of POEMS Syndrome.,Ann Dermatol,2023-12-17-22-16-05,True
35110490,PMC9449619,Glomeruloid Hemangioma in a Patient with TAFRO Syndrome.,Intern Med,2023-12-17-22-16-05,True
35145824,PMC8803383,A Case of Oral Glomeruloid Hemangioma Without Systemic Conditions.,Cureus,2023-12-17-22-16-05,True
35228431,PMC9593160,TAFRO Syndrome That Responded to Prednisolone-only Treatment: Evaluating Changes in IL-6.,Intern Med,2023-12-17-22-16-05,True
