pmid,pmcid,title,journal,insert_time
37942120,PMC10627979,Endoscopic En-Bloc Resection of Neurilemmoma of the Foot Dorsum.,Arthrosc Tech,2023-12-17-22-14-39
38015617,PMC9167573,A Rare Case Report on Neurilemmoma of the Superficial Peroneal Nerve and a Review of the Literature.,Cureus,2023-12-17-22-14-39
38021869,PMC10659235,Neurilemmoma of Tongue in A Young Female: A Case Report.,Cureus,2023-12-17-22-14-39
38033968,PMC10683895,An intriguing case report of follicular lymphoid hyperplasia of tongue with the detailed review of literature.,J Oral Maxillofac Pathol,2023-12-17-22-14-39
38046923,PMC10692475,A rare case of a median nerve schwannoma: Case report.,Radiol Case Rep,2023-12-17-22-14-39
38098556,PMC10718353,Successful management of a giant retroperitoneal ancient schwannoma mimicking malignant tumors: A case report and literature review.,Ann Med Surg (Lond),2023-12-17-22-14-39
8843014,PMC3054045,Jugular foramen neurilemmoma mimicking an intra-axial brainstem tumor--a case report.,J Korean Med Sci,2023-12-17-22-14-39
9197537,PMC5921428,Radioimmunodetection with 111In-labeled monoclonal antibody Nd2 in patients with pancreatic cancer.,Jpn J Cancer Res,2023-12-17-22-14-39
